{
  "meta": {
    "id": "tvmaze:1388",
    "type": "series",
    "name": "Jimmy Kimmel Live",
    "description": "Jimmy Kimmel Live features a diverse lineup of guests that include celebrities, athletes, musical acts, comedians and human-interest subjects, along with comedy bits and a house band.",
    "poster": "https://static.tvmaze.com/uploads/images/original_untouched/565/1413031.jpg",
    "background": "https://static.tvmaze.com/uploads/images/original_untouched/565/1413031.jpg",
    "videos": [
      {
        "id": "tvmaze:3461070",
        "title": "Jamie Lee Curtis, Rachel Sennott, The Pretty Reckless",
        "season": 2025,
        "episode": 152,
        "released": "2025-12-11",
        "overview": "1. Jamie Lee Curtis (\"Ella McCay\"). 2. Rachel Sennott (\"I Love LA\"). 3. Musical Guest The Pretty Reckless."
      },
      {
        "id": "tvmaze:120770",
        "title": "Premiere Episode",
        "season": 2003,
        "episode": 1,
        "released": "2003-01-26",
        "overview": ""
      },
      {
        "id": "tvmaze:120771",
        "title": "Dwayne \"The Rock\" Johnson, Al Michaels, & 50 Cent",
        "season": 2003,
        "episode": 2,
        "released": "2003-01-27",
        "overview": ""
      },
      {
        "id": "tvmaze:120772",
        "title": "Robin Alexis",
        "season": 2003,
        "episode": 3,
        "released": "2003-01-28",
        "overview": ""
      },
      {
        "id": "tvmaze:120773",
        "title": "Adam Carolla & Shirley Corriher",
        "season": 2003,
        "episode": 4,
        "released": "2003-01-29",
        "overview": ""
      },
      {
        "id": "tvmaze:120774",
        "title": "Seth Green, LeAnn Rimes, & Gerhard Reinke",
        "season": 2003,
        "episode": 5,
        "released": "2003-01-30",
        "overview": ""
      },
      {
        "id": "tvmaze:120775",
        "title": "David Alan Grier",
        "season": 2003,
        "episode": 6,
        "released": "2003-01-31",
        "overview": ""
      },
      {
        "id": "tvmaze:120776",
        "title": "Jerry O'Connell, Brian Posehn, Scott Aukerman, Unwritten Law, & Bob Einstein",
        "season": 2003,
        "episode": 7,
        "released": "2003-02-03",
        "overview": ""
      },
      {
        "id": "tvmaze:120777",
        "title": "Corey Feldman, Simple Plan, Jeffrey Ross, & David Desrosiers",
        "season": 2003,
        "episode": 8,
        "released": "2003-02-04",
        "overview": ""
      },
      {
        "id": "tvmaze:120778",
        "title": "Ben Stein, Eric Roberts, Jurassic 5, & Gerhard Reinke",
        "season": 2003,
        "episode": 9,
        "released": "2003-02-05",
        "overview": ""
      },
      {
        "id": "tvmaze:120779",
        "title": "Estella Warren & Zach Galifianakis",
        "season": 2003,
        "episode": 10,
        "released": "2003-02-06",
        "overview": ""
      },
      {
        "id": "tvmaze:120780",
        "title": "Master P, Lil' Romeo, & Bonnie Hunt",
        "season": 2003,
        "episode": 11,
        "released": "2003-02-07",
        "overview": ""
      },
      {
        "id": "tvmaze:120781",
        "title": "Tonic",
        "season": 2003,
        "episode": 12,
        "released": "2003-02-10",
        "overview": ""
      },
      {
        "id": "tvmaze:120782",
        "title": "Hugh Hefner, Lucy Lawless, & The D-4",
        "season": 2003,
        "episode": 13,
        "released": "2003-02-11",
        "overview": ""
      },
      {
        "id": "tvmaze:120783",
        "title": "Jolene Blalock, Patton Oswalt, & Talib Kweli",
        "season": 2003,
        "episode": 14,
        "released": "2003-02-12",
        "overview": ""
      },
      {
        "id": "tvmaze:120784",
        "title": "Heather Graham & Christopher Lowell",
        "season": 2003,
        "episode": 15,
        "released": "2003-02-13",
        "overview": ""
      },
      {
        "id": "tvmaze:120785",
        "title": "Adrienne Barbeau, Erick Sermon, & Dr. Drew Pinsky",
        "season": 2003,
        "episode": 16,
        "released": "2003-02-14",
        "overview": ""
      },
      {
        "id": "tvmaze:120786",
        "title": "Famke Janssen, Colin Quinn, & Guttermouth",
        "season": 2003,
        "episode": 17,
        "released": "2003-02-17",
        "overview": ""
      },
      {
        "id": "tvmaze:120787",
        "title": "Jamie Kennedy, Howard Kremer, & Field Mob",
        "season": 2003,
        "episode": 18,
        "released": "2003-02-18",
        "overview": ""
      },
      {
        "id": "tvmaze:120788",
        "title": "Laura Linney, David Cross, Bob Odenkirk, & Chevelle",
        "season": 2003,
        "episode": 19,
        "released": "2003-02-19",
        "overview": ""
      },
      {
        "id": "tvmaze:120789",
        "title": "Trista Rehn, Ryan Sutter, Emmanuel Lewis, Bill Walton, & Quentin Richardson",
        "season": 2003,
        "episode": 20,
        "released": "2003-02-20",
        "overview": ""
      },
      {
        "id": "tvmaze:120790",
        "title": "Jennifer Garner, Rich Eisen, & Martina Sementelli",
        "season": 2003,
        "episode": 21,
        "released": "2003-02-21",
        "overview": ""
      },
      {
        "id": "tvmaze:120791",
        "title": "Lauren Graham & Har Mar Superstar",
        "season": 2003,
        "episode": 22,
        "released": "2003-02-24",
        "overview": ""
      },
      {
        "id": "tvmaze:120792",
        "title": "Nicole Eggert, Papa Roach, & Kevin Mitnick",
        "season": 2003,
        "episode": 23,
        "released": "2003-02-25",
        "overview": ""
      },
      {
        "id": "tvmaze:120793",
        "title": "Vince Vaughn, Robin Leach, Monica Bellucci, & T.A.T.U",
        "season": 2003,
        "episode": 24,
        "released": "2003-02-26",
        "overview": ""
      },
      {
        "id": "tvmaze:120794",
        "title": "Anna Nicole Smith, Lennox Lewis, & Todd Glass",
        "season": 2003,
        "episode": 25,
        "released": "2003-02-27",
        "overview": ""
      },
      {
        "id": "tvmaze:120795",
        "title": "Evan Marriott & Steve-O",
        "season": 2003,
        "episode": 26,
        "released": "2003-02-28",
        "overview": ""
      },
      {
        "id": "tvmaze:120796",
        "title": "Jeff Goldblum, Molly Simms, & Fabolous",
        "season": 2003,
        "episode": 27,
        "released": "2003-03-03",
        "overview": ""
      },
      {
        "id": "tvmaze:120797",
        "title": "Gerhard Reinke, James Claire Lewis, Rachel Hunter, & Nappy Roots",
        "season": 2003,
        "episode": 28,
        "released": "2003-03-05",
        "overview": ""
      },
      {
        "id": "tvmaze:120798",
        "title": "Jared Fogel & Roseanne",
        "season": 2003,
        "episode": 29,
        "released": "2003-03-06",
        "overview": ""
      },
      {
        "id": "tvmaze:120799",
        "title": "Tom Arnold & Bowling for Soup",
        "season": 2003,
        "episode": 30,
        "released": "2003-03-07",
        "overview": ""
      },
      {
        "id": "tvmaze:120800",
        "title": "John Leguizamo, Suge Knight, Cook E. Jarr , Crooked Eye",
        "season": 2003,
        "episode": 31,
        "released": "2003-03-10",
        "overview": ""
      },
      {
        "id": "tvmaze:120801",
        "title": "Eugene Levy, Ralphie May, & Zebrahead",
        "season": 2003,
        "episode": 32,
        "released": "2003-03-11",
        "overview": ""
      },
      {
        "id": "tvmaze:120802",
        "title": "Matt Stone, Trey Parker, Lorenzo Lamas, Ralphie May, Smilez, & Southstar",
        "season": 2003,
        "episode": 33,
        "released": "2003-03-12",
        "overview": ""
      },
      {
        "id": "tvmaze:120803",
        "title": "Jay Mohr, Cris Judd, Happatai, & Chris Judd",
        "season": 2003,
        "episode": 34,
        "released": "2003-03-13",
        "overview": ""
      },
      {
        "id": "tvmaze:120804",
        "title": "Brooke Burke, R. Lee Ermey, & Gerhard Reinke",
        "season": 2003,
        "episode": 35,
        "released": "2003-03-14",
        "overview": ""
      },
      {
        "id": "tvmaze:120805",
        "title": "The Smothers Brothers, Flogging Molly, & Dave Capurro",
        "season": 2003,
        "episode": 36,
        "released": "2003-03-17",
        "overview": ""
      },
      {
        "id": "tvmaze:120806",
        "title": "Geri Halliwell, Kevin Nealon, Darrel Hammond, & Supergrass",
        "season": 2003,
        "episode": 37,
        "released": "2003-03-18",
        "overview": ""
      },
      {
        "id": "tvmaze:120807",
        "title": "Dave Foley, Scott Thompson, & Larry Pines",
        "season": 2003,
        "episode": 38,
        "released": "2003-03-24",
        "overview": ""
      },
      {
        "id": "tvmaze:120808",
        "title": "Ashton Kutcher, Steve Williams, Robert Evans, & Mr. Cheeks",
        "season": 2003,
        "episode": 39,
        "released": "2003-03-25",
        "overview": ""
      },
      {
        "id": "tvmaze:120809",
        "title": "Ashton Kutcher, Pat O'Brien, & Cypress Hill",
        "season": 2003,
        "episode": 40,
        "released": "2003-03-26",
        "overview": ""
      },
      {
        "id": "tvmaze:120810",
        "title": "Killer Mike & Big Boi",
        "season": 2003,
        "episode": 41,
        "released": "2003-03-27",
        "overview": ""
      },
      {
        "id": "tvmaze:120811",
        "title": "Thora Birch",
        "season": 2003,
        "episode": 42,
        "released": "2003-03-28",
        "overview": ""
      },
      {
        "id": "tvmaze:120812",
        "title": "Episode 43",
        "season": 2003,
        "episode": 43,
        "released": "2003-03-31",
        "overview": ""
      },
      {
        "id": "tvmaze:120813",
        "title": "Episode 44",
        "season": 2003,
        "episode": 44,
        "released": "2003-04-01",
        "overview": ""
      },
      {
        "id": "tvmaze:120814",
        "title": "Ben Stein & Cam'ron",
        "season": 2003,
        "episode": 45,
        "released": "2003-04-02",
        "overview": ""
      },
      {
        "id": "tvmaze:120815",
        "title": "Episode 46",
        "season": 2003,
        "episode": 46,
        "released": "2003-04-03",
        "overview": ""
      },
      {
        "id": "tvmaze:120816",
        "title": "Episode 47",
        "season": 2003,
        "episode": 47,
        "released": "2003-04-04",
        "overview": ""
      },
      {
        "id": "tvmaze:120817",
        "title": "10/3/03",
        "season": 2003,
        "episode": 48,
        "released": "2003-04-03",
        "overview": ""
      },
      {
        "id": "tvmaze:120818",
        "title": "10/6/03",
        "season": 2003,
        "episode": 49,
        "released": "2003-10-06",
        "overview": ""
      },
      {
        "id": "tvmaze:120819",
        "title": "10/7/03",
        "season": 2003,
        "episode": 50,
        "released": "2003-10-07",
        "overview": ""
      },
      {
        "id": "tvmaze:120820",
        "title": "10/8/03",
        "season": 2003,
        "episode": 51,
        "released": "2003-10-08",
        "overview": ""
      },
      {
        "id": "tvmaze:120821",
        "title": "10/9/03",
        "season": 2003,
        "episode": 52,
        "released": "2003-10-09",
        "overview": ""
      },
      {
        "id": "tvmaze:120822",
        "title": "10/10/03",
        "season": 2003,
        "episode": 53,
        "released": "2003-10-10",
        "overview": ""
      },
      {
        "id": "tvmaze:120823",
        "title": "10/13/03",
        "season": 2003,
        "episode": 54,
        "released": "2003-10-13",
        "overview": ""
      },
      {
        "id": "tvmaze:120824",
        "title": "10/14/03",
        "season": 2003,
        "episode": 55,
        "released": "2003-10-14",
        "overview": ""
      },
      {
        "id": "tvmaze:120825",
        "title": "10/15/03",
        "season": 2003,
        "episode": 56,
        "released": "2003-10-15",
        "overview": ""
      },
      {
        "id": "tvmaze:120826",
        "title": "10/16/03",
        "season": 2003,
        "episode": 57,
        "released": "2003-10-16",
        "overview": ""
      },
      {
        "id": "tvmaze:120827",
        "title": "10/17/03",
        "season": 2003,
        "episode": 58,
        "released": "2003-10-17",
        "overview": ""
      },
      {
        "id": "tvmaze:120898",
        "title": "May, 6 2003",
        "season": 2003,
        "episode": 59,
        "released": "2003-05-03",
        "overview": ""
      },
      {
        "id": "tvmaze:120951",
        "title": "Anna Faris, David Arquette",
        "season": 2003,
        "episode": 60,
        "released": "2003-10-22",
        "overview": ""
      },
      {
        "id": "tvmaze:120828",
        "title": "4/15/04",
        "season": 2004,
        "episode": 1,
        "released": "2004-04-15",
        "overview": ""
      },
      {
        "id": "tvmaze:120829",
        "title": "4/16/04",
        "season": 2004,
        "episode": 2,
        "released": "2004-04-16",
        "overview": ""
      },
      {
        "id": "tvmaze:120830",
        "title": "5/3/04",
        "season": 2004,
        "episode": 3,
        "released": "2004-05-03",
        "overview": ""
      },
      {
        "id": "tvmaze:120831",
        "title": "5/4/04",
        "season": 2004,
        "episode": 4,
        "released": "2004-05-04",
        "overview": ""
      },
      {
        "id": "tvmaze:120832",
        "title": "5/5/04",
        "season": 2004,
        "episode": 5,
        "released": "2004-05-05",
        "overview": ""
      },
      {
        "id": "tvmaze:120833",
        "title": "5/6/04",
        "season": 2004,
        "episode": 6,
        "released": "2004-05-06",
        "overview": ""
      },
      {
        "id": "tvmaze:120834",
        "title": "5/7/04",
        "season": 2004,
        "episode": 7,
        "released": "2004-05-07",
        "overview": ""
      },
      {
        "id": "tvmaze:120835",
        "title": "5/10/04",
        "season": 2004,
        "episode": 8,
        "released": "2004-05-10",
        "overview": ""
      },
      {
        "id": "tvmaze:120836",
        "title": "5/11/04",
        "season": 2004,
        "episode": 9,
        "released": "2004-05-11",
        "overview": ""
      },
      {
        "id": "tvmaze:120837",
        "title": "5/12/04",
        "season": 2004,
        "episode": 10,
        "released": "2004-05-12",
        "overview": ""
      },
      {
        "id": "tvmaze:120838",
        "title": "5/13/04",
        "season": 2004,
        "episode": 11,
        "released": "2004-05-13",
        "overview": ""
      },
      {
        "id": "tvmaze:120839",
        "title": "5/14/04",
        "season": 2004,
        "episode": 12,
        "released": "2004-05-14",
        "overview": ""
      },
      {
        "id": "tvmaze:120840",
        "title": "5/19/04",
        "season": 2004,
        "episode": 13,
        "released": "2004-05-19",
        "overview": ""
      },
      {
        "id": "tvmaze:120841",
        "title": "5/20/04",
        "season": 2004,
        "episode": 14,
        "released": "2004-05-20",
        "overview": ""
      },
      {
        "id": "tvmaze:120842",
        "title": "5/21/04",
        "season": 2004,
        "episode": 15,
        "released": "2004-05-21",
        "overview": ""
      },
      {
        "id": "tvmaze:120843",
        "title": "5/24/04",
        "season": 2004,
        "episode": 16,
        "released": "2004-05-24",
        "overview": ""
      },
      {
        "id": "tvmaze:120844",
        "title": "5/25/04",
        "season": 2004,
        "episode": 17,
        "released": "2004-05-25",
        "overview": ""
      },
      {
        "id": "tvmaze:120845",
        "title": "5/26/04",
        "season": 2004,
        "episode": 18,
        "released": "2004-05-26",
        "overview": ""
      },
      {
        "id": "tvmaze:120846",
        "title": "5/27/04",
        "season": 2004,
        "episode": 19,
        "released": "2004-05-27",
        "overview": ""
      },
      {
        "id": "tvmaze:120847",
        "title": "5/28/04",
        "season": 2004,
        "episode": 20,
        "released": "2004-05-28",
        "overview": ""
      },
      {
        "id": "tvmaze:120848",
        "title": "6/7/04",
        "season": 2004,
        "episode": 21,
        "released": "2004-06-07",
        "overview": ""
      },
      {
        "id": "tvmaze:120849",
        "title": "6/8/04",
        "season": 2004,
        "episode": 22,
        "released": "2004-06-08",
        "overview": ""
      },
      {
        "id": "tvmaze:120850",
        "title": "6/9/04",
        "season": 2004,
        "episode": 23,
        "released": "2004-06-09",
        "overview": ""
      },
      {
        "id": "tvmaze:120851",
        "title": "6/10/04",
        "season": 2004,
        "episode": 24,
        "released": "2004-06-10",
        "overview": ""
      },
      {
        "id": "tvmaze:120852",
        "title": "6/11/04",
        "season": 2004,
        "episode": 25,
        "released": "2004-06-11",
        "overview": ""
      },
      {
        "id": "tvmaze:120853",
        "title": "6/14/04",
        "season": 2004,
        "episode": 26,
        "released": "2004-06-14",
        "overview": ""
      },
      {
        "id": "tvmaze:120854",
        "title": "6/15/04",
        "season": 2004,
        "episode": 27,
        "released": "2004-06-15",
        "overview": ""
      },
      {
        "id": "tvmaze:120855",
        "title": "6/16/04",
        "season": 2004,
        "episode": 28,
        "released": "2004-06-16",
        "overview": ""
      },
      {
        "id": "tvmaze:120856",
        "title": "6/17/04",
        "season": 2004,
        "episode": 29,
        "released": "2004-06-17",
        "overview": ""
      },
      {
        "id": "tvmaze:120857",
        "title": "6/18/04",
        "season": 2004,
        "episode": 30,
        "released": "2004-06-18",
        "overview": ""
      },
      {
        "id": "tvmaze:120858",
        "title": "6/21/04",
        "season": 2004,
        "episode": 31,
        "released": "2004-06-21",
        "overview": ""
      },
      {
        "id": "tvmaze:120859",
        "title": "6/22/04",
        "season": 2004,
        "episode": 32,
        "released": "2004-06-22",
        "overview": ""
      },
      {
        "id": "tvmaze:120860",
        "title": "6/23/04",
        "season": 2004,
        "episode": 33,
        "released": "2004-06-23",
        "overview": ""
      },
      {
        "id": "tvmaze:120861",
        "title": "6/24/04",
        "season": 2004,
        "episode": 34,
        "released": "2004-06-24",
        "overview": ""
      },
      {
        "id": "tvmaze:120862",
        "title": "6/25/04",
        "season": 2004,
        "episode": 35,
        "released": "2004-06-25",
        "overview": ""
      },
      {
        "id": "tvmaze:120863",
        "title": "6/28/04",
        "season": 2004,
        "episode": 36,
        "released": "2004-06-28",
        "overview": ""
      },
      {
        "id": "tvmaze:120864",
        "title": "6/29/04",
        "season": 2004,
        "episode": 37,
        "released": "2004-06-29",
        "overview": ""
      },
      {
        "id": "tvmaze:120865",
        "title": "6/30/04",
        "season": 2004,
        "episode": 38,
        "released": "2004-06-30",
        "overview": ""
      },
      {
        "id": "tvmaze:120866",
        "title": "7/1/04",
        "season": 2004,
        "episode": 39,
        "released": "2004-07-01",
        "overview": ""
      },
      {
        "id": "tvmaze:120867",
        "title": "7/2/04",
        "season": 2004,
        "episode": 40,
        "released": "2004-07-02",
        "overview": ""
      },
      {
        "id": "tvmaze:120868",
        "title": "7/12/04",
        "season": 2004,
        "episode": 41,
        "released": "2004-07-12",
        "overview": ""
      },
      {
        "id": "tvmaze:120869",
        "title": "7/13/04",
        "season": 2004,
        "episode": 42,
        "released": "2004-07-13",
        "overview": ""
      },
      {
        "id": "tvmaze:120870",
        "title": "7/14/04",
        "season": 2004,
        "episode": 43,
        "released": "2004-07-14",
        "overview": ""
      },
      {
        "id": "tvmaze:120871",
        "title": "7/15/04",
        "season": 2004,
        "episode": 44,
        "released": "2004-07-15",
        "overview": ""
      },
      {
        "id": "tvmaze:120872",
        "title": "7/16/04",
        "season": 2004,
        "episode": 45,
        "released": "2004-07-16",
        "overview": ""
      },
      {
        "id": "tvmaze:120873",
        "title": "7/19/04",
        "season": 2004,
        "episode": 46,
        "released": "2004-07-19",
        "overview": ""
      },
      {
        "id": "tvmaze:120874",
        "title": "7/20/04",
        "season": 2004,
        "episode": 47,
        "released": "2004-07-20",
        "overview": ""
      },
      {
        "id": "tvmaze:120875",
        "title": "7/21/04",
        "season": 2004,
        "episode": 48,
        "released": "2004-07-21",
        "overview": ""
      },
      {
        "id": "tvmaze:120876",
        "title": "7/22/04",
        "season": 2004,
        "episode": 49,
        "released": "2004-07-22",
        "overview": ""
      },
      {
        "id": "tvmaze:120877",
        "title": "7/23/04",
        "season": 2004,
        "episode": 50,
        "released": "2004-07-23",
        "overview": ""
      },
      {
        "id": "tvmaze:120878",
        "title": "7/26/04",
        "season": 2004,
        "episode": 51,
        "released": "2004-07-26",
        "overview": ""
      },
      {
        "id": "tvmaze:120879",
        "title": "7/27/04",
        "season": 2004,
        "episode": 52,
        "released": "2004-07-27",
        "overview": ""
      },
      {
        "id": "tvmaze:120880",
        "title": "7/28/04",
        "season": 2004,
        "episode": 53,
        "released": "2004-07-28",
        "overview": ""
      },
      {
        "id": "tvmaze:120881",
        "title": "7/29/04",
        "season": 2004,
        "episode": 54,
        "released": "2004-07-29",
        "overview": ""
      },
      {
        "id": "tvmaze:120882",
        "title": "7/30/04",
        "season": 2004,
        "episode": 55,
        "released": "2004-07-30",
        "overview": ""
      },
      {
        "id": "tvmaze:120883",
        "title": "8/9/04",
        "season": 2004,
        "episode": 56,
        "released": "2004-08-09",
        "overview": ""
      },
      {
        "id": "tvmaze:120884",
        "title": "8/10/04",
        "season": 2004,
        "episode": 57,
        "released": "2004-08-10",
        "overview": ""
      },
      {
        "id": "tvmaze:120885",
        "title": "8/11/04",
        "season": 2004,
        "episode": 58,
        "released": "2004-08-11",
        "overview": ""
      },
      {
        "id": "tvmaze:120886",
        "title": "8/12/04",
        "season": 2004,
        "episode": 59,
        "released": "2004-08-12",
        "overview": ""
      },
      {
        "id": "tvmaze:120887",
        "title": "8/13/04",
        "season": 2004,
        "episode": 60,
        "released": "2004-08-13",
        "overview": ""
      },
      {
        "id": "tvmaze:120888",
        "title": "8/16/04",
        "season": 2004,
        "episode": 61,
        "released": "2004-08-16",
        "overview": ""
      },
      {
        "id": "tvmaze:120889",
        "title": "8/17/04",
        "season": 2004,
        "episode": 62,
        "released": "2004-08-17",
        "overview": ""
      },
      {
        "id": "tvmaze:120890",
        "title": "8/18/04",
        "season": 2004,
        "episode": 63,
        "released": "2004-08-18",
        "overview": ""
      },
      {
        "id": "tvmaze:120891",
        "title": "8/19/04",
        "season": 2004,
        "episode": 64,
        "released": "2004-08-19",
        "overview": ""
      },
      {
        "id": "tvmaze:120892",
        "title": "8/20/04",
        "season": 2004,
        "episode": 65,
        "released": "2004-08-20",
        "overview": ""
      },
      {
        "id": "tvmaze:120893",
        "title": "8/23/04",
        "season": 2004,
        "episode": 66,
        "released": "2004-08-23",
        "overview": ""
      },
      {
        "id": "tvmaze:120894",
        "title": "8/24/04",
        "season": 2004,
        "episode": 67,
        "released": "2004-08-24",
        "overview": ""
      },
      {
        "id": "tvmaze:120895",
        "title": "8/25/04",
        "season": 2004,
        "episode": 68,
        "released": "2004-08-25",
        "overview": ""
      },
      {
        "id": "tvmaze:120896",
        "title": "8/26/04",
        "season": 2004,
        "episode": 69,
        "released": "2004-08-26",
        "overview": ""
      },
      {
        "id": "tvmaze:120897",
        "title": "8/27/04",
        "season": 2004,
        "episode": 70,
        "released": "2004-08-27",
        "overview": ""
      },
      {
        "id": "tvmaze:120899",
        "title": "9/7/04",
        "season": 2004,
        "episode": 71,
        "released": "2004-09-07",
        "overview": ""
      },
      {
        "id": "tvmaze:120900",
        "title": "9/8/04",
        "season": 2004,
        "episode": 72,
        "released": "2004-09-08",
        "overview": ""
      },
      {
        "id": "tvmaze:120901",
        "title": "9/9/04",
        "season": 2004,
        "episode": 73,
        "released": "2004-09-09",
        "overview": ""
      },
      {
        "id": "tvmaze:120902",
        "title": "9/10/04",
        "season": 2004,
        "episode": 74,
        "released": "2004-09-10",
        "overview": ""
      },
      {
        "id": "tvmaze:120903",
        "title": "9/13/04",
        "season": 2004,
        "episode": 75,
        "released": "2004-09-13",
        "overview": ""
      },
      {
        "id": "tvmaze:120904",
        "title": "Farrah Fawcett",
        "season": 2004,
        "episode": 76,
        "released": "2004-09-14",
        "overview": ""
      },
      {
        "id": "tvmaze:120905",
        "title": "9/15/04",
        "season": 2004,
        "episode": 77,
        "released": "2004-09-15",
        "overview": ""
      },
      {
        "id": "tvmaze:120906",
        "title": "9/16/04",
        "season": 2004,
        "episode": 78,
        "released": "2004-09-16",
        "overview": ""
      },
      {
        "id": "tvmaze:120907",
        "title": "9/17/04",
        "season": 2004,
        "episode": 79,
        "released": "2004-09-17",
        "overview": ""
      },
      {
        "id": "tvmaze:120908",
        "title": "9/20/04",
        "season": 2004,
        "episode": 80,
        "released": "2004-09-20",
        "overview": ""
      },
      {
        "id": "tvmaze:120909",
        "title": "9/21/04",
        "season": 2004,
        "episode": 81,
        "released": "2004-09-21",
        "overview": ""
      },
      {
        "id": "tvmaze:120910",
        "title": "9/22/04",
        "season": 2004,
        "episode": 82,
        "released": "2004-09-22",
        "overview": ""
      },
      {
        "id": "tvmaze:120911",
        "title": "9/23/04",
        "season": 2004,
        "episode": 83,
        "released": "2004-09-23",
        "overview": ""
      },
      {
        "id": "tvmaze:120912",
        "title": "9/24/04",
        "season": 2004,
        "episode": 84,
        "released": "2004-09-24",
        "overview": ""
      },
      {
        "id": "tvmaze:120913",
        "title": "9/27/04",
        "season": 2004,
        "episode": 85,
        "released": "2004-09-27",
        "overview": ""
      },
      {
        "id": "tvmaze:120914",
        "title": "9/28/04",
        "season": 2004,
        "episode": 86,
        "released": "2004-09-28",
        "overview": ""
      },
      {
        "id": "tvmaze:120915",
        "title": "9/29/04",
        "season": 2004,
        "episode": 87,
        "released": "2004-09-29",
        "overview": ""
      },
      {
        "id": "tvmaze:120916",
        "title": "9/30/04",
        "season": 2004,
        "episode": 88,
        "released": "2004-09-30",
        "overview": ""
      },
      {
        "id": "tvmaze:120917",
        "title": "10/1/04",
        "season": 2004,
        "episode": 89,
        "released": "2004-10-01",
        "overview": ""
      },
      {
        "id": "tvmaze:120918",
        "title": "10/4/04",
        "season": 2004,
        "episode": 90,
        "released": "2004-10-04",
        "overview": ""
      },
      {
        "id": "tvmaze:120919",
        "title": "10/5/04",
        "season": 2004,
        "episode": 91,
        "released": "2004-10-05",
        "overview": ""
      },
      {
        "id": "tvmaze:120920",
        "title": "10/6/04",
        "season": 2004,
        "episode": 92,
        "released": "2004-10-06",
        "overview": ""
      },
      {
        "id": "tvmaze:120921",
        "title": "10/7/04",
        "season": 2004,
        "episode": 93,
        "released": "2004-10-07",
        "overview": ""
      },
      {
        "id": "tvmaze:120922",
        "title": "10/8/04",
        "season": 2004,
        "episode": 94,
        "released": "2004-10-08",
        "overview": ""
      },
      {
        "id": "tvmaze:120923",
        "title": "10/11/04",
        "season": 2004,
        "episode": 95,
        "released": "2004-10-11",
        "overview": ""
      },
      {
        "id": "tvmaze:120924",
        "title": "10/18/04",
        "season": 2004,
        "episode": 96,
        "released": "2004-10-18",
        "overview": ""
      },
      {
        "id": "tvmaze:120925",
        "title": "10/19/04",
        "season": 2004,
        "episode": 97,
        "released": "2004-10-19",
        "overview": ""
      },
      {
        "id": "tvmaze:120926",
        "title": "10/12/04",
        "season": 2004,
        "episode": 98,
        "released": "2004-10-12",
        "overview": ""
      },
      {
        "id": "tvmaze:120927",
        "title": "10/20/04",
        "season": 2004,
        "episode": 99,
        "released": "2004-10-20",
        "overview": ""
      },
      {
        "id": "tvmaze:120928",
        "title": "10/13/04",
        "season": 2004,
        "episode": 100,
        "released": "2004-10-13",
        "overview": ""
      },
      {
        "id": "tvmaze:120929",
        "title": "10/21/04",
        "season": 2004,
        "episode": 101,
        "released": "2004-10-21",
        "overview": ""
      },
      {
        "id": "tvmaze:120930",
        "title": "10/14/04",
        "season": 2004,
        "episode": 102,
        "released": "2004-10-14",
        "overview": ""
      },
      {
        "id": "tvmaze:120931",
        "title": "10/15/04",
        "season": 2004,
        "episode": 103,
        "released": "2004-10-15",
        "overview": ""
      },
      {
        "id": "tvmaze:120932",
        "title": "10/18/04",
        "season": 2004,
        "episode": 104,
        "released": "2004-10-18",
        "overview": ""
      },
      {
        "id": "tvmaze:120933",
        "title": "10/19/04",
        "season": 2004,
        "episode": 105,
        "released": "2004-10-19",
        "overview": ""
      },
      {
        "id": "tvmaze:120934",
        "title": "10/20/04",
        "season": 2004,
        "episode": 106,
        "released": "2004-10-20",
        "overview": ""
      },
      {
        "id": "tvmaze:120935",
        "title": "10/21/04",
        "season": 2004,
        "episode": 107,
        "released": "2004-10-21",
        "overview": ""
      },
      {
        "id": "tvmaze:120936",
        "title": "10/22/04",
        "season": 2004,
        "episode": 108,
        "released": "2004-10-22",
        "overview": ""
      },
      {
        "id": "tvmaze:120937",
        "title": "10/25/04",
        "season": 2004,
        "episode": 109,
        "released": "2004-10-25",
        "overview": ""
      },
      {
        "id": "tvmaze:120938",
        "title": "10/26/04",
        "season": 2004,
        "episode": 110,
        "released": "2004-10-26",
        "overview": ""
      },
      {
        "id": "tvmaze:120939",
        "title": "10/27/04",
        "season": 2004,
        "episode": 111,
        "released": "2004-10-27",
        "overview": ""
      },
      {
        "id": "tvmaze:120940",
        "title": "10/28/04",
        "season": 2004,
        "episode": 112,
        "released": "2004-10-28",
        "overview": ""
      },
      {
        "id": "tvmaze:120941",
        "title": "10/29/04",
        "season": 2004,
        "episode": 113,
        "released": "2004-10-29",
        "overview": ""
      },
      {
        "id": "tvmaze:120942",
        "title": "11/1/04",
        "season": 2004,
        "episode": 114,
        "released": "2004-11-01",
        "overview": ""
      },
      {
        "id": "tvmaze:120943",
        "title": "11/3/04",
        "season": 2004,
        "episode": 115,
        "released": "2004-11-03",
        "overview": ""
      },
      {
        "id": "tvmaze:120944",
        "title": "11/4/04",
        "season": 2004,
        "episode": 116,
        "released": "2004-11-04",
        "overview": ""
      },
      {
        "id": "tvmaze:120945",
        "title": "11/5/04",
        "season": 2004,
        "episode": 117,
        "released": "2004-11-05",
        "overview": ""
      },
      {
        "id": "tvmaze:120946",
        "title": "11/6/04",
        "season": 2004,
        "episode": 118,
        "released": "2004-11-06",
        "overview": ""
      },
      {
        "id": "tvmaze:120947",
        "title": "11/7/04",
        "season": 2004,
        "episode": 119,
        "released": "2004-11-07",
        "overview": ""
      },
      {
        "id": "tvmaze:120948",
        "title": "11/10/04",
        "season": 2004,
        "episode": 120,
        "released": "2004-11-10",
        "overview": ""
      },
      {
        "id": "tvmaze:120949",
        "title": "11/11/04",
        "season": 2004,
        "episode": 121,
        "released": "2004-11-11",
        "overview": ""
      },
      {
        "id": "tvmaze:120950",
        "title": "11/12/04",
        "season": 2004,
        "episode": 122,
        "released": "2004-11-12",
        "overview": ""
      },
      {
        "id": "tvmaze:120952",
        "title": "Tracy Morgan, Emilie de Ravin, Arthur Nakane",
        "season": 2005,
        "episode": 1,
        "released": "2005-02-06",
        "overview": ""
      },
      {
        "id": "tvmaze:120953",
        "title": "Ja Rule",
        "season": 2005,
        "episode": 2,
        "released": "2005-01-10",
        "overview": ""
      },
      {
        "id": "tvmaze:120954",
        "title": "Oliver Platt, Elizabeth Rohm, & Michael McDonald",
        "season": 2005,
        "episode": 3,
        "released": "2005-01-11",
        "overview": ""
      },
      {
        "id": "tvmaze:120955",
        "title": "Steve Harvey",
        "season": 2005,
        "episode": 4,
        "released": "2005-01-12",
        "overview": ""
      },
      {
        "id": "tvmaze:120956",
        "title": "James Woods, Game, & 50 cent",
        "season": 2005,
        "episode": 5,
        "released": "2005-01-14",
        "overview": ""
      },
      {
        "id": "tvmaze:120957",
        "title": "Sarah Ferguson & Jorge Garcia",
        "season": 2005,
        "episode": 6,
        "released": "2005-01-17",
        "overview": ""
      },
      {
        "id": "tvmaze:120958",
        "title": "Tony Shalhoub, Michael Irvin, & Elefant",
        "season": 2005,
        "episode": 7,
        "released": "2005-01-18",
        "overview": ""
      },
      {
        "id": "tvmaze:120959",
        "title": "Wayne Newton & Drea de Matteo",
        "season": 2005,
        "episode": 8,
        "released": "2005-01-19",
        "overview": ""
      },
      {
        "id": "tvmaze:120960",
        "title": "Laurence Fishburne, Jo Frost, & Trick Daddy",
        "season": 2005,
        "episode": 9,
        "released": "2005-01-21",
        "overview": ""
      },
      {
        "id": "tvmaze:120961",
        "title": "Will Arnett & The Features",
        "season": 2005,
        "episode": 10,
        "released": "2005-02-02",
        "overview": ""
      },
      {
        "id": "tvmaze:120962",
        "title": "LeAnn Rimes",
        "season": 2005,
        "episode": 11,
        "released": "2005-02-04",
        "overview": ""
      },
      {
        "id": "tvmaze:120963",
        "title": "Tracy Morgan",
        "season": 2005,
        "episode": 12,
        "released": "2005-02-07",
        "overview": ""
      },
      {
        "id": "tvmaze:120964",
        "title": "Joy Behar & Farnsworth Bentley",
        "season": 2005,
        "episode": 13,
        "released": "2005-02-08",
        "overview": ""
      },
      {
        "id": "tvmaze:120965",
        "title": "Emilie de Ravin",
        "season": 2005,
        "episode": 14,
        "released": "2005-02-09",
        "overview": ""
      },
      {
        "id": "tvmaze:120966",
        "title": "Jen Schefft",
        "season": 2005,
        "episode": 15,
        "released": "2005-02-10",
        "overview": ""
      },
      {
        "id": "tvmaze:120967",
        "title": "Avril Lavigne",
        "season": 2005,
        "episode": 16,
        "released": "2005-02-11",
        "overview": ""
      },
      {
        "id": "tvmaze:120968",
        "title": "Clay Aiken & Los Lonely Boys",
        "season": 2005,
        "episode": 17,
        "released": "2005-02-14",
        "overview": ""
      },
      {
        "id": "tvmaze:120969",
        "title": "Ludacris",
        "season": 2005,
        "episode": 18,
        "released": "2005-02-15",
        "overview": ""
      },
      {
        "id": "tvmaze:120970",
        "title": "Seth Green & Naked Trucker",
        "season": 2005,
        "episode": 19,
        "released": "2005-02-16",
        "overview": ""
      },
      {
        "id": "tvmaze:120971",
        "title": "Jaime Kennedy & Kim Raver",
        "season": 2005,
        "episode": 20,
        "released": "2005-02-18",
        "overview": ""
      },
      {
        "id": "tvmaze:120972",
        "title": "Jim Belushi, Shia LeBeouf, & Greg Fitzsimmons",
        "season": 2005,
        "episode": 21,
        "released": "2005-02-21",
        "overview": ""
      },
      {
        "id": "tvmaze:120973",
        "title": "Simon Cowell, Michelle Rodriguez, & Secret Machines",
        "season": 2005,
        "episode": 22,
        "released": "2005-02-23",
        "overview": ""
      },
      {
        "id": "tvmaze:120974",
        "title": "Bernie Mac & Joanna Newsom",
        "season": 2005,
        "episode": 23,
        "released": "2005-02-24",
        "overview": ""
      },
      {
        "id": "tvmaze:120975",
        "title": "Diane Sawyer, Gavin Rossdale, & Xzibit",
        "season": 2005,
        "episode": 24,
        "released": "2005-02-25",
        "overview": ""
      },
      {
        "id": "tvmaze:120976",
        "title": "Christina Ricci, Steven Bochco, & Duran Duran",
        "season": 2005,
        "episode": 25,
        "released": "2005-02-28",
        "overview": ""
      },
      {
        "id": "tvmaze:120977",
        "title": "George Lopez, Debbie Matenopoulos, & Marc Broussard",
        "season": 2005,
        "episode": 26,
        "released": "2005-03-01",
        "overview": ""
      },
      {
        "id": "tvmaze:120978",
        "title": "David Alan Grier & Bam Margera",
        "season": 2005,
        "episode": 27,
        "released": "2005-03-02",
        "overview": ""
      },
      {
        "id": "tvmaze:120979",
        "title": "Tom Arnold, Michael Ealy, Silvertide",
        "season": 2005,
        "episode": 28,
        "released": "2005-03-04",
        "overview": ""
      },
      {
        "id": "tvmaze:120980",
        "title": "Amy Brenneman, Patton Oswalt, & Brazilian Girls",
        "season": 2005,
        "episode": 29,
        "released": "2005-03-07",
        "overview": ""
      },
      {
        "id": "tvmaze:120981",
        "title": "Randy Jackson, Brittany Snow, & O'Jays",
        "season": 2005,
        "episode": 30,
        "released": "2005-03-08",
        "overview": ""
      },
      {
        "id": "tvmaze:120982",
        "title": "Kelsey Grammer",
        "season": 2005,
        "episode": 31,
        "released": "2005-03-09",
        "overview": ""
      },
      {
        "id": "tvmaze:120983",
        "title": "William Shatner, Sugar Ray Leonard, & Kasabian",
        "season": 2005,
        "episode": 32,
        "released": "2005-03-11",
        "overview": ""
      },
      {
        "id": "tvmaze:120984",
        "title": "Ron Eldard & The Music",
        "season": 2005,
        "episode": 33,
        "released": "2005-03-14",
        "overview": ""
      },
      {
        "id": "tvmaze:120985",
        "title": "Will Sasso & Hard 'n Phirm",
        "season": 2005,
        "episode": 34,
        "released": "2005-03-15",
        "overview": ""
      },
      {
        "id": "tvmaze:120986",
        "title": "John Stamos, Harland Williams, Aslyn",
        "season": 2005,
        "episode": 35,
        "released": "2005-03-16",
        "overview": ""
      },
      {
        "id": "tvmaze:120987",
        "title": "Sylvester Stallone & Christina Millian",
        "season": 2005,
        "episode": 36,
        "released": "2005-03-18",
        "overview": ""
      },
      {
        "id": "tvmaze:120988",
        "title": "Mena Suvari & Kenan Thompson",
        "season": 2005,
        "episode": 37,
        "released": "2005-03-21",
        "overview": ""
      },
      {
        "id": "tvmaze:120989",
        "title": "Andy Dick, Keshia Knight Pulliam, & Louis XIV",
        "season": 2005,
        "episode": 38,
        "released": "2005-03-22",
        "overview": ""
      },
      {
        "id": "tvmaze:120990",
        "title": "Bernie Mac, Sherri Shepherd, & Tegan and Sara",
        "season": 2005,
        "episode": 39,
        "released": "2005-03-23",
        "overview": ""
      },
      {
        "id": "tvmaze:120991",
        "title": "Sting",
        "season": 2005,
        "episode": 40,
        "released": "2005-03-25",
        "overview": ""
      },
      {
        "id": "tvmaze:120992",
        "title": "Timothy Daly, Grover, & My Chemical Romance",
        "season": 2005,
        "episode": 41,
        "released": "2005-04-04",
        "overview": ""
      },
      {
        "id": "tvmaze:120993",
        "title": "Fred Willard & Laura Leighton",
        "season": 2005,
        "episode": 42,
        "released": "2005-04-05",
        "overview": ""
      },
      {
        "id": "tvmaze:120994",
        "title": "Lisa Marie Presley, Nick Stahl, & The Bravery",
        "season": 2005,
        "episode": 43,
        "released": "2005-04-06",
        "overview": ""
      },
      {
        "id": "tvmaze:120995",
        "title": "Sara Rue, Charlie O'Connell & Dizzee Rascal",
        "season": 2005,
        "episode": 44,
        "released": "2005-04-08",
        "overview": ""
      },
      {
        "id": "tvmaze:120996",
        "title": "Karl Malone, Meinhardt Raabe, & The Dan Band",
        "season": 2005,
        "episode": 45,
        "released": "2005-04-11",
        "overview": ""
      },
      {
        "id": "tvmaze:120997",
        "title": "Sean Astin, Garcelle Beauvais-Nilon, & Frankie J",
        "season": 2005,
        "episode": 46,
        "released": "2005-04-12",
        "overview": ""
      },
      {
        "id": "tvmaze:120998",
        "title": "David Krumholtz & Hall & Oats",
        "season": 2005,
        "episode": 47,
        "released": "2005-04-13",
        "overview": ""
      },
      {
        "id": "tvmaze:120999",
        "title": "Fabio & Ingram Hill",
        "season": 2005,
        "episode": 48,
        "released": "2005-04-15",
        "overview": ""
      },
      {
        "id": "tvmaze:121000",
        "title": "Travis Barker, Shanna Moakler, & Matisyahu",
        "season": 2005,
        "episode": 49,
        "released": "2005-04-18",
        "overview": ""
      },
      {
        "id": "tvmaze:121001",
        "title": "Ice Cube & Johnny Holiday",
        "season": 2005,
        "episode": 50,
        "released": "2005-04-20",
        "overview": ""
      },
      {
        "id": "tvmaze:121002",
        "title": "Ashton Kutcher, Matt Johnston, Jon Douglas, & Killswitch Engage",
        "season": 2005,
        "episode": 51,
        "released": "2005-04-22",
        "overview": ""
      },
      {
        "id": "tvmaze:121003",
        "title": "Ludacris & Jessi Alexander",
        "season": 2005,
        "episode": 52,
        "released": "2005-04-25",
        "overview": ""
      },
      {
        "id": "tvmaze:121004",
        "title": "Farrah Fawcett & Frank Caliendo",
        "season": 2005,
        "episode": 53,
        "released": "2005-04-26",
        "overview": ""
      },
      {
        "id": "tvmaze:121005",
        "title": "Jennifer Tilly, Joe Maloof, Gavin Maloof, & New Order",
        "season": 2005,
        "episode": 54,
        "released": "2005-04-27",
        "overview": ""
      },
      {
        "id": "tvmaze:121006",
        "title": "Willi Ninja & Puffy Amiyumi",
        "season": 2005,
        "episode": 55,
        "released": "2005-04-28",
        "overview": ""
      },
      {
        "id": "tvmaze:121007",
        "title": "Jim Belushi, Jennifer Morrison, & The Raveonettes",
        "season": 2005,
        "episode": 56,
        "released": "2005-05-02",
        "overview": ""
      },
      {
        "id": "tvmaze:121008",
        "title": "Zooey Deschanel, Malcolm David Kelley, & M.i.a.",
        "season": 2005,
        "episode": 57,
        "released": "2005-05-03",
        "overview": ""
      },
      {
        "id": "tvmaze:121009",
        "title": "Seth McFarlane & Alex Borstein",
        "season": 2005,
        "episode": 58,
        "released": "2005-05-04",
        "overview": ""
      },
      {
        "id": "tvmaze:121010",
        "title": "Martin Short, Mighty Gonzales, & Los Amigos Invisibles",
        "season": 2005,
        "episode": 59,
        "released": "2005-05-05",
        "overview": ""
      },
      {
        "id": "tvmaze:121011",
        "title": "Regis Philbin & Faith Evans",
        "season": 2005,
        "episode": 60,
        "released": "2005-05-06",
        "overview": ""
      },
      {
        "id": "tvmaze:121012",
        "title": "Pamela Anderson",
        "season": 2005,
        "episode": 61,
        "released": "2005-05-09",
        "overview": ""
      },
      {
        "id": "tvmaze:121013",
        "title": "Jonathan Winters, Melissa George, & Keyshia Cole",
        "season": 2005,
        "episode": 62,
        "released": "2005-05-10",
        "overview": ""
      },
      {
        "id": "tvmaze:121014",
        "title": "Andy Garcia, Michelle Trachtenberg, & Bobby Valentino",
        "season": 2005,
        "episode": 63,
        "released": "2005-05-11",
        "overview": ""
      },
      {
        "id": "tvmaze:121015",
        "title": "Ozzy Osbourne & Erasure",
        "season": 2005,
        "episode": 64,
        "released": "2005-05-13",
        "overview": ""
      },
      {
        "id": "tvmaze:121016",
        "title": "Michael Irvin & Audioslave",
        "season": 2005,
        "episode": 65,
        "released": "2005-05-18",
        "overview": ""
      },
      {
        "id": "tvmaze:121017",
        "title": "Adam Scott & Gwen Stefani",
        "season": 2005,
        "episode": 66,
        "released": "2005-05-19",
        "overview": ""
      },
      {
        "id": "tvmaze:121018",
        "title": "Tracy Morgan, Rodney Rothman, & The Dears",
        "season": 2005,
        "episode": 67,
        "released": "2005-05-20",
        "overview": ""
      },
      {
        "id": "tvmaze:121019",
        "title": "Matthew Fox, Judge Joe Brown, Bloc Party",
        "season": 2005,
        "episode": 68,
        "released": "2005-05-23",
        "overview": ""
      },
      {
        "id": "tvmaze:121020",
        "title": "Seether",
        "season": 2005,
        "episode": 69,
        "released": "2005-05-24",
        "overview": ""
      },
      {
        "id": "tvmaze:121021",
        "title": "Dominic Monaghan, Harold Perrineau Jr., & Goldie Lookin' Chain",
        "season": 2005,
        "episode": 70,
        "released": "2005-05-25",
        "overview": ""
      },
      {
        "id": "tvmaze:121022",
        "title": "Dane Cook & Nelly",
        "season": 2005,
        "episode": 71,
        "released": "2005-05-27",
        "overview": ""
      },
      {
        "id": "tvmaze:121023",
        "title": "Fred Willard, Seth McFarlane, & Alex Borstein",
        "season": 2005,
        "episode": 72,
        "released": "2005-06-06",
        "overview": ""
      },
      {
        "id": "tvmaze:121024",
        "title": "Bradley Whitford, Huey Lewis, & The News",
        "season": 2005,
        "episode": 73,
        "released": "2005-06-07",
        "overview": ""
      },
      {
        "id": "tvmaze:121025",
        "title": "Anthony Michael Hall & Athlete",
        "season": 2005,
        "episode": 74,
        "released": "2005-06-08",
        "overview": ""
      },
      {
        "id": "tvmaze:121026",
        "title": "Cedric the Entertainer & Yogi Ramesh",
        "season": 2005,
        "episode": 75,
        "released": "2005-06-09",
        "overview": ""
      },
      {
        "id": "tvmaze:121027",
        "title": "Mike Epps & The Faint",
        "season": 2005,
        "episode": 76,
        "released": "2005-06-13",
        "overview": ""
      },
      {
        "id": "tvmaze:121028",
        "title": "George Foreman, Preston Barden, & John Butler Trio",
        "season": 2005,
        "episode": 77,
        "released": "2005-06-14",
        "overview": ""
      },
      {
        "id": "tvmaze:121029",
        "title": "George Lopez, Gabrielle Union, & Embrace",
        "season": 2005,
        "episode": 78,
        "released": "2005-06-15",
        "overview": ""
      },
      {
        "id": "tvmaze:121030",
        "title": "Evander Holyfield, Kathie Lee Gifford, & Majestik Magnificent",
        "season": 2005,
        "episode": 79,
        "released": "2005-06-16",
        "overview": ""
      },
      {
        "id": "tvmaze:121031",
        "title": "Mekhi Phifer, Nancy Grace, & Ying Yang Twins",
        "season": 2005,
        "episode": 80,
        "released": "2005-06-20",
        "overview": ""
      },
      {
        "id": "tvmaze:121032",
        "title": "Reggie Miller",
        "season": 2005,
        "episode": 81,
        "released": "2005-06-21",
        "overview": ""
      },
      {
        "id": "tvmaze:121033",
        "title": "Dennis Hopper, Andy Milonakis, The Futureheads",
        "season": 2005,
        "episode": 82,
        "released": "2005-06-22",
        "overview": ""
      },
      {
        "id": "tvmaze:121034",
        "title": "Jesse Dawson, Jonathan Reese, & Billy Idol",
        "season": 2005,
        "episode": 83,
        "released": "2005-06-23",
        "overview": ""
      },
      {
        "id": "tvmaze:121035",
        "title": "Gary Busey, Russell Simmons, & The Transplants",
        "season": 2005,
        "episode": 84,
        "released": "2005-07-05",
        "overview": ""
      },
      {
        "id": "tvmaze:121036",
        "title": "Tim Roth, Bobby Brown, & Goldie Lookin' Chain",
        "season": 2005,
        "episode": 85,
        "released": "2005-07-06",
        "overview": ""
      },
      {
        "id": "tvmaze:121037",
        "title": "Jeremy Piven, Morgan Spurlock, & Esthero",
        "season": 2005,
        "episode": 86,
        "released": "2005-07-07",
        "overview": ""
      },
      {
        "id": "tvmaze:121038",
        "title": "Magic Johnson",
        "season": 2005,
        "episode": 87,
        "released": "2005-07-08",
        "overview": ""
      },
      {
        "id": "tvmaze:121039",
        "title": "Hilary Duff, Terrence Howard, & Nick DiPaolo",
        "season": 2005,
        "episode": 88,
        "released": "2005-07-11",
        "overview": ""
      },
      {
        "id": "tvmaze:121040",
        "title": "All American Rejects",
        "season": 2005,
        "episode": 89,
        "released": "2005-07-12",
        "overview": ""
      },
      {
        "id": "tvmaze:121041",
        "title": "Taryn Manning, Wilson, & Elsamelys",
        "season": 2005,
        "episode": 90,
        "released": "2005-07-13",
        "overview": ""
      },
      {
        "id": "tvmaze:121042",
        "title": "Venus Williams, Criss Angel, & Kem",
        "season": 2005,
        "episode": 91,
        "released": "2005-07-15",
        "overview": ""
      },
      {
        "id": "tvmaze:121043",
        "title": "Anthony Anderson, Caprice, & Fall Out Boy",
        "season": 2005,
        "episode": 92,
        "released": "2005-07-18",
        "overview": ""
      },
      {
        "id": "tvmaze:121044",
        "title": "Amanda Ghost",
        "season": 2005,
        "episode": 93,
        "released": "2005-07-19",
        "overview": ""
      },
      {
        "id": "tvmaze:121045",
        "title": "Perry Farrell & G-Love",
        "season": 2005,
        "episode": 94,
        "released": "2005-07-20",
        "overview": ""
      },
      {
        "id": "tvmaze:121046",
        "title": "John Cena & Mike O'Connell",
        "season": 2005,
        "episode": 95,
        "released": "2005-07-22",
        "overview": ""
      },
      {
        "id": "tvmaze:121047",
        "title": "D.L. Hughley & Bam Margera",
        "season": 2005,
        "episode": 96,
        "released": "2005-07-25",
        "overview": ""
      },
      {
        "id": "tvmaze:121048",
        "title": "Terrence Howard, Jason Ritter, & Hot Hot Heat",
        "season": 2005,
        "episode": 97,
        "released": "2005-07-26",
        "overview": ""
      },
      {
        "id": "tvmaze:121049",
        "title": "Tom Arnold & Alanis Morissette",
        "season": 2005,
        "episode": 98,
        "released": "2005-07-27",
        "overview": ""
      },
      {
        "id": "tvmaze:121050",
        "title": "Jerry Ferrara, Hulk Hogan, & Jack Johnson",
        "season": 2005,
        "episode": 99,
        "released": "2005-07-29",
        "overview": ""
      },
      {
        "id": "tvmaze:121051",
        "title": "Wilmer Valderrama, Lauren Sanchez, & Julius Sharpe",
        "season": 2005,
        "episode": 100,
        "released": "2005-08-01",
        "overview": ""
      },
      {
        "id": "tvmaze:121052",
        "title": "Adam Carolla, Venus Williams, & Young Jeezy",
        "season": 2005,
        "episode": 101,
        "released": "2005-08-02",
        "overview": ""
      },
      {
        "id": "tvmaze:121053",
        "title": "Pamela Anderson & Paul Provenza",
        "season": 2005,
        "episode": 102,
        "released": "2005-08-03",
        "overview": ""
      },
      {
        "id": "tvmaze:121054",
        "title": "Nick Cannon, Joe Simpson, & Queens of the Stone Age",
        "season": 2005,
        "episode": 103,
        "released": "2005-08-05",
        "overview": ""
      },
      {
        "id": "tvmaze:121055",
        "title": "Kevin Nealon, Yucko the Clown, & Raheem Devaughn",
        "season": 2005,
        "episode": 104,
        "released": "2005-08-08",
        "overview": ""
      },
      {
        "id": "tvmaze:121056",
        "title": "Johnny Knoxville, Bill Engvall, & Roger Alan Wade",
        "season": 2005,
        "episode": 105,
        "released": "2005-08-09",
        "overview": ""
      },
      {
        "id": "tvmaze:121057",
        "title": "Dane Cook & Eric Schaeffer",
        "season": 2005,
        "episode": 106,
        "released": "2005-08-10",
        "overview": ""
      },
      {
        "id": "tvmaze:121058",
        "title": "Jennifer Tilly, Tyrese, & Doug Benson",
        "season": 2005,
        "episode": 107,
        "released": "2005-08-12",
        "overview": ""
      },
      {
        "id": "tvmaze:121059",
        "title": "Amy Poehler, Ice-T, & Amy Miles",
        "season": 2005,
        "episode": 108,
        "released": "2005-08-22",
        "overview": ""
      },
      {
        "id": "tvmaze:121060",
        "title": "Kathy Griffin, Dr. Drew Pinsky, & Reliant K",
        "season": 2005,
        "episode": 109,
        "released": "2005-08-23",
        "overview": ""
      },
      {
        "id": "tvmaze:121061",
        "title": "Yunjin Kim, Howie Mandel, & Click 5",
        "season": 2005,
        "episode": 110,
        "released": "2005-08-24",
        "overview": ""
      },
      {
        "id": "tvmaze:121062",
        "title": "Hugh Hefner & girlfriends, Louis C.K., & Jason Mraz",
        "season": 2005,
        "episode": 111,
        "released": "2005-08-26",
        "overview": ""
      },
      {
        "id": "tvmaze:121063",
        "title": "Tommy Lee & Daniel Dae Kim",
        "season": 2005,
        "episode": 112,
        "released": "2005-08-29",
        "overview": ""
      },
      {
        "id": "tvmaze:121064",
        "title": "Kevin Dillon, Vivica A. Fox, & Hawthorne Heights",
        "season": 2005,
        "episode": 113,
        "released": "2005-08-30",
        "overview": ""
      },
      {
        "id": "tvmaze:121065",
        "title": "Al Michaels, Van Stone, & Tony Yayo featuring Joe",
        "season": 2005,
        "episode": 114,
        "released": "2005-08-31",
        "overview": ""
      },
      {
        "id": "tvmaze:121066",
        "title": "Sarah Silverman, Michael Ian Black, Michael Showalter, David Wain, & BJ Snowden",
        "season": 2005,
        "episode": 115,
        "released": "2005-09-02",
        "overview": ""
      },
      {
        "id": "tvmaze:121067",
        "title": "Rev. Al Sharpton, Tony Hale, & Common",
        "season": 2005,
        "episode": 116,
        "released": "2005-09-06",
        "overview": ""
      },
      {
        "id": "tvmaze:121068",
        "title": "Adam Brody & Kristin Cavalleri",
        "season": 2005,
        "episode": 117,
        "released": "2005-09-07",
        "overview": ""
      },
      {
        "id": "tvmaze:121069",
        "title": "Paul Reiser & Matt Leinart",
        "season": 2005,
        "episode": 118,
        "released": "2005-09-08",
        "overview": ""
      },
      {
        "id": "tvmaze:121070",
        "title": "Laura Linney, Michael McKean, & Trapt",
        "season": 2005,
        "episode": 119,
        "released": "2005-09-09",
        "overview": ""
      },
      {
        "id": "tvmaze:121071",
        "title": "Danica Patrick, Todd Glass, Richard Kind,& LL Cool J",
        "season": 2005,
        "episode": 120,
        "released": "2005-09-12",
        "overview": ""
      },
      {
        "id": "tvmaze:121072",
        "title": "Tracy Morgan & Hanson",
        "season": 2005,
        "episode": 121,
        "released": "2005-09-13",
        "overview": ""
      },
      {
        "id": "tvmaze:121073",
        "title": "Fran Drescher & Amerie",
        "season": 2005,
        "episode": 122,
        "released": "2005-09-14",
        "overview": ""
      },
      {
        "id": "tvmaze:121074",
        "title": "Will Arnett & Blues Traveler",
        "season": 2005,
        "episode": 123,
        "released": "2005-09-16",
        "overview": ""
      },
      {
        "id": "tvmaze:121075",
        "title": "Jim Belushi, Kelly Monaco, & Damian Marley",
        "season": 2005,
        "episode": 124,
        "released": "2005-09-19",
        "overview": ""
      },
      {
        "id": "tvmaze:121076",
        "title": "Matthew Fox, Peter Falk & Blood Brothers",
        "season": 2005,
        "episode": 125,
        "released": "2005-09-20",
        "overview": ""
      },
      {
        "id": "tvmaze:121077",
        "title": "Johnny Knoxville, Chi McBride, & Backstreet Boys",
        "season": 2005,
        "episode": 126,
        "released": "2005-09-21",
        "overview": ""
      },
      {
        "id": "tvmaze:121078",
        "title": "Quentin Tarantino, Erika Christensen, & Morgan Murphy",
        "season": 2005,
        "episode": 127,
        "released": "2005-09-23",
        "overview": ""
      },
      {
        "id": "tvmaze:121079",
        "title": "Clay Aiken, Scott Caan, & Weezer",
        "season": 2005,
        "episode": 128,
        "released": "2005-09-26",
        "overview": ""
      },
      {
        "id": "tvmaze:121080",
        "title": "George Lopez, Malcolm David Kelley, & Paul Wall",
        "season": 2005,
        "episode": 129,
        "released": "2005-09-27",
        "overview": ""
      },
      {
        "id": "tvmaze:121081",
        "title": "Alec Baldwin & Hobart Shakespeareans",
        "season": 2005,
        "episode": 130,
        "released": "2005-09-28",
        "overview": ""
      },
      {
        "id": "tvmaze:121082",
        "title": "Cheryl Hines, Brian Austin Green, & Queens of the Stone Age",
        "season": 2005,
        "episode": 131,
        "released": "2005-09-30",
        "overview": ""
      },
      {
        "id": "tvmaze:121083",
        "title": "Jessica Alba, Neil Strauss, & Brad Paisley",
        "season": 2005,
        "episode": 132,
        "released": "2005-10-03",
        "overview": ""
      },
      {
        "id": "tvmaze:121084",
        "title": "Jane Kaczmarek, Jeff Probst, & Kevin Shea",
        "season": 2005,
        "episode": 133,
        "released": "2005-10-04",
        "overview": ""
      },
      {
        "id": "tvmaze:121085",
        "title": "Sofia Vergara, Andy Dick, & Sean Paul",
        "season": 2005,
        "episode": 134,
        "released": "2005-10-05",
        "overview": ""
      },
      {
        "id": "tvmaze:121086",
        "title": "Lauren Holly, Billy Bush, & Nickelback",
        "season": 2005,
        "episode": 135,
        "released": "2005-10-07",
        "overview": ""
      },
      {
        "id": "tvmaze:121087",
        "title": "Freddie Prinze Jr., Bill Simmons, & Mike Jones",
        "season": 2005,
        "episode": 136,
        "released": "2005-10-10",
        "overview": ""
      },
      {
        "id": "tvmaze:121088",
        "title": "Anthony Anderson. Maggie Grace, & Jerry Minor",
        "season": 2005,
        "episode": 137,
        "released": "2005-10-11",
        "overview": ""
      },
      {
        "id": "tvmaze:121089",
        "title": "Mickey Rourke, Danica Patrick, & 3 Doors Down",
        "season": 2005,
        "episode": 138,
        "released": "2005-10-12",
        "overview": ""
      },
      {
        "id": "tvmaze:121090",
        "title": "Matt Stone, Trey Parker, Rodney Carrington, Shinedown",
        "season": 2005,
        "episode": 139,
        "released": "2005-10-14",
        "overview": ""
      },
      {
        "id": "tvmaze:121091",
        "title": "Roseanne Barr, Rev. Run, Black Eyed Peas",
        "season": 2005,
        "episode": 140,
        "released": "2005-10-17",
        "overview": ""
      },
      {
        "id": "tvmaze:121092",
        "title": "Constance Marie, Jeff Daniels, & Thrice",
        "season": 2005,
        "episode": 141,
        "released": "2005-10-18",
        "overview": ""
      },
      {
        "id": "tvmaze:121093",
        "title": "Bonnie Hunt, Tony Hawk, & Institute",
        "season": 2005,
        "episode": 142,
        "released": "2005-10-19",
        "overview": ""
      },
      {
        "id": "tvmaze:121094",
        "title": "James Denton, Lawrence Taylor, & The Go! Team",
        "season": 2005,
        "episode": 143,
        "released": "2005-10-21",
        "overview": ""
      },
      {
        "id": "tvmaze:121095",
        "title": "Jim Rome, Josie Maran, & John Legend",
        "season": 2005,
        "episode": 144,
        "released": "2005-10-24",
        "overview": ""
      },
      {
        "id": "tvmaze:121096",
        "title": "Mila Kunis, Neil Hamburger, & Jerry Tarkanian",
        "season": 2005,
        "episode": 145,
        "released": "2005-10-25",
        "overview": ""
      },
      {
        "id": "tvmaze:121097",
        "title": "Val Kilmer, Geraldo Rivera, & Kaci Brown",
        "season": 2005,
        "episode": 146,
        "released": "2005-10-26",
        "overview": ""
      },
      {
        "id": "tvmaze:121098",
        "title": "R. Kelly & Donnie Wahlberg",
        "season": 2005,
        "episode": 147,
        "released": "2005-10-28",
        "overview": ""
      },
      {
        "id": "tvmaze:121099",
        "title": "Mike Tyson & Bobby Brown",
        "season": 2005,
        "episode": 148,
        "released": "2005-10-31",
        "overview": ""
      },
      {
        "id": "tvmaze:121100",
        "title": "Molly Sims & Harland Williams",
        "season": 2005,
        "episode": 149,
        "released": "2005-11-01",
        "overview": ""
      },
      {
        "id": "tvmaze:121101",
        "title": "Ozzy Osbourne, Josh Hutcherson, Talib Kweli",
        "season": 2005,
        "episode": 150,
        "released": "2005-11-02",
        "overview": ""
      },
      {
        "id": "tvmaze:121102",
        "title": "Dane Cook & Billy Baldwin",
        "season": 2005,
        "episode": 151,
        "released": "2005-11-03",
        "overview": ""
      },
      {
        "id": "tvmaze:121103",
        "title": "Nicolette Sheridan, Ryan Dunn, Raul Midon",
        "season": 2005,
        "episode": 152,
        "released": "2005-11-04",
        "overview": ""
      },
      {
        "id": "tvmaze:121104",
        "title": "Pamela Anderson & Paul Anka",
        "season": 2005,
        "episode": 153,
        "released": "2005-11-08",
        "overview": ""
      },
      {
        "id": "tvmaze:121105",
        "title": "Patton Oswalt",
        "season": 2005,
        "episode": 154,
        "released": "2005-11-09",
        "overview": ""
      },
      {
        "id": "tvmaze:121106",
        "title": "Sarah Silverman, Xzibit, Jamiroquai",
        "season": 2005,
        "episode": 155,
        "released": "2005-11-10",
        "overview": ""
      },
      {
        "id": "tvmaze:121107",
        "title": "50 Cent, Christopher Meloni",
        "season": 2005,
        "episode": 156,
        "released": "2005-11-11",
        "overview": ""
      },
      {
        "id": "tvmaze:121108",
        "title": "William Shatner, Kristen Bell, Staind",
        "season": 2005,
        "episode": 157,
        "released": "2005-11-14",
        "overview": ""
      },
      {
        "id": "tvmaze:121109",
        "title": "Destiny's Child",
        "season": 2005,
        "episode": 158,
        "released": "2005-11-15",
        "overview": ""
      },
      {
        "id": "tvmaze:121110",
        "title": "Neil Diamond",
        "season": 2005,
        "episode": 159,
        "released": "2005-11-17",
        "overview": ""
      },
      {
        "id": "tvmaze:121111",
        "title": "Chris Elliott, Marc John Jeffries, Earth Wind & Fire",
        "season": 2005,
        "episode": 160,
        "released": "2005-11-18",
        "overview": ""
      },
      {
        "id": "tvmaze:121112",
        "title": "Cedric the Entertainer, Kenny Chesney",
        "season": 2005,
        "episode": 161,
        "released": "2005-11-21",
        "overview": ""
      },
      {
        "id": "tvmaze:121113",
        "title": "Fred Willard, Tyler James Williams, Lyfe Jennings",
        "season": 2005,
        "episode": 162,
        "released": "2005-11-22",
        "overview": ""
      },
      {
        "id": "tvmaze:121114",
        "title": "Anthony LaPaglia, Amy Smart, Def Leppard",
        "season": 2005,
        "episode": 163,
        "released": "2005-11-23",
        "overview": ""
      },
      {
        "id": "tvmaze:121115",
        "title": "Stephen A. Smith, Montgomery Gentry",
        "season": 2005,
        "episode": 164,
        "released": "2005-11-28",
        "overview": ""
      },
      {
        "id": "tvmaze:121116",
        "title": "Kevin Nealon, Ryan Reynolds, Upright Citizens Brigade",
        "season": 2005,
        "episode": 165,
        "released": "2005-11-29",
        "overview": ""
      },
      {
        "id": "tvmaze:121117",
        "title": "Alanis Morissette",
        "season": 2005,
        "episode": 166,
        "released": "2005-11-30",
        "overview": ""
      },
      {
        "id": "tvmaze:121118",
        "title": "Joe Rogan, Beck",
        "season": 2005,
        "episode": 167,
        "released": "2005-12-02",
        "overview": ""
      },
      {
        "id": "tvmaze:121119",
        "title": "Ted Danson, Julie Bowen, Floetry",
        "season": 2005,
        "episode": 168,
        "released": "2005-12-05",
        "overview": ""
      },
      {
        "id": "tvmaze:121120",
        "title": "Larry King, Adam Goldberg, Shawn King",
        "season": 2005,
        "episode": 169,
        "released": "2005-12-06",
        "overview": ""
      },
      {
        "id": "tvmaze:121121",
        "title": "Paula Abdul, Balthazar Getty, Faith Evans",
        "season": 2005,
        "episode": 170,
        "released": "2005-12-07",
        "overview": ""
      },
      {
        "id": "tvmaze:121122",
        "title": "Fort Minor",
        "season": 2005,
        "episode": 171,
        "released": "2005-12-09",
        "overview": ""
      },
      {
        "id": "tvmaze:121123",
        "title": "Korn",
        "season": 2005,
        "episode": 172,
        "released": "2005-12-12",
        "overview": ""
      },
      {
        "id": "tvmaze:121124",
        "title": "Howie Mandel, LaDainian Tomlinson, Death Cab for Cutie",
        "season": 2005,
        "episode": 173,
        "released": "2005-12-13",
        "overview": ""
      },
      {
        "id": "tvmaze:121125",
        "title": "David Krumholtz, Cypress Hill",
        "season": 2005,
        "episode": 174,
        "released": "2005-12-14",
        "overview": ""
      },
      {
        "id": "tvmaze:121126",
        "title": "Camryn Manheim, Christopher Masterson, Anthony Hamilton",
        "season": 2005,
        "episode": 175,
        "released": "2005-12-16",
        "overview": ""
      },
      {
        "id": "tvmaze:121127",
        "title": "Dermot Mulroney, Joe Hachem, Upright Citizens Brigade",
        "season": 2005,
        "episode": 176,
        "released": "2005-12-19",
        "overview": ""
      },
      {
        "id": "tvmaze:121128",
        "title": "Adam Carolla, Tommy Lasorda, Juelz Santana",
        "season": 2005,
        "episode": 177,
        "released": "2005-12-20",
        "overview": ""
      },
      {
        "id": "tvmaze:121129",
        "title": "Andy Dick, Maria Sharapova, The Dan Band",
        "season": 2005,
        "episode": 178,
        "released": "2005-12-21",
        "overview": ""
      },
      {
        "id": "tvmaze:121130",
        "title": "Ryan Seacrest, Brian Wilson",
        "season": 2005,
        "episode": 179,
        "released": "2005-12-23",
        "overview": ""
      },
      {
        "id": "tvmaze:121131",
        "title": "Al Sharpton, Kenny Mayne",
        "season": 2006,
        "episode": 1,
        "released": "2006-01-03",
        "overview": ""
      },
      {
        "id": "tvmaze:121132",
        "title": "Carmen Electra, Autolux",
        "season": 2006,
        "episode": 2,
        "released": "2006-01-04",
        "overview": ""
      },
      {
        "id": "tvmaze:121133",
        "title": "John Mayer Trio",
        "season": 2006,
        "episode": 3,
        "released": "2006-01-05",
        "overview": ""
      },
      {
        "id": "tvmaze:121134",
        "title": "Cheryl Hines, David Banner",
        "season": 2006,
        "episode": 4,
        "released": "2006-01-06",
        "overview": ""
      },
      {
        "id": "tvmaze:121135",
        "title": "Dominic Monaghan, Lil' Wayne",
        "season": 2006,
        "episode": 5,
        "released": "2006-01-09",
        "overview": ""
      },
      {
        "id": "tvmaze:121136",
        "title": "Quentin Tarantino, Tia Carrere, John Daly",
        "season": 2006,
        "episode": 6,
        "released": "2006-01-10",
        "overview": ""
      },
      {
        "id": "tvmaze:121137",
        "title": "David Boreanaz, Henry Phillips",
        "season": 2006,
        "episode": 7,
        "released": "2006-01-11",
        "overview": ""
      },
      {
        "id": "tvmaze:121138",
        "title": "Evangeline Lilly, Jonathan Rhys-Meyers, Giant Drag",
        "season": 2006,
        "episode": 8,
        "released": "2006-01-13",
        "overview": ""
      },
      {
        "id": "tvmaze:121139",
        "title": "John Mayer Trio, Steve-O",
        "season": 2006,
        "episode": 9,
        "released": "2006-01-16",
        "overview": ""
      },
      {
        "id": "tvmaze:121140",
        "title": "Michael Chiklis, Roselyn Sanchez, Bo Bice",
        "season": 2006,
        "episode": 10,
        "released": "2006-01-17",
        "overview": ""
      },
      {
        "id": "tvmaze:121141",
        "title": "Adewale Akinnuoye-Agbaje, Drew Lachey, Chamillionaire ft. Lil' Flip",
        "season": 2006,
        "episode": 11,
        "released": "2006-01-18",
        "overview": ""
      },
      {
        "id": "tvmaze:121142",
        "title": "Method Man, Motion City Soundtrack, Jerry Bruckheimer",
        "season": 2006,
        "episode": 12,
        "released": "2006-01-20",
        "overview": ""
      },
      {
        "id": "tvmaze:121143",
        "title": "David Gest, Feist",
        "season": 2006,
        "episode": 13,
        "released": "2006-01-23",
        "overview": ""
      },
      {
        "id": "tvmaze:121144",
        "title": "Regis Philbin, Jordana Brewster, She Wants Revenge",
        "season": 2006,
        "episode": 14,
        "released": "2006-01-24",
        "overview": ""
      },
      {
        "id": "tvmaze:121145",
        "title": "Jerry Rice, Mike Epps, Mike O'Connell",
        "season": 2006,
        "episode": 15,
        "released": "2006-01-25",
        "overview": ""
      },
      {
        "id": "tvmaze:121146",
        "title": "Martin Lawrence, Dem Franchize Boyz ft. Bow Wow, Jermaine Dupri",
        "season": 2006,
        "episode": 16,
        "released": "2006-01-27",
        "overview": ""
      },
      {
        "id": "tvmaze:121147",
        "title": "Kid Rock, David Alan Grier",
        "season": 2006,
        "episode": 17,
        "released": "2006-01-31",
        "overview": ""
      },
      {
        "id": "tvmaze:121148",
        "title": "David Spade, Rob Schneider, Jon Heder, Dwele",
        "season": 2006,
        "episode": 18,
        "released": "2006-02-01",
        "overview": ""
      },
      {
        "id": "tvmaze:121149",
        "title": "Michael Irvin, Jeff Daniels, The Four Tops, Buddy Guy",
        "season": 2006,
        "episode": 19,
        "released": "2006-02-02",
        "overview": ""
      },
      {
        "id": "tvmaze:121150",
        "title": "Jessica Alba, Anthony Anderson, The Four Tops",
        "season": 2006,
        "episode": 20,
        "released": "2006-02-03",
        "overview": ""
      },
      {
        "id": "tvmaze:121151",
        "title": "SuperBowl Episode",
        "season": 2006,
        "episode": 21,
        "released": "2006-02-05",
        "overview": ""
      },
      {
        "id": "tvmaze:121152",
        "title": "Mischa Barton, Travis Barker & Shanna Moakler, James Blunt",
        "season": 2006,
        "episode": 22,
        "released": "2006-02-06",
        "overview": ""
      },
      {
        "id": "tvmaze:121153",
        "title": "Jorge Garcia, Dan Naturman, Nelly",
        "season": 2006,
        "episode": 23,
        "released": "2006-02-07",
        "overview": ""
      },
      {
        "id": "tvmaze:121154",
        "title": "Wilmer Valderrama, Dan Naturman, Golden Brooks, Dwight Yoakam",
        "season": 2006,
        "episode": 24,
        "released": "2006-02-08",
        "overview": ""
      },
      {
        "id": "tvmaze:121155",
        "title": "Nick Cannon, Kathy Griffin, Damian Marley",
        "season": 2006,
        "episode": 25,
        "released": "2006-02-09",
        "overview": ""
      },
      {
        "id": "tvmaze:121156",
        "title": "Steve Coogan, Travis Stork, Daddy Yankee",
        "season": 2006,
        "episode": 26,
        "released": "2006-02-10",
        "overview": ""
      },
      {
        "id": "tvmaze:121157",
        "title": "Freddie Prinze, Jr., John Daly, Jacks Mannequin",
        "season": 2006,
        "episode": 27,
        "released": "2006-02-13",
        "overview": ""
      },
      {
        "id": "tvmaze:121158",
        "title": "Flavor Flav",
        "season": 2006,
        "episode": 28,
        "released": "2006-02-14",
        "overview": ""
      },
      {
        "id": "tvmaze:121159",
        "title": "Fred Savage, Harold Perrineau Jr., Yellowcard",
        "season": 2006,
        "episode": 29,
        "released": "2006-02-15",
        "overview": ""
      },
      {
        "id": "tvmaze:121160",
        "title": "Jack Osbourne, Carolyn Murphy, Dem Franchize Boyz",
        "season": 2006,
        "episode": 30,
        "released": "2006-02-16",
        "overview": ""
      },
      {
        "id": "tvmaze:121161",
        "title": "Shaun White, Steve Harvey, Hawthorne Heights",
        "season": 2006,
        "episode": 31,
        "released": "2006-02-17",
        "overview": ""
      },
      {
        "id": "tvmaze:121162",
        "title": "Kathie Lee Gifford, Yehya Mohamed, Augustana",
        "season": 2006,
        "episode": 32,
        "released": "2006-02-21",
        "overview": ""
      },
      {
        "id": "tvmaze:121163",
        "title": "Simon Cowell, Jennifer Esposito, Dilated Peoples",
        "season": 2006,
        "episode": 33,
        "released": "2006-02-22",
        "overview": ""
      },
      {
        "id": "tvmaze:121164",
        "title": "Cuba Gooding Jr., Mike Birbiglia",
        "season": 2006,
        "episode": 34,
        "released": "2006-02-23",
        "overview": ""
      },
      {
        "id": "tvmaze:121165",
        "title": "Paul Walker, Hannah Teter, Bow Wow, Travis Barker",
        "season": 2006,
        "episode": 35,
        "released": "2006-02-24",
        "overview": ""
      },
      {
        "id": "tvmaze:121166",
        "title": "Kelly Ripa, Tracy Morgan",
        "season": 2006,
        "episode": 36,
        "released": "2006-02-27",
        "overview": ""
      },
      {
        "id": "tvmaze:121167",
        "title": "Stacy Keibler, Howie Mandel, Three Six Mafia",
        "season": 2006,
        "episode": 37,
        "released": "2006-02-28",
        "overview": ""
      },
      {
        "id": "tvmaze:121168",
        "title": "Jamie Oliver, Sasha Cohen, OK Go",
        "season": 2006,
        "episode": 38,
        "released": "2006-03-01",
        "overview": ""
      },
      {
        "id": "tvmaze:121169",
        "title": "After the Academy Awards",
        "season": 2006,
        "episode": 39,
        "released": "2006-03-05",
        "overview": ""
      },
      {
        "id": "tvmaze:121170",
        "title": "Zooey Deschanel, Dave Sheridan, Panic! At the Disco",
        "season": 2006,
        "episode": 40,
        "released": "2006-03-06",
        "overview": ""
      },
      {
        "id": "tvmaze:121171",
        "title": "Amanda Bynes, Chuck Lidell, Jamie Cullum",
        "season": 2006,
        "episode": 41,
        "released": "2006-03-07",
        "overview": ""
      },
      {
        "id": "tvmaze:121172",
        "title": "Michael Rapaport, Elisha Cuthbert, Matisyahu",
        "season": 2006,
        "episode": 42,
        "released": "2006-03-08",
        "overview": ""
      },
      {
        "id": "tvmaze:121173",
        "title": "John Lydon, Orlando Jones, Jim Gaffigan",
        "season": 2006,
        "episode": 43,
        "released": "2006-03-10",
        "overview": ""
      },
      {
        "id": "tvmaze:121174",
        "title": "Ice Cube, Elantu B. Veovode, Nine Black Alps",
        "season": 2006,
        "episode": 44,
        "released": "2006-03-13",
        "overview": ""
      },
      {
        "id": "tvmaze:121175",
        "title": "Adam Brody, John Cena, Juvenile featuring Galactic",
        "season": 2006,
        "episode": 45,
        "released": "2006-03-14",
        "overview": ""
      },
      {
        "id": "tvmaze:121176",
        "title": "Randy Jackson, Janet Reno, Hard-Fi",
        "season": 2006,
        "episode": 46,
        "released": "2006-03-15",
        "overview": ""
      },
      {
        "id": "tvmaze:121177",
        "title": "James Caan, Justin Chambers, The Tossers",
        "season": 2006,
        "episode": 47,
        "released": "2006-03-17",
        "overview": ""
      },
      {
        "id": "tvmaze:121178",
        "title": "Hulk Hogan, Yunjin Kim, Harold & Darrell Allen",
        "season": 2006,
        "episode": 48,
        "released": "2006-03-20",
        "overview": ""
      },
      {
        "id": "tvmaze:121179",
        "title": "George Lopez, Duane \"Dog\" Chapman, the Sounds",
        "season": 2006,
        "episode": 49,
        "released": "2006-03-21",
        "overview": ""
      },
      {
        "id": "tvmaze:121180",
        "title": "Jamie-Lynn Sigler, Larry the Cable Guy, Gogol Bordello",
        "season": 2006,
        "episode": 50,
        "released": "2006-03-22",
        "overview": ""
      },
      {
        "id": "tvmaze:121181",
        "title": "Kiefer Sutherland, Rocco DeLuca",
        "season": 2006,
        "episode": 51,
        "released": "2006-03-24",
        "overview": ""
      },
      {
        "id": "tvmaze:121182",
        "title": "Seth Green, Chop from \"King of Cars,\" Anthony Jeselnik, John Anderson",
        "season": 2006,
        "episode": 52,
        "released": "2006-04-03",
        "overview": ""
      },
      {
        "id": "tvmaze:121183",
        "title": "Anthony Anderson, Pete Rose",
        "season": 2006,
        "episode": 53,
        "released": "2006-04-04",
        "overview": ""
      },
      {
        "id": "tvmaze:121184",
        "title": "Carmen Electra, David Gest, People in Planes",
        "season": 2006,
        "episode": 54,
        "released": "2006-04-05",
        "overview": ""
      },
      {
        "id": "tvmaze:121185",
        "title": "Tori Spelling, C. Thomas Howell, T.I.",
        "season": 2006,
        "episode": 55,
        "released": "2006-04-07",
        "overview": ""
      },
      {
        "id": "tvmaze:121186",
        "title": "Rebecca Romijn, Judge Marilyn Milian, T-Pain",
        "season": 2006,
        "episode": 56,
        "released": "2006-04-10",
        "overview": ""
      },
      {
        "id": "tvmaze:121187",
        "title": "Chris Matthews, Craig Bierko",
        "season": 2006,
        "episode": 57,
        "released": "2006-04-11",
        "overview": ""
      },
      {
        "id": "tvmaze:121188",
        "title": "Wilmer Valderamma, Chris Elliott, The Wiggles",
        "season": 2006,
        "episode": 58,
        "released": "2006-04-12",
        "overview": ""
      },
      {
        "id": "tvmaze:121189",
        "title": "Charlie Sheen, Rube Goldberg Contest winners, K.T. Tunstall",
        "season": 2006,
        "episode": 59,
        "released": "2006-04-14",
        "overview": ""
      },
      {
        "id": "tvmaze:121190",
        "title": "Paula Abdul, Enrico Colantoni, Mighty Gonzalez",
        "season": 2006,
        "episode": 60,
        "released": "2006-04-17",
        "overview": ""
      },
      {
        "id": "tvmaze:121191",
        "title": "Cheryl Hines, Landon Donovan, Bril",
        "season": 2006,
        "episode": 61,
        "released": "2006-04-18",
        "overview": ""
      },
      {
        "id": "tvmaze:121192",
        "title": "Eva Longoria, Dick Cavett, Dresden Dolls",
        "season": 2006,
        "episode": 62,
        "released": "2006-04-19",
        "overview": ""
      },
      {
        "id": "tvmaze:121193",
        "title": "Regis Philbin, Barry Watson, Mike Birbiglia",
        "season": 2006,
        "episode": 63,
        "released": "2006-04-21",
        "overview": ""
      },
      {
        "id": "tvmaze:121194",
        "title": "Natasha Henstridge, Robert Wuhl, the cast of MTV's \"Call to Greatness\"",
        "season": 2006,
        "episode": 64,
        "released": "2006-04-24",
        "overview": ""
      },
      {
        "id": "tvmaze:121195",
        "title": "LL Cool J, Robert Klein",
        "season": 2006,
        "episode": 65,
        "released": "2006-04-25",
        "overview": ""
      },
      {
        "id": "tvmaze:121196",
        "title": "Guy Pearce, Ludacris, Atmosphere",
        "season": 2006,
        "episode": 66,
        "released": "2006-04-26",
        "overview": ""
      },
      {
        "id": "tvmaze:121197",
        "title": "Susan Lucci, Adam Carolla, Rihanna",
        "season": 2006,
        "episode": 67,
        "released": "2006-04-27",
        "overview": ""
      },
      {
        "id": "tvmaze:121198",
        "title": "Joe Gannascoli, Kellie Pickler, Adam Carolla, Godsmack",
        "season": 2006,
        "episode": 68,
        "released": "2006-04-28",
        "overview": ""
      },
      {
        "id": "tvmaze:121199",
        "title": "Jenny McCarthy, Seth MacFarlane, The Cult",
        "season": 2006,
        "episode": 69,
        "released": "2006-05-01",
        "overview": ""
      },
      {
        "id": "tvmaze:121200",
        "title": "Sir Ian McKellen, Jared Leto, Franz Ferdinand",
        "season": 2006,
        "episode": 70,
        "released": "2006-05-02",
        "overview": ""
      },
      {
        "id": "tvmaze:121201",
        "title": "Chris O'Donnell, American Chopper Guys",
        "season": 2006,
        "episode": 71,
        "released": "2006-05-03",
        "overview": ""
      },
      {
        "id": "tvmaze:121202",
        "title": "Kathie Lee Gifford, Isaiah Washington, Art Brut",
        "season": 2006,
        "episode": 72,
        "released": "2006-05-04",
        "overview": ""
      },
      {
        "id": "tvmaze:121203",
        "title": "Famke Janssen, Jared Leto, 30 Seconds to Mars",
        "season": 2006,
        "episode": 73,
        "released": "2006-05-05",
        "overview": ""
      },
      {
        "id": "tvmaze:121204",
        "title": "Carl Reiner, Ashley Tisdale, Ivan Kane's Royal Jelly dancers, Martin Fry",
        "season": 2006,
        "episode": 74,
        "released": "2006-05-08",
        "overview": ""
      },
      {
        "id": "tvmaze:121205",
        "title": "Reggie Bush, Pat O'Brien, Lacuna Coil",
        "season": 2006,
        "episode": 75,
        "released": "2006-05-09",
        "overview": ""
      },
      {
        "id": "tvmaze:121206",
        "title": "Jamie Kennedy, Daryl Hannah, Jonathan Rice",
        "season": 2006,
        "episode": 76,
        "released": "2006-05-10",
        "overview": ""
      },
      {
        "id": "tvmaze:121207",
        "title": "Rev. Jesse Jackson, Jimmy Bennett, Nick Lachey",
        "season": 2006,
        "episode": 77,
        "released": "2006-05-11",
        "overview": ""
      },
      {
        "id": "tvmaze:121208",
        "title": "Dominic Monaghan, J.J. Abrams, Taking Back Sunday",
        "season": 2006,
        "episode": 78,
        "released": "2006-05-12",
        "overview": ""
      },
      {
        "id": "tvmaze:121209",
        "title": "Katherine Heigl, James Pickens Jr., Chandra Wilson, Ben Lee",
        "season": 2006,
        "episode": 79,
        "released": "2006-05-15",
        "overview": ""
      },
      {
        "id": "tvmaze:121210",
        "title": "Drew Carey, Malcolm David Kelley, Christina Milian",
        "season": 2006,
        "episode": 80,
        "released": "2006-05-17",
        "overview": ""
      },
      {
        "id": "tvmaze:121211",
        "title": "Teri Hatcher, Umphrey's McGee featuring Huey Lewis",
        "season": 2006,
        "episode": 81,
        "released": "2006-05-18",
        "overview": ""
      },
      {
        "id": "tvmaze:121212",
        "title": "Sarah Silverman, Artie Lange, Hoobastank",
        "season": 2006,
        "episode": 82,
        "released": "2006-05-19",
        "overview": ""
      },
      {
        "id": "tvmaze:121213",
        "title": "Sarah Silverman, James Cramer, Denny \"Average Homeboy\" Blaze",
        "season": 2006,
        "episode": 83,
        "released": "2006-05-22",
        "overview": ""
      },
      {
        "id": "tvmaze:121214",
        "title": "Julia Stiles, Jason Ritter, Atreyu",
        "season": 2006,
        "episode": 84,
        "released": "2006-05-23",
        "overview": ""
      },
      {
        "id": "tvmaze:121215",
        "title": "Jon Favreau, Mike Iaconelli, Elefant",
        "season": 2006,
        "episode": 85,
        "released": "2006-05-24",
        "overview": ""
      },
      {
        "id": "tvmaze:121216",
        "title": "Dane Cook, Brett Ratner",
        "season": 2006,
        "episode": 86,
        "released": "2006-05-26",
        "overview": ""
      },
      {
        "id": "tvmaze:121217",
        "title": "Ice Cube, Paget Brewster",
        "season": 2006,
        "episode": 87,
        "released": "2006-06-06",
        "overview": ""
      },
      {
        "id": "tvmaze:121218",
        "title": "Jessica Alba, Larry the Cable Guy, Him",
        "season": 2006,
        "episode": 88,
        "released": "2006-06-07",
        "overview": ""
      },
      {
        "id": "tvmaze:121219",
        "title": "Rosie Perez, Jared Hess, Elefant",
        "season": 2006,
        "episode": 89,
        "released": "2006-06-08",
        "overview": ""
      },
      {
        "id": "tvmaze:121220",
        "title": "John C. Reilly, Gary Gulman",
        "season": 2006,
        "episode": 90,
        "released": "2006-06-09",
        "overview": ""
      },
      {
        "id": "tvmaze:121221",
        "title": "Jaime Pressly, Xzibit, The Streets",
        "season": 2006,
        "episode": 91,
        "released": "2006-06-13",
        "overview": ""
      },
      {
        "id": "tvmaze:121222",
        "title": "Luke Perry, Jean Smart, Huey Lewis",
        "season": 2006,
        "episode": 92,
        "released": "2006-06-14",
        "overview": ""
      },
      {
        "id": "tvmaze:121223",
        "title": "Jack Black, Wolfmother",
        "season": 2006,
        "episode": 93,
        "released": "2006-06-15",
        "overview": ""
      },
      {
        "id": "tvmaze:121224",
        "title": "Fiona Apple",
        "season": 2006,
        "episode": 94,
        "released": "2006-06-16",
        "overview": ""
      },
      {
        "id": "tvmaze:121225",
        "title": "Ozzy Osbourne, Anthony Bourdain",
        "season": 2006,
        "episode": 95,
        "released": "2006-06-20",
        "overview": ""
      },
      {
        "id": "tvmaze:121226",
        "title": "Bonnie Hunt, Phil Gordon, Buckcherry",
        "season": 2006,
        "episode": 96,
        "released": "2006-06-21",
        "overview": ""
      },
      {
        "id": "tvmaze:121227",
        "title": "Geena Davis, Louis C.K., Jeff Corwin",
        "season": 2006,
        "episode": 97,
        "released": "2006-06-22",
        "overview": ""
      },
      {
        "id": "tvmaze:121228",
        "title": "Mariah Carey, Rob Zombie",
        "season": 2006,
        "episode": 98,
        "released": "2006-06-23",
        "overview": ""
      },
      {
        "id": "tvmaze:121229",
        "title": "Jason Alexander, Meagan Good, Jamie Kennedy",
        "season": 2006,
        "episode": 99,
        "released": "2006-06-26",
        "overview": ""
      },
      {
        "id": "tvmaze:121230",
        "title": "Tommy Lee, 98-year-old high school student Josephine Belasco, Greg Fitzsimmons, the Fixx",
        "season": 2006,
        "episode": 100,
        "released": "2006-06-27",
        "overview": ""
      },
      {
        "id": "tvmaze:121231",
        "title": "George Foreman, psychotherapist Richard Cohen, Blue October",
        "season": 2006,
        "episode": 101,
        "released": "2006-06-28",
        "overview": ""
      },
      {
        "id": "tvmaze:121232",
        "title": "Kathy Griffin, Jason Gray-Stanford, the Brand New Heavies",
        "season": 2006,
        "episode": 102,
        "released": "2006-06-30",
        "overview": ""
      },
      {
        "id": "tvmaze:121233",
        "title": "Ed Burns, NBA Finals MVP Dwayne Wade, Flyleaf",
        "season": 2006,
        "episode": 103,
        "released": "2006-07-10",
        "overview": ""
      },
      {
        "id": "tvmaze:121234",
        "title": "Tracy Morgan, Shaun Alexander, Sonic Youth",
        "season": 2006,
        "episode": 104,
        "released": "2006-07-11",
        "overview": ""
      },
      {
        "id": "tvmaze:121235",
        "title": "Lance Armstrong, Matt Dallas, Smoosh",
        "season": 2006,
        "episode": 105,
        "released": "2006-07-12",
        "overview": ""
      },
      {
        "id": "tvmaze:121236",
        "title": "Brittany Murphy, Danica Patrick, Eagles of Death Metal",
        "season": 2006,
        "episode": 106,
        "released": "2006-07-14",
        "overview": ""
      },
      {
        "id": "tvmaze:121237",
        "title": "Terrell Owens, Rainn Wilson, Rascal Flatts",
        "season": 2006,
        "episode": 107,
        "released": "2006-07-17",
        "overview": ""
      },
      {
        "id": "tvmaze:121238",
        "title": "Shawn & Marlon Wayans, Fred Willard, Korn",
        "season": 2006,
        "episode": 108,
        "released": "2006-07-18",
        "overview": ""
      },
      {
        "id": "tvmaze:121239",
        "title": "Robin Williams, Anna Faris, Rhymefest",
        "season": 2006,
        "episode": 109,
        "released": "2006-07-19",
        "overview": ""
      },
      {
        "id": "tvmaze:121240",
        "title": "Allison Janney, Morgan Spurlock, Jurassic 5",
        "season": 2006,
        "episode": 110,
        "released": "2006-07-21",
        "overview": ""
      },
      {
        "id": "tvmaze:121241",
        "title": "Rosario Dawson, Jesse Metcalf, the Flaming Lips",
        "season": 2006,
        "episode": 111,
        "released": "2006-07-24",
        "overview": ""
      },
      {
        "id": "tvmaze:121242",
        "title": "Gene Simmons, Jeff Ross, the Elected",
        "season": 2006,
        "episode": 112,
        "released": "2006-07-25",
        "overview": ""
      },
      {
        "id": "tvmaze:121243",
        "title": "Jon Cryer, the Dudesons, Los Lonely Boys",
        "season": 2006,
        "episode": 113,
        "released": "2006-07-26",
        "overview": ""
      },
      {
        "id": "tvmaze:121244",
        "title": "Regis Philbin, Trevor Fehrman, Pharrell",
        "season": 2006,
        "episode": 114,
        "released": "2006-07-28",
        "overview": ""
      },
      {
        "id": "tvmaze:121245",
        "title": "Flavor Flav, Leslie Bibb, Ben Harper",
        "season": 2006,
        "episode": 115,
        "released": "2006-07-31",
        "overview": ""
      },
      {
        "id": "tvmaze:121246",
        "title": "Sandra Oh, Jewel",
        "season": 2006,
        "episode": 116,
        "released": "2006-08-01",
        "overview": ""
      },
      {
        "id": "tvmaze:121247",
        "title": "Cheryl Hines, Shaun White, Russell Peters",
        "season": 2006,
        "episode": 117,
        "released": "2006-08-02",
        "overview": ""
      },
      {
        "id": "tvmaze:121248",
        "title": "Will Ferrell, Bobby Cannavale, Under the Influence of Giants",
        "season": 2006,
        "episode": 118,
        "released": "2006-08-04",
        "overview": ""
      },
      {
        "id": "tvmaze:121249",
        "title": "Matt Dillon, Justin Long, Ziggy Marley",
        "season": 2006,
        "episode": 119,
        "released": "2006-08-14",
        "overview": ""
      },
      {
        "id": "tvmaze:121250",
        "title": "Jonathan Winters, Kenan Thompson, Against Me!",
        "season": 2006,
        "episode": 120,
        "released": "2006-08-15",
        "overview": ""
      },
      {
        "id": "tvmaze:121251",
        "title": "Paul Reubens, snake handler Jules Sylvester, Obie Trice, Leonid \"the Magnificent\" Filatov",
        "season": 2006,
        "episode": 121,
        "released": "2006-08-16",
        "overview": ""
      },
      {
        "id": "tvmaze:121252",
        "title": "Samuel L. Jackson, Elisha Cuthbert, Cobra Starship",
        "season": 2006,
        "episode": 122,
        "released": "2006-08-18",
        "overview": ""
      },
      {
        "id": "tvmaze:121253",
        "title": "Heidi Klum, Dave Navarro, Panic Channel",
        "season": 2006,
        "episode": 123,
        "released": "2006-08-21",
        "overview": ""
      },
      {
        "id": "tvmaze:121254",
        "title": "Hillary Duff, Ultimate Fighting Champion Chuck Lidell, Anti-Flag",
        "season": 2006,
        "episode": 124,
        "released": "2006-08-22",
        "overview": ""
      },
      {
        "id": "tvmaze:121255",
        "title": "Tom Cavanaugh, Tommy Chong, Cartel",
        "season": 2006,
        "episode": 125,
        "released": "2006-08-23",
        "overview": ""
      },
      {
        "id": "tvmaze:121256",
        "title": "Anthony Michael Hall, Joan & Melissa Rivers, the Red Jumpsuit Apparatus",
        "season": 2006,
        "episode": 126,
        "released": "2006-08-25",
        "overview": ""
      },
      {
        "id": "tvmaze:121257",
        "title": "Kevin Nealon, Jay Chandrasekhar, Pat Green",
        "season": 2006,
        "episode": 127,
        "released": "2006-08-29",
        "overview": ""
      },
      {
        "id": "tvmaze:121258",
        "title": "Tommy Lee, Wayne Brady, Starsailor",
        "season": 2006,
        "episode": 128,
        "released": "2006-08-30",
        "overview": ""
      },
      {
