{
  "meta": {
    "id": "tvmaze:17336",
    "type": "series",
    "name": "The Chase Australia",
    "description": "It's a hit with audiences around the globe – now the general knowledge game show with a difference lands on our shores with The Chase Australia, hosted by Larry Emdur.",
    "poster": "https://static.tvmaze.com/uploads/images/original_untouched/58/146212.jpg",
    "background": "https://static.tvmaze.com/uploads/images/original_untouched/58/146212.jpg",
    "videos": [
      {
        "id": "tvmaze:3462067",
        "title": "Episode 103",
        "season": 15,
        "episode": 103,
        "released": "2025-12-15",
        "overview": ""
      },
      {
        "id": "tvmaze:3462068",
        "title": "Episode 104",
        "season": 15,
        "episode": 104,
        "released": "2025-12-16",
        "overview": ""
      },
      {
        "id": "tvmaze:3462069",
        "title": "Episode 105",
        "season": 15,
        "episode": 105,
        "released": "2025-12-17",
        "overview": ""
      },
      {
        "id": "tvmaze:3462067",
        "title": "Episode 103",
        "season": 15,
        "episode": 103,
        "released": "2025-12-15",
        "overview": ""
      },
      {
        "id": "tvmaze:3462068",
        "title": "Episode 104",
        "season": 15,
        "episode": 104,
        "released": "2025-12-16",
        "overview": ""
      },
      {
        "id": "tvmaze:3462069",
        "title": "Episode 105",
        "season": 15,
        "episode": 105,
        "released": "2025-12-17",
        "overview": ""
      },
      {
        "id": "tvmaze:3462066",
        "title": "Episode 102",
        "season": 15,
        "episode": 102,
        "released": "2025-12-10",
        "overview": ""
      },
      {
        "id": "tvmaze:3462067",
        "title": "Episode 103",
        "season": 15,
        "episode": 103,
        "released": "2025-12-15",
        "overview": ""
      },
      {
        "id": "tvmaze:3462068",
        "title": "Episode 104",
        "season": 15,
        "episode": 104,
        "released": "2025-12-16",
        "overview": ""
      },
      {
        "id": "tvmaze:3462069",
        "title": "Episode 105",
        "season": 15,
        "episode": 105,
        "released": "2025-12-17",
        "overview": ""
      },
      {
        "id": "tvmaze:3462066",
        "title": "Episode 102",
        "season": 15,
        "episode": 102,
        "released": "2025-12-10",
        "overview": ""
      },
      {
        "id": "tvmaze:3462067",
        "title": "Episode 103",
        "season": 15,
        "episode": 103,
        "released": "2025-12-15",
        "overview": ""
      },
      {
        "id": "tvmaze:3462068",
        "title": "Episode 104",
        "season": 15,
        "episode": 104,
        "released": "2025-12-16",
        "overview": ""
      },
      {
        "id": "tvmaze:3462069",
        "title": "Episode 105",
        "season": 15,
        "episode": 105,
        "released": "2025-12-17",
        "overview": ""
      },
      {
        "id": "tvmaze:3462066",
        "title": "Episode 102",
        "season": 15,
        "episode": 102,
        "released": "2025-12-10",
        "overview": ""
      },
      {
        "id": "tvmaze:3462067",
        "title": "Episode 103",
        "season": 15,
        "episode": 103,
        "released": "2025-12-15",
        "overview": ""
      },
      {
        "id": "tvmaze:3462068",
        "title": "Episode 104",
        "season": 15,
        "episode": 104,
        "released": "2025-12-16",
        "overview": ""
      },
      {
        "id": "tvmaze:3462069",
        "title": "Episode 105",
        "season": 15,
        "episode": 105,
        "released": "2025-12-17",
        "overview": ""
      },
      {
        "id": "tvmaze:3462066",
        "title": "Episode 102",
        "season": 15,
        "episode": 102,
        "released": "2025-12-10",
        "overview": ""
      },
      {
        "id": "tvmaze:3462067",
        "title": "Episode 103",
        "season": 15,
        "episode": 103,
        "released": "2025-12-15",
        "overview": ""
      },
      {
        "id": "tvmaze:3462068",
        "title": "Episode 104",
        "season": 15,
        "episode": 104,
        "released": "2025-12-16",
        "overview": ""
      },
      {
        "id": "tvmaze:3462069",
        "title": "Episode 105",
        "season": 15,
        "episode": 105,
        "released": "2025-12-17",
        "overview": ""
      },
      {
        "id": "tvmaze:3462066",
        "title": "Episode 102",
        "season": 15,
        "episode": 102,
        "released": "2025-12-10",
        "overview": ""
      },
      {
        "id": "tvmaze:3462067",
        "title": "Episode 103",
        "season": 15,
        "episode": 103,
        "released": "2025-12-15",
        "overview": ""
      },
      {
        "id": "tvmaze:3462068",
        "title": "Episode 104",
        "season": 15,
        "episode": 104,
        "released": "2025-12-16",
        "overview": ""
      },
      {
        "id": "tvmaze:3462069",
        "title": "Episode 105",
        "season": 15,
        "episode": 105,
        "released": "2025-12-17",
        "overview": ""
      },
      {
        "id": "tvmaze:3462066",
        "title": "Episode 102",
        "season": 15,
        "episode": 102,
        "released": "2025-12-10",
        "overview": ""
      },
      {
        "id": "tvmaze:3462067",
        "title": "Episode 103",
        "season": 15,
        "episode": 103,
        "released": "2025-12-15",
        "overview": ""
      },
      {
        "id": "tvmaze:3462068",
        "title": "Episode 104",
        "season": 15,
        "episode": 104,
        "released": "2025-12-16",
        "overview": ""
      },
      {
        "id": "tvmaze:3462069",
        "title": "Episode 105",
        "season": 15,
        "episode": 105,
        "released": "2025-12-17",
        "overview": ""
      },
      {
        "id": "tvmaze:3462066",
        "title": "Episode 102",
        "season": 15,
        "episode": 102,
        "released": "2025-12-10",
        "overview": ""
      },
      {
        "id": "tvmaze:3462067",
        "title": "Episode 103",
        "season": 15,
        "episode": 103,
        "released": "2025-12-15",
        "overview": ""
      },
      {
        "id": "tvmaze:3462068",
        "title": "Episode 104",
        "season": 15,
        "episode": 104,
        "released": "2025-12-16",
        "overview": ""
      },
      {
        "id": "tvmaze:3462069",
        "title": "Episode 105",
        "season": 15,
        "episode": 105,
        "released": "2025-12-17",
        "overview": ""
      },
      {
        "id": "tvmaze:3462066",
        "title": "Episode 102",
        "season": 15,
        "episode": 102,
        "released": "2025-12-10",
        "overview": ""
      },
      {
        "id": "tvmaze:3462067",
        "title": "Episode 103",
        "season": 15,
        "episode": 103,
        "released": "2025-12-15",
        "overview": ""
      },
      {
        "id": "tvmaze:3462068",
        "title": "Episode 104",
        "season": 15,
        "episode": 104,
        "released": "2025-12-16",
        "overview": ""
      },
      {
        "id": "tvmaze:3462069",
        "title": "Episode 105",
        "season": 15,
        "episode": 105,
        "released": "2025-12-17",
        "overview": ""
      },
      {
        "id": "tvmaze:790241",
        "title": "Episode 1",
        "season": 1,
        "episode": 1,
        "released": "2015-09-14",
        "overview": ""
      },
      {
        "id": "tvmaze:790242",
        "title": "Episode 9",
        "season": 3,
        "episode": 9,
        "released": "2016-05-23",
        "overview": ""
      },
      {
        "id": "tvmaze:790243",
        "title": "Episode 10",
        "season": 3,
        "episode": 10,
        "released": "2016-05-24",
        "overview": ""
      },
      {
        "id": "tvmaze:790244",
        "title": "Episode 11",
        "season": 3,
        "episode": 11,
        "released": "2016-05-25",
        "overview": ""
      },
      {
        "id": "tvmaze:790245",
        "title": "Episode 12",
        "season": 3,
        "episode": 12,
        "released": "2016-05-26",
        "overview": ""
      },
      {
        "id": "tvmaze:790246",
        "title": "Episode 13",
        "season": 3,
        "episode": 13,
        "released": "2016-05-27",
        "overview": ""
      },
      {
        "id": "tvmaze:802076",
        "title": "Episode 14",
        "season": 3,
        "episode": 14,
        "released": "2016-05-31",
        "overview": ""
      },
      {
        "id": "tvmaze:802077",
        "title": "Episode 15",
        "season": 3,
        "episode": 15,
        "released": "2016-06-01",
        "overview": ""
      },
      {
        "id": "tvmaze:802078",
        "title": "Episode 16",
        "season": 3,
        "episode": 16,
        "released": "2016-06-02",
        "overview": ""
      },
      {
        "id": "tvmaze:802079",
        "title": "Episode 17",
        "season": 3,
        "episode": 17,
        "released": "2016-06-03",
        "overview": ""
      },
      {
        "id": "tvmaze:814262",
        "title": "Episode 18",
        "season": 3,
        "episode": 18,
        "released": "2016-06-07",
        "overview": ""
      },
      {
        "id": "tvmaze:814263",
        "title": "Episode 19",
        "season": 3,
        "episode": 19,
        "released": "2016-06-08",
        "overview": ""
      },
      {
        "id": "tvmaze:814264",
        "title": "Episode 20",
        "season": 3,
        "episode": 20,
        "released": "2016-06-09",
        "overview": ""
      },
      {
        "id": "tvmaze:814265",
        "title": "Episode 21",
        "season": 3,
        "episode": 21,
        "released": "2016-06-10",
        "overview": ""
      },
      {
        "id": "tvmaze:825110",
        "title": "Episode 22",
        "season": 3,
        "episode": 22,
        "released": "2016-06-14",
        "overview": ""
      },
      {
        "id": "tvmaze:825111",
        "title": "Episode 23",
        "season": 3,
        "episode": 23,
        "released": "2016-06-15",
        "overview": ""
      },
      {
        "id": "tvmaze:825112",
        "title": "Episode 24",
        "season": 3,
        "episode": 24,
        "released": "2016-06-16",
        "overview": ""
      },
      {
        "id": "tvmaze:835598",
        "title": "Episode 25",
        "season": 3,
        "episode": 25,
        "released": "2016-06-20",
        "overview": ""
      },
      {
        "id": "tvmaze:835599",
        "title": "Episode 26",
        "season": 3,
        "episode": 26,
        "released": "2016-06-21",
        "overview": ""
      },
      {
        "id": "tvmaze:835600",
        "title": "Episode 27",
        "season": 3,
        "episode": 27,
        "released": "2016-06-22",
        "overview": ""
      },
      {
        "id": "tvmaze:835601",
        "title": "Episode 28",
        "season": 3,
        "episode": 28,
        "released": "2016-06-23",
        "overview": ""
      },
      {
        "id": "tvmaze:835602",
        "title": "Episode 29",
        "season": 3,
        "episode": 29,
        "released": "2016-06-24",
        "overview": ""
      },
      {
        "id": "tvmaze:840555",
        "title": "Episode 30",
        "season": 3,
        "episode": 30,
        "released": "2016-06-27",
        "overview": ""
      },
      {
        "id": "tvmaze:840556",
        "title": "Episode 31",
        "season": 3,
        "episode": 31,
        "released": "2016-06-28",
        "overview": ""
      },
      {
        "id": "tvmaze:840557",
        "title": "Episode 32",
        "season": 3,
        "episode": 32,
        "released": "2016-06-29",
        "overview": ""
      },
      {
        "id": "tvmaze:840558",
        "title": "Episode 33",
        "season": 3,
        "episode": 33,
        "released": "2016-06-30",
        "overview": ""
      },
      {
        "id": "tvmaze:840559",
        "title": "Episode 34",
        "season": 3,
        "episode": 34,
        "released": "2016-07-01",
        "overview": ""
      },
      {
        "id": "tvmaze:847766",
        "title": "Episode 35",
        "season": 3,
        "episode": 35,
        "released": "2016-07-04",
        "overview": ""
      },
      {
        "id": "tvmaze:847767",
        "title": "Episode 36",
        "season": 3,
        "episode": 36,
        "released": "2016-07-05",
        "overview": ""
      },
      {
        "id": "tvmaze:847768",
        "title": "Episode 37",
        "season": 3,
        "episode": 37,
        "released": "2016-07-11",
        "overview": ""
      },
      {
        "id": "tvmaze:847769",
        "title": "Episode 38",
        "season": 3,
        "episode": 38,
        "released": "2016-07-12",
        "overview": ""
      },
      {
        "id": "tvmaze:847770",
        "title": "Episode 39",
        "season": 3,
        "episode": 39,
        "released": "2016-07-13",
        "overview": ""
      },
      {
        "id": "tvmaze:873538",
        "title": "Episode 40",
        "season": 3,
        "episode": 40,
        "released": "2016-07-14",
        "overview": ""
      },
      {
        "id": "tvmaze:873539",
        "title": "Episode 41",
        "season": 3,
        "episode": 41,
        "released": "2016-07-18",
        "overview": ""
      },
      {
        "id": "tvmaze:873541",
        "title": "Episode 42",
        "season": 3,
        "episode": 42,
        "released": "2016-07-19",
        "overview": ""
      },
      {
        "id": "tvmaze:873542",
        "title": "Episode 43",
        "season": 3,
        "episode": 43,
        "released": "2016-07-19",
        "overview": ""
      },
      {
        "id": "tvmaze:873543",
        "title": "Episode 44",
        "season": 3,
        "episode": 44,
        "released": "2016-07-21",
        "overview": ""
      },
      {
        "id": "tvmaze:873544",
        "title": "Episode 45",
        "season": 3,
        "episode": 45,
        "released": "2016-07-25",
        "overview": ""
      },
      {
        "id": "tvmaze:873545",
        "title": "Episode 46",
        "season": 3,
        "episode": 46,
        "released": "2016-07-26",
        "overview": ""
      },
      {
        "id": "tvmaze:873546",
        "title": "Episode 47",
        "season": 3,
        "episode": 47,
        "released": "2016-07-27",
        "overview": ""
      },
      {
        "id": "tvmaze:873547",
        "title": "Episode 48",
        "season": 3,
        "episode": 48,
        "released": "2016-07-28",
        "overview": ""
      },
      {
        "id": "tvmaze:873548",
        "title": "Episode 49",
        "season": 3,
        "episode": 49,
        "released": "2016-08-01",
        "overview": ""
      },
      {
        "id": "tvmaze:873549",
        "title": "Episode 50",
        "season": 3,
        "episode": 50,
        "released": "2016-08-02",
        "overview": ""
      },
      {
        "id": "tvmaze:873550",
        "title": "Episode 51",
        "season": 3,
        "episode": 51,
        "released": "2016-08-03",
        "overview": ""
      },
      {
        "id": "tvmaze:873551",
        "title": "Episode 52",
        "season": 3,
        "episode": 52,
        "released": "2016-08-04",
        "overview": ""
      },
      {
        "id": "tvmaze:908438",
        "title": "Episode 1",
        "season": 4,
        "episode": 1,
        "released": "2016-08-30",
        "overview": ""
      },
      {
        "id": "tvmaze:935730",
        "title": "Episode 16",
        "season": 4,
        "episode": 16,
        "released": "2016-09-26",
        "overview": ""
      },
      {
        "id": "tvmaze:935733",
        "title": "Episode 17",
        "season": 4,
        "episode": 17,
        "released": "2016-09-27",
        "overview": ""
      },
      {
        "id": "tvmaze:935735",
        "title": "Episode 18",
        "season": 4,
        "episode": 18,
        "released": "2016-09-27",
        "overview": ""
      },
      {
        "id": "tvmaze:935738",
        "title": "Episode 19",
        "season": 4,
        "episode": 19,
        "released": "2016-09-28",
        "overview": ""
      },
      {
        "id": "tvmaze:1155735",
        "title": "Episode 37",
        "season": 5,
        "episode": 37,
        "released": "2017-05-01",
        "overview": ""
      },
      {
        "id": "tvmaze:1155737",
        "title": "Episode 38",
        "season": 5,
        "episode": 38,
        "released": "2017-05-02",
        "overview": ""
      },
      {
        "id": "tvmaze:1155739",
        "title": "Episode 39",
        "season": 5,
        "episode": 39,
        "released": "2017-05-03",
        "overview": ""
      },
      {
        "id": "tvmaze:1155743",
        "title": "Episode 40",
        "season": 5,
        "episode": 40,
        "released": "2017-05-04",
        "overview": ""
      },
      {
        "id": "tvmaze:1155746",
        "title": "Episode 41",
        "season": 5,
        "episode": 41,
        "released": "2017-05-05",
        "overview": ""
      },
      {
        "id": "tvmaze:1168927",
        "title": "Episode 42",
        "season": 5,
        "episode": 42,
        "released": "2017-05-08",
        "overview": ""
      },
      {
        "id": "tvmaze:1168928",
        "title": "Episode 43",
        "season": 5,
        "episode": 43,
        "released": "2017-05-09",
        "overview": ""
      },
      {
        "id": "tvmaze:1168929",
        "title": "Episode 44",
        "season": 5,
        "episode": 44,
        "released": "2017-05-10",
        "overview": ""
      },
      {
        "id": "tvmaze:1168930",
        "title": "Episode 45",
        "season": 5,
        "episode": 45,
        "released": "2017-05-15",
        "overview": ""
      },
      {
        "id": "tvmaze:1168931",
        "title": "Episode 46",
        "season": 5,
        "episode": 46,
        "released": "2017-05-16",
        "overview": ""
      },
      {
        "id": "tvmaze:1168932",
        "title": "Episode 47",
        "season": 5,
        "episode": 47,
        "released": "2017-05-17",
        "overview": ""
      },
      {
        "id": "tvmaze:1168933",
        "title": "Episode 48",
        "season": 5,
        "episode": 48,
        "released": "2017-05-18",
        "overview": ""
      },
      {
        "id": "tvmaze:1175569",
        "title": "Episode 49",
        "season": 5,
        "episode": 49,
        "released": "2017-05-22",
        "overview": ""
      },
      {
        "id": "tvmaze:1175570",
        "title": "Episode 50",
        "season": 5,
        "episode": 50,
        "released": "2017-05-23",
        "overview": ""
      },
      {
        "id": "tvmaze:1175571",
        "title": "Episode 51",
        "season": 5,
        "episode": 51,
        "released": "2017-05-24",
        "overview": ""
      },
      {
        "id": "tvmaze:1175572",
        "title": "Episode 52",
        "season": 5,
        "episode": 52,
        "released": "2017-05-25",
        "overview": ""
      },
      {
        "id": "tvmaze:1182626",
        "title": "Episode 53",
        "season": 5,
        "episode": 53,
        "released": "2017-05-29",
        "overview": ""
      },
      {
        "id": "tvmaze:1182627",
        "title": "Episode 54",
        "season": 5,
        "episode": 54,
        "released": "2017-05-30",
        "overview": ""
      },
      {
        "id": "tvmaze:1182628",
        "title": "Episode 55",
        "season": 5,
        "episode": 55,
        "released": "2017-05-31",
        "overview": ""
      },
      {
        "id": "tvmaze:1182629",
        "title": "Episode 56",
        "season": 5,
        "episode": 56,
        "released": "2017-06-01",
        "overview": ""
      },
      {
        "id": "tvmaze:1210371",
        "title": "Episode 57",
        "season": 5,
        "episode": 57,
        "released": "2017-06-05",
        "overview": ""
      },
      {
        "id": "tvmaze:1210372",
        "title": "Episode 58",
        "season": 5,
        "episode": 58,
        "released": "2017-06-06",
        "overview": ""
      },
      {
        "id": "tvmaze:1210373",
        "title": "Episode 59",
        "season": 5,
        "episode": 59,
        "released": "2017-06-07",
        "overview": ""
      },
      {
        "id": "tvmaze:1210374",
        "title": "Episode 60",
        "season": 5,
        "episode": 60,
        "released": "2017-06-08",
        "overview": ""
      },
      {
        "id": "tvmaze:1210375",
        "title": "Episode 61",
        "season": 5,
        "episode": 61,
        "released": "2017-06-12",
        "overview": ""
      },
      {
        "id": "tvmaze:1210376",
        "title": "Episode 62",
        "season": 5,
        "episode": 62,
        "released": "2017-06-13",
        "overview": ""
      },
      {
        "id": "tvmaze:1210377",
        "title": "Episode 63",
        "season": 5,
        "episode": 63,
        "released": "2017-06-14",
        "overview": ""
      },
      {
        "id": "tvmaze:1210378",
        "title": "Episode 64",
        "season": 5,
        "episode": 64,
        "released": "2017-06-15",
        "overview": ""
      },
      {
        "id": "tvmaze:3409235",
        "title": "Tue 14 Nov",
        "season": 5,
        "episode": 164,
        "released": "2017-11-14",
        "overview": ""
      },
      {
        "id": "tvmaze:3409236",
        "title": "Wed 15 Nov",
        "season": 5,
        "episode": 165,
        "released": "2017-11-15",
        "overview": ""
      },
      {
        "id": "tvmaze:3409237",
        "title": "Thu 16 Nov",
        "season": 5,
        "episode": 166,
        "released": "2017-11-16",
        "overview": ""
      },
      {
        "id": "tvmaze:3409238",
        "title": "Mon 20 Nov",
        "season": 5,
        "episode": 167,
        "released": "2017-11-20",
        "overview": ""
      },
      {
        "id": "tvmaze:3409239",
        "title": "Tue 21 Nov",
        "season": 5,
        "episode": 168,
        "released": "2017-11-21",
        "overview": ""
      },
      {
        "id": "tvmaze:3409240",
        "title": "Wed 22 Nov",
        "season": 5,
        "episode": 169,
        "released": "2017-11-22",
        "overview": ""
      },
      {
        "id": "tvmaze:3409241",
        "title": "Thu 23 Nov",
        "season": 5,
        "episode": 170,
        "released": "2017-11-23",
        "overview": ""
      },
      {
        "id": "tvmaze:3409242",
        "title": "Mon 27 Nov",
        "season": 5,
        "episode": 171,
        "released": "2017-11-27",
        "overview": ""
      },
      {
        "id": "tvmaze:3409243",
        "title": "Tue 28 Nov",
        "season": 5,
        "episode": 172,
        "released": "2017-11-28",
        "overview": ""
      },
      {
        "id": "tvmaze:3409244",
        "title": "Wed 29 Nov",
        "season": 5,
        "episode": 173,
        "released": "2017-11-29",
        "overview": ""
      },
      {
        "id": "tvmaze:3409245",
        "title": "Thu 30 Nov",
        "season": 5,
        "episode": 174,
        "released": "2017-11-30",
        "overview": ""
      },
      {
        "id": "tvmaze:3409246",
        "title": "Mon 29 Jan",
        "season": 6,
        "episode": 1,
        "released": "2018-01-29",
        "overview": ""
      },
      {
        "id": "tvmaze:3409247",
        "title": "Tue 30 Jan",
        "season": 6,
        "episode": 2,
        "released": "2018-01-30",
        "overview": ""
      },
      {
        "id": "tvmaze:3409248",
        "title": "Tue 20 Feb",
        "season": 6,
        "episode": 3,
        "released": "2018-02-20",
        "overview": ""
      },
      {
        "id": "tvmaze:3409249",
        "title": "Wed 31 Jan",
        "season": 6,
        "episode": 4,
        "released": "2018-01-31",
        "overview": ""
      },
      {
        "id": "tvmaze:3409250",
        "title": "Wed 21 Feb",
        "season": 6,
        "episode": 5,
        "released": "2018-02-21",
        "overview": ""
      },
      {
        "id": "tvmaze:3409251",
        "title": "Thu 1 Feb",
        "season": 6,
        "episode": 6,
        "released": "2018-02-01",
        "overview": ""
      },
      {
        "id": "tvmaze:3409252",
        "title": "Thu 22 Feb",
        "season": 6,
        "episode": 7,
        "released": "2018-02-22",
        "overview": ""
      },
      {
        "id": "tvmaze:3409253",
        "title": "Mon 5 Feb",
        "season": 6,
        "episode": 8,
        "released": "2018-02-05",
        "overview": ""
      },
      {
        "id": "tvmaze:3409254",
        "title": "Mon 26 Feb",
        "season": 6,
        "episode": 9,
        "released": "2018-02-26",
        "overview": ""
      },
      {
        "id": "tvmaze:3409255",
        "title": "Tue 6 Feb",
        "season": 6,
        "episode": 10,
        "released": "2018-02-06",
        "overview": ""
      },
      {
        "id": "tvmaze:3409256",
        "title": "Tue 27 Feb",
        "season": 6,
        "episode": 11,
        "released": "2018-02-27",
        "overview": ""
      },
      {
        "id": "tvmaze:3409257",
        "title": "Wed 7 Feb",
        "season": 6,
        "episode": 12,
        "released": "2018-02-07",
        "overview": ""
      },
      {
        "id": "tvmaze:3409258",
        "title": "Wed 28 Feb",
        "season": 6,
        "episode": 13,
        "released": "2018-02-28",
        "overview": ""
      },
      {
        "id": "tvmaze:3409259",
        "title": "Thu 1 Mar",
        "season": 6,
        "episode": 14,
        "released": "2018-03-01",
        "overview": ""
      },
      {
        "id": "tvmaze:3409260",
        "title": "Thu 8 Feb",
        "season": 6,
        "episode": 15,
        "released": "2018-02-08",
        "overview": ""
      },
      {
        "id": "tvmaze:3409261",
        "title": "Mon 5 Mar",
        "season": 6,
        "episode": 16,
        "released": "2018-03-05",
        "overview": ""
      },
      {
        "id": "tvmaze:3409262",
        "title": "Mon 12 Feb",
        "season": 6,
        "episode": 17,
        "released": "2018-02-12",
        "overview": ""
      },
      {
        "id": "tvmaze:3409263",
        "title": "Tue 6 Mar",
        "season": 6,
        "episode": 18,
        "released": "2018-03-06",
        "overview": ""
      },
      {
        "id": "tvmaze:3409264",
        "title": "Tue 13 Feb",
        "season": 6,
        "episode": 19,
        "released": "2018-02-13",
        "overview": ""
      },
      {
        "id": "tvmaze:3409265",
        "title": "Wed 7 Mar",
        "season": 6,
        "episode": 20,
        "released": "2018-03-07",
        "overview": ""
      },
      {
        "id": "tvmaze:3409266",
        "title": "Thu 8 Mar",
        "season": 6,
        "episode": 21,
        "released": "2018-03-08",
        "overview": ""
      },
      {
        "id": "tvmaze:3409267",
        "title": "Wed 14 Feb",
        "season": 6,
        "episode": 22,
        "released": "2018-02-14",
        "overview": ""
      },
      {
        "id": "tvmaze:3409268",
        "title": "Thu 15 Feb",
        "season": 6,
        "episode": 23,
        "released": "2018-02-15",
        "overview": ""
      },
      {
        "id": "tvmaze:3409269",
        "title": "Mon 12 Mar",
        "season": 6,
        "episode": 24,
        "released": "2018-03-12",
        "overview": ""
      },
      {
        "id": "tvmaze:3409270",
        "title": "Mon 19 Feb",
        "season": 6,
        "episode": 25,
        "released": "2018-02-19",
        "overview": ""
      },
      {
        "id": "tvmaze:3409271",
        "title": "Tue 13 Mar",
        "season": 6,
        "episode": 26,
        "released": "2018-03-13",
        "overview": ""
      },
      {
        "id": "tvmaze:3409272",
        "title": "Wed 14 Mar",
        "season": 6,
        "episode": 27,
        "released": "2018-03-14",
        "overview": ""
      },
      {
        "id": "tvmaze:3409273",
        "title": "Thu 15 Mar",
        "season": 6,
        "episode": 28,
        "released": "2018-03-15",
        "overview": ""
      },
      {
        "id": "tvmaze:3409274",
        "title": "Wed 25 Apr",
        "season": 6,
        "episode": 29,
        "released": "2018-04-25",
        "overview": ""
      },
      {
        "id": "tvmaze:3409275",
        "title": "Mon 19 Mar",
        "season": 6,
        "episode": 30,
        "released": "2018-03-19",
        "overview": ""
      },
      {
        "id": "tvmaze:3409276",
        "title": "Thu 26 Apr",
        "season": 6,
        "episode": 31,
        "released": "2018-04-26",
        "overview": ""
      },
      {
        "id": "tvmaze:3409277",
        "title": "Tue 20 Mar",
        "season": 6,
        "episode": 32,
        "released": "2018-03-20",
        "overview": ""
      },
      {
        "id": "tvmaze:3409278",
        "title": "Mon 30 Apr",
        "season": 6,
        "episode": 33,
        "released": "2018-04-30",
        "overview": ""
      },
      {
        "id": "tvmaze:3409279",
        "title": "Wed 21 Mar",
        "season": 6,
        "episode": 34,
        "released": "2018-03-21",
        "overview": ""
      },
      {
        "id": "tvmaze:3409280",
        "title": "Tue 1 May",
        "season": 6,
        "episode": 35,
        "released": "2018-05-01",
        "overview": ""
      },
      {
        "id": "tvmaze:3409281",
        "title": "Thu 22 Mar",
        "season": 6,
        "episode": 36,
        "released": "2018-03-22",
        "overview": ""
      },
      {
        "id": "tvmaze:3409282",
        "title": "Wed 2 May",
        "season": 6,
        "episode": 37,
        "released": "2018-05-02",
        "overview": ""
      },
      {
        "id": "tvmaze:3409283",
        "title": "Mon 16 Apr",
        "season": 6,
        "episode": 38,
        "released": "2018-04-16",
        "overview": ""
      },
      {
        "id": "tvmaze:3409284",
        "title": "Thu 3 May",
        "season": 6,
        "episode": 39,
        "released": "2018-05-03",
        "overview": ""
      },
      {
        "id": "tvmaze:3409285",
        "title": "Mon 7 May",
        "season": 6,
        "episode": 40,
        "released": "2018-05-07",
        "overview": ""
      },
      {
        "id": "tvmaze:3409286",
        "title": "Tue 17 Apr",
        "season": 6,
        "episode": 41,
        "released": "2018-04-17",
        "overview": ""
      },
      {
        "id": "tvmaze:3409287",
        "title": "Wed 18 Apr",
        "season": 6,
        "episode": 42,
        "released": "2018-04-18",
        "overview": ""
      },
      {
        "id": "tvmaze:3409288",
        "title": "Tue 8 May",
        "season": 6,
        "episode": 43,
        "released": "2018-05-08",
        "overview": ""
      },
      {
        "id": "tvmaze:3409289",
        "title": "Thu 19 Apr",
        "season": 6,
        "episode": 44,
        "released": "2018-04-19",
        "overview": ""
      },
      {
        "id": "tvmaze:3409290",
        "title": "Wed 9 May",
        "season": 6,
        "episode": 45,
        "released": "2018-05-09",
        "overview": ""
      },
      {
        "id": "tvmaze:3409291",
        "title": "Mon 23 Apr",
        "season": 6,
        "episode": 46,
        "released": "2018-04-23",
        "overview": ""
      },
      {
        "id": "tvmaze:3409292",
        "title": "Thu 10 May",
        "season": 6,
        "episode": 47,
        "released": "2018-05-10",
        "overview": ""
      },
      {
        "id": "tvmaze:3409293",
        "title": "Mon 14 May",
        "season": 6,
        "episode": 48,
        "released": "2018-05-14",
        "overview": ""
      },
      {
        "id": "tvmaze:3409294",
        "title": "Tue 24 Apr",
        "season": 6,
        "episode": 49,
        "released": "2018-04-24",
        "overview": ""
      },
      {
        "id": "tvmaze:3409295",
        "title": "Tue 15 May",
        "season": 6,
        "episode": 50,
        "released": "2018-05-15",
        "overview": ""
      },
      {
        "id": "tvmaze:3409296",
        "title": "Wed 16 May",
        "season": 6,
        "episode": 51,
        "released": "2018-05-16",
        "overview": ""
      },
      {
        "id": "tvmaze:3409297",
        "title": "Thu 17 May",
        "season": 6,
        "episode": 52,
        "released": "2018-05-17",
        "overview": ""
      },
      {
        "id": "tvmaze:3409298",
        "title": "Mon 21 May",
        "season": 6,
        "episode": 53,
        "released": "2018-05-21",
        "overview": ""
      },
      {
        "id": "tvmaze:3409299",
        "title": "Tue 22 May",
        "season": 6,
        "episode": 54,
        "released": "2018-05-22",
        "overview": ""
      },
      {
        "id": "tvmaze:3409300",
        "title": "Thu 7 Jun",
        "season": 6,
        "episode": 55,
        "released": "2018-06-07",
        "overview": ""
      },
      {
        "id": "tvmaze:3409301",
        "title": "Wed 23 May",
        "season": 6,
        "episode": 56,
        "released": "2018-05-23",
        "overview": ""
      },
      {
        "id": "tvmaze:3409302",
        "title": "Mon 11 Jun",
        "season": 6,
        "episode": 57,
        "released": "2018-06-11",
        "overview": ""
      },
      {
        "id": "tvmaze:3409303",
        "title": "Thu 24 May",
        "season": 6,
        "episode": 58,
        "released": "2018-05-24",
        "overview": ""
      },
      {
        "id": "tvmaze:3409304",
        "title": "Tue 12 Jun",
        "season": 6,
        "episode": 59,
        "released": "2018-06-12",
        "overview": ""
      },
      {
        "id": "tvmaze:3409305",
        "title": "Mon 28 May",
        "season": 6,
        "episode": 60,
        "released": "2018-05-28",
        "overview": ""
      },
      {
        "id": "tvmaze:3409306",
        "title": "Wed 13 Jun",
        "season": 6,
        "episode": 61,
        "released": "2018-06-13",
        "overview": ""
      },
      {
        "id": "tvmaze:3409307",
        "title": "Tue 29 May",
        "season": 6,
        "episode": 62,
        "released": "2018-05-29",
        "overview": ""
      },
      {
        "id": "tvmaze:3409308",
        "title": "Thu 14 Jun",
        "season": 6,
        "episode": 63,
        "released": "2018-06-14",
        "overview": ""
      },
      {
        "id": "tvmaze:3409309",
        "title": "Wed 30 May",
        "season": 6,
        "episode": 64,
        "released": "2018-05-30",
        "overview": ""
      },
      {
        "id": "tvmaze:3409310",
        "title": "Mon 18 Jun",
        "season": 6,
        "episode": 65,
        "released": "2018-06-18",
        "overview": ""
      },
      {
        "id": "tvmaze:3409311",
        "title": "Tue 19 Jun",
        "season": 6,
        "episode": 66,
        "released": "2018-06-19",
        "overview": ""
      },
      {
        "id": "tvmaze:3409312",
        "title": "Thu 31 May",
        "season": 6,
        "episode": 67,
        "released": "2018-05-31",
        "overview": ""
      },
      {
        "id": "tvmaze:3409313",
        "title": "Wed 20 Jun",
        "season": 6,
        "episode": 68,
        "released": "2018-06-20",
        "overview": ""
      },
      {
        "id": "tvmaze:3409314",
        "title": "Mon 4 Jun",
        "season": 6,
        "episode": 69,
        "released": "2018-06-04",
        "overview": ""
      },
      {
        "id": "tvmaze:3409315",
        "title": "Thu 21 Jun",
        "season": 6,
        "episode": 70,
        "released": "2018-06-21",
        "overview": ""
      },
      {
        "id": "tvmaze:3409316",
        "title": "Tue 5 Jun",
        "season": 6,
        "episode": 71,
        "released": "2018-06-05",
        "overview": ""
      },
      {
        "id": "tvmaze:3409317",
        "title": "Mon 25 Jun",
        "season": 6,
        "episode": 72,
        "released": "2018-06-25",
        "overview": ""
      },
      {
        "id": "tvmaze:3409318",
        "title": "Wed 6 Jun",
        "season": 6,
        "episode": 73,
        "released": "2018-06-06",
        "overview": ""
      },
      {
        "id": "tvmaze:3409319",
        "title": "Tue 26 Jun",
        "season": 6,
        "episode": 74,
        "released": "2018-06-26",
        "overview": ""
      },
      {
        "id": "tvmaze:3409320",
        "title": "Wed 27 Jun",
        "season": 6,
        "episode": 75,
        "released": "2018-06-27",
        "overview": ""
      },
      {
        "id": "tvmaze:3409321",
        "title": "Mon 23 Jul",
        "season": 6,
        "episode": 76,
        "released": "2018-07-23",
        "overview": ""
      },
      {
        "id": "tvmaze:3409322",
        "title": "Thu 28 Jun",
        "season": 6,
        "episode": 77,
        "released": "2018-06-28",
        "overview": ""
      },
      {
        "id": "tvmaze:3409323",
        "title": "Tue 24 Jul",
        "season": 6,
        "episode": 78,
        "released": "2018-07-24",
        "overview": ""
      },
      {
        "id": "tvmaze:3409324",
        "title": "Mon 2 Jul",
        "season": 6,
        "episode": 79,
        "released": "2018-07-02",
        "overview": ""
      },
      {
        "id": "tvmaze:3409325",
        "title": "Wed 25 Jul",
        "season": 6,
        "episode": 80,
        "released": "2018-07-25",
        "overview": ""
      },
      {
        "id": "tvmaze:3409326",
        "title": "Tue 3 Jul",
        "season": 6,
        "episode": 81,
        "released": "2018-07-03",
        "overview": ""
      },
      {
        "id": "tvmaze:3409327",
        "title": "Thu 26 Jul",
        "season": 6,
        "episode": 82,
        "released": "2018-07-26",
        "overview": ""
      },
      {
        "id": "tvmaze:3409328",
        "title": "Wed 4 Jul",
        "season": 6,
        "episode": 83,
        "released": "2018-07-04",
        "overview": ""
      },
      {
        "id": "tvmaze:3409329",
        "title": "Mon 30 Jul",
        "season": 6,
        "episode": 84,
        "released": "2018-07-30",
        "overview": ""
      },
      {
        "id": "tvmaze:3409330",
        "title": "Thu 5 Jul",
        "season": 6,
        "episode": 85,
        "released": "2018-07-05",
        "overview": ""
      },
      {
        "id": "tvmaze:3409331",
        "title": "Tue 31 Jul",
        "season": 6,
        "episode": 86,
        "released": "2018-07-31",
        "overview": ""
      },
      {
        "id": "tvmaze:3409332",
        "title": "Mon 9 Jul",
        "season": 6,
        "episode": 87,
        "released": "2018-07-09",
        "overview": ""
      },
      {
        "id": "tvmaze:3409333",
        "title": "Wed 1 Aug",
        "season": 6,
        "episode": 88,
        "released": "2018-08-01",
        "overview": ""
      },
      {
        "id": "tvmaze:3409334",
        "title": "Tue 10 Jul",
        "season": 6,
        "episode": 89,
        "released": "2018-07-10",
        "overview": ""
      },
      {
        "id": "tvmaze:3409335",
        "title": "Thu 2 Aug",
        "season": 6,
        "episode": 90,
        "released": "2018-08-02",
        "overview": ""
      },
      {
        "id": "tvmaze:3409336",
        "title": "Wed 11 Jul",
        "season": 6,
        "episode": 91,
        "released": "2018-07-11",
        "overview": ""
      },
      {
        "id": "tvmaze:3409337",
        "title": "Mon 6 Aug",
        "season": 6,
        "episode": 92,
        "released": "2018-08-06",
        "overview": ""
      },
      {
        "id": "tvmaze:3409338",
        "title": "Thu 12 Jul",
        "season": 6,
        "episode": 93,
        "released": "2018-07-12",
        "overview": ""
      },
      {
        "id": "tvmaze:3409339",
        "title": "Tue 7 Aug",
        "season": 6,
        "episode": 94,
        "released": "2018-08-07",
        "overview": ""
      },
      {
        "id": "tvmaze:3409340",
        "title": "Mon 16 Jul",
        "season": 6,
        "episode": 95,
        "released": "2018-07-16",
        "overview": ""
      },
      {
        "id": "tvmaze:3409341",
        "title": "Tue 17 Jul",
        "season": 6,
        "episode": 96,
        "released": "2018-07-17",
        "overview": ""
      },
      {
        "id": "tvmaze:3409342",
        "title": "Wed 18 Jul",
        "season": 6,
        "episode": 97,
        "released": "2018-07-18",
        "overview": ""
      },
      {
        "id": "tvmaze:3409343",
        "title": "Thu 19 Jul",
        "season": 6,
        "episode": 98,
        "released": "2018-07-19",
        "overview": ""
      },
      {
        "id": "tvmaze:3409344",
        "title": "Wed 8 Aug",
        "season": 6,
        "episode": 99,
        "released": "2018-08-08",
        "overview": ""
      },
      {
        "id": "tvmaze:3409345",
        "title": "Thu 9 Aug",
        "season": 6,
        "episode": 100,
        "released": "2018-08-09",
        "overview": ""
      },
      {
        "id": "tvmaze:3409346",
        "title": "Mon 13 Aug",
        "season": 6,
        "episode": 101,
        "released": "2018-08-13",
        "overview": ""
      },
      {
        "id": "tvmaze:3409347",
        "title": "Tue 14 Aug",
        "season": 6,
        "episode": 102,
        "released": "2018-08-14",
        "overview": ""
      },
      {
        "id": "tvmaze:3409348",
        "title": "Wed 15 Aug",
        "season": 6,
        "episode": 103,
        "released": "2018-08-15",
        "overview": ""
      },
      {
        "id": "tvmaze:3409349",
        "title": "Thu 16 Aug",
        "season": 6,
        "episode": 104,
        "released": "2018-08-16",
        "overview": ""
      },
      {
        "id": "tvmaze:3409350",
        "title": "Mon 20 Aug",
        "season": 6,
        "episode": 105,
        "released": "2018-08-20",
        "overview": ""
      },
      {
        "id": "tvmaze:3409351",
        "title": "Tue 21 Aug",
        "season": 6,
        "episode": 106,
        "released": "2018-08-21",
        "overview": ""
      },
      {
        "id": "tvmaze:3409352",
        "title": "Wed 22 Aug",
        "season": 6,
        "episode": 107,
        "released": "2018-08-22",
        "overview": ""
      },
      {
        "id": "tvmaze:3409353",
        "title": "Thu 23 Aug",
        "season": 6,
        "episode": 108,
        "released": "2018-08-23",
        "overview": ""
      },
      {
        "id": "tvmaze:3409354",
        "title": "Mon 27 Aug",
        "season": 6,
        "episode": 109,
        "released": "2018-08-27",
        "overview": ""
      },
      {
        "id": "tvmaze:3409355",
        "title": "Tue 28 Aug",
        "season": 6,
        "episode": 110,
        "released": "2018-08-28",
        "overview": ""
      },
      {
        "id": "tvmaze:3409356",
        "title": "Wed 29 Aug",
        "season": 6,
        "episode": 111,
        "released": "2018-08-29",
        "overview": ""
      },
      {
        "id": "tvmaze:3409357",
        "title": "Thu 30 Aug",
        "season": 6,
        "episode": 112,
        "released": "2018-08-30",
        "overview": ""
      },
      {
        "id": "tvmaze:3409358",
        "title": "Mon 3 Sep",
        "season": 6,
        "episode": 113,
        "released": "2018-09-03",
        "overview": ""
      },
      {
        "id": "tvmaze:3409359",
        "title": "Tue 4 Sep",
        "season": 6,
        "episode": 114,
        "released": "2018-09-04",
        "overview": ""
      },
      {
        "id": "tvmaze:3409360",
        "title": "Thu 20 Sep",
        "season": 6,
        "episode": 115,
        "released": "2018-09-20",
        "overview": ""
      },
      {
        "id": "tvmaze:3409361",
        "title": "Wed 5 Sep",
        "season": 6,
        "episode": 116,
        "released": "2018-09-05",
        "overview": ""
      },
      {
        "id": "tvmaze:3409362",
        "title": "Mon 24 Sep",
        "season": 6,
        "episode": 117,
        "released": "2018-09-24",
        "overview": ""
      },
      {
        "id": "tvmaze:3409363",
        "title": "Thu 6 Sep",
        "season": 6,
        "episode": 118,
        "released": "2018-09-06",
        "overview": ""
      },
      {
        "id": "tvmaze:3409364",
        "title": "Tue 25 Sep",
        "season": 6,
        "episode": 119,
        "released": "2018-09-25",
        "overview": ""
      },
      {
        "id": "tvmaze:3409365",
        "title": "Mon 10 Sep",
        "season": 6,
        "episode": 120,
        "released": "2018-09-10",
        "overview": ""
      },
      {
        "id": "tvmaze:3409366",
        "title": "Wed 26 Sep",
        "season": 6,
        "episode": 121,
        "released": "2018-09-26",
        "overview": ""
      },
      {
        "id": "tvmaze:3409367",
        "title": "Tue 11 Sep",
        "season": 6,
        "episode": 122,
        "released": "2018-09-11",
        "overview": ""
      },
      {
        "id": "tvmaze:3409368",
        "title": "Thu 27 Sep",
        "season": 6,
        "episode": 123,
        "released": "2018-09-27",
        "overview": ""
      },
      {
        "id": "tvmaze:3409369",
        "title": "Wed 12 Sep",
        "season": 6,
        "episode": 124,
        "released": "2018-09-12",
        "overview": ""
      },
      {
        "id": "tvmaze:3409370",
        "title": "Mon 1 Oct",
        "season": 6,
        "episode": 125,
        "released": "2018-10-01",
        "overview": ""
      },
      {
        "id": "tvmaze:3409371",
        "title": "Thu 13 Sep",
        "season": 6,
        "episode": 126,
        "released": "2018-09-13",
        "overview": ""
      },
      {
        "id": "tvmaze:3409372",
        "title": "Tue 2 Oct",
        "season": 6,
        "episode": 127,
        "released": "2018-10-02",
        "overview": ""
      },
      {
        "id": "tvmaze:3409373",
        "title": "Mon 17 Sep",
        "season": 6,
        "episode": 128,
        "released": "2018-09-17",
        "overview": ""
      },
      {
        "id": "tvmaze:3409374",
        "title": "Wed 3 Oct",
        "season": 6,
        "episode": 129,
        "released": "2018-10-03",
        "overview": ""
      },
      {
        "id": "tvmaze:3409375",
        "title": "Tue 18 Sep",
        "season": 6,
        "episode": 130,
        "released": "2018-09-18",
        "overview": ""
      },
      {
        "id": "tvmaze:3409377",
        "title": "Thu 4 Oct",
        "season": 6,
        "episode": 131,
        "released": "2018-10-04",
        "overview": ""
      },
      {
        "id": "tvmaze:3409378",
        "title": "Wed 19 Sep",
        "season": 6,
        "episode": 132,
        "released": "2018-09-19",
        "overview": ""
      },
      {
        "id": "tvmaze:3409379",
        "title": "Mon 5 Nov",
        "season": 6,
        "episode": 133,
        "released": "2018-11-05",
        "overview": ""
      },
      {
        "id": "tvmaze:3409380",
        "title": "Mon 8 Oct",
        "season": 6,
        "episode": 134,
        "released": "2018-10-08",
        "overview": ""
      },
      {
        "id": "tvmaze:3409381",
        "title": "Tue 6 Nov",
        "season": 6,
        "episode": 135,
        "released": "2018-11-06",
        "overview": ""
      },
      {
        "id": "tvmaze:3409382",
        "title": "Tue 6 Nov",
        "season": 6,
        "episode": 136,
        "released": "2018-11-06",
        "overview": ""
      },
      {
        "id": "tvmaze:3409383",
        "title": "Tue 9 Oct",
        "season": 6,
        "episode": 137,
        "released": "2018-10-09",
        "overview": ""
      },
      {
        "id": "tvmaze:3409384",
        "title": "Wed 10 Oct",
        "season": 6,
        "episode": 138,
        "released": "2018-10-10",
        "overview": ""
      },
      {
        "id": "tvmaze:3409385",
        "title": "Wed 7 Nov",
        "season": 6,
        "episode": 139,
        "released": "2018-11-07",
        "overview": ""
      },
      {
        "id": "tvmaze:3409386",
        "title": "Thu 11 Oct",
        "season": 6,
        "episode": 140,
        "released": "2018-10-11",
        "overview": ""
      },
      {
        "id": "tvmaze:3409387",
        "title": "Thu 8 Nov",
        "season": 6,
        "episode": 141,
        "released": "2018-11-08",
        "overview": ""
      },
      {
        "id": "tvmaze:3409388",
        "title": "Thu 8 Nov",
        "season": 6,
        "episode": 142,
        "released": "2018-11-08",
        "overview": ""
      },
      {
        "id": "tvmaze:3409389",
        "title": "Mon 15 Oct",
        "season": 6,
        "episode": 143,
        "released": "2018-10-15",
        "overview": ""
      },
      {
        "id": "tvmaze:3409390",
        "title": "Mon 12 Nov",
        "season": 6,
        "episode": 144,
        "released": "2018-11-12",
        "overview": ""
      },
      {
        "id": "tvmaze:3409391",
        "title": "Tue 16 Oct",
        "season": 6,
        "episode": 145,
        "released": "2018-10-16",
        "overview": ""
      },
      {
        "id": "tvmaze:3409392",
        "title": "Tue 13 Nov",
        "season": 6,
        "episode": 146,
        "released": "2018-11-13",
        "overview": ""
      },
      {
        "id": "tvmaze:3409393",
        "title": "Wed 17 Oct",
        "season": 6,
        "episode": 147,
        "released": "2018-10-17",
        "overview": ""
      },
      {
        "id": "tvmaze:3409394",
        "title": "Wed 14 Nov",
        "season": 6,
        "episode": 148,
        "released": "2018-11-14",
        "overview": ""
      },
      {
        "id": "tvmaze:3409395",
        "title": "Thu 18 Oct",
        "season": 6,
        "episode": 149,
        "released": "2018-10-18",
        "overview": ""
      },
      {
        "id": "tvmaze:3409396",
        "title": "Thu 15 Nov",
        "season": 6,
        "episode": 150,
        "released": "2018-11-15",
        "overview": ""
      },
      {
        "id": "tvmaze:3409397",
        "title": "Mon 22 Oct",
        "season": 6,
        "episode": 151,
        "released": "2018-10-22",
        "overview": ""
      },
      {
        "id": "tvmaze:3409398",
        "title": "Tue 23 Oct",
        "season": 6,
        "episode": 152,
        "released": "2018-10-23",
        "overview": ""
      },
      {
        "id": "tvmaze:3409399",
        "title": "Mon 19 Nov",
        "season": 6,
        "episode": 153,
        "released": "2018-11-19",
        "overview": ""
      },
      {
        "id": "tvmaze:3409400",
        "title": "Tue 20 Nov",
        "season": 6,
        "episode": 154,
        "released": "2018-11-20",
        "overview": ""
      },
      {
        "id": "tvmaze:3409401",
        "title": "Wed 24 Oct",
        "season": 6,
        "episode": 155,
        "released": "2018-10-24",
        "overview": ""
      },
      {
        "id": "tvmaze:3409402",
        "title": "Thu 25 Oct",
        "season": 6,
        "episode": 156,
        "released": "2018-10-25",
        "overview": ""
      },
      {
        "id": "tvmaze:3409403",
        "title": "Mon 26 Nov",
        "season": 6,
        "episode": 157,
        "released": "2018-11-26",
        "overview": ""
      },
      {
        "id": "tvmaze:3409404",
        "title": "Mon 29 Oct",
        "season": 6,
        "episode": 158,
        "released": "2018-10-29",
        "overview": ""
      },
      {
        "id": "tvmaze:3409405",
        "title": "Tue 27 Nov",
        "season": 6,
        "episode": 159,
        "released": "2018-11-27",
        "overview": ""
      },
      {
        "id": "tvmaze:3409406",
        "title": "Tue 30 Oct",
        "season": 6,
        "episode": 160,
        "released": "2018-10-30",
        "overview": ""
      },
      {
        "id": "tvmaze:3409407",
        "title": "Wed 31 Oct",
        "season": 6,
        "episode": 161,
        "released": "2018-10-31",
        "overview": ""
      },
      {
        "id": "tvmaze:3409408",
        "title": "Thu 1 Nov",
        "season": 6,
        "episode": 162,
        "released": "2018-11-01",
        "overview": ""
      },
      {
        "id": "tvmaze:3409409",
        "title": "Mon 28 Jan",
        "season": 7,
        "episode": 7,
        "released": "2019-01-28",
        "overview": ""
      },
      {
        "id": "tvmaze:3409410",
        "title": "Tue 29 Jan",
        "season": 7,
        "episode": 8,
        "released": "2019-01-29",
        "overview": ""
      },
      {
        "id": "tvmaze:3409411",
        "title": "Wed 30 Jan",
        "season": 7,
        "episode": 9,
        "released": "2019-01-30",
        "overview": ""
      },
      {
        "id": "tvmaze:3409412",
        "title": "Thu 31 Jan",
        "season": 7,
        "episode": 10,
        "released": "2019-01-31",
        "overview": ""
      },
      {
        "id": "tvmaze:3409413",
        "title": "Mon 4 Feb",
        "season": 7,
        "episode": 11,
        "released": "2019-02-04",
        "overview": ""
      },
      {
        "id": "tvmaze:3409414",
        "title": "Tue 5 Feb",
        "season": 7,
        "episode": 12,
        "released": "2019-02-05",
        "overview": ""
      },
      {
        "id": "tvmaze:3409415",
        "title": "Wed 6 Feb",
        "season": 7,
        "episode": 13,
        "released": "2019-02-06",
        "overview": ""
      },
      {
        "id": "tvmaze:3409416",
        "title": "Thu 7 Feb",
        "season": 7,
        "episode": 14,
        "released": "2019-02-07",
        "overview": ""
      },
      {
        "id": "tvmaze:3409417",
        "title": "Mon 11 Feb",
        "season": 7,
        "episode": 15,
        "released": "2019-02-11",
        "overview": ""
      },
      {
        "id": "tvmaze:3409418",
        "title": "Tue 12 Feb",
        "season": 7,
        "episode": 16,
        "released": "2019-02-12",
        "overview": ""
      },
      {
        "id": "tvmaze:3409419",
        "title": "Wed 13 Feb",
        "season": 7,
        "episode": 17,
        "released": "2019-02-13",
        "overview": ""
      },
      {
        "id": "tvmaze:3409420",
        "title": "Thu 14 Feb",
        "season": 7,
        "episode": 18,
        "released": "2019-02-14",
        "overview": ""
      },
      {
        "id": "tvmaze:3409421",
        "title": "Mon 18 Feb",
        "season": 7,
        "episode": 19,
        "released": "2019-02-18",
        "overview": ""
      },
      {
        "id": "tvmaze:3409422",
        "title": "Tue 19 Feb",
        "season": 7,
        "episode": 20,
        "released": "2019-02-19",
        "overview": ""
      },
      {
        "id": "tvmaze:3409423",
        "title": "Wed 20 Feb",
        "season": 7,
        "episode": 21,
        "released": "2019-02-20",
        "overview": ""
      },
      {
        "id": "tvmaze:3409424",
        "title": "Thu 21 Feb",
        "season": 7,
        "episode": 22,
        "released": "2019-02-21",
        "overview": ""
      },
      {
        "id": "tvmaze:3409425",
        "title": "Mon 25 Feb",
        "season": 7,
        "episode": 23,
        "released": "2019-02-25",
        "overview": ""
      },
      {
        "id": "tvmaze:3409426",
        "title": "Tue 26 Feb",
        "season": 7,
        "episode": 24,
        "released": "2019-02-26",
        "overview": ""
      },
      {
        "id": "tvmaze:3409427",
        "title": "Wed 27 Feb",
        "season": 7,
        "episode": 25,
        "released": "2019-02-27",
        "overview": ""
      },
      {
        "id": "tvmaze:3409428",
        "title": "Thu 28 Feb",
        "season": 7,
        "episode": 26,
        "released": "2019-02-28",
        "overview": ""
      },
      {
        "id": "tvmaze:3409429",
        "title": "Mon 4 Mar",
        "season": 7,
        "episode": 27,
        "released": "2019-03-04",
        "overview": ""
      },
      {
        "id": "tvmaze:3409430",
        "title": "Tue 5 Mar",
        "season": 7,
        "episode": 28,
        "released": "2019-03-05",
        "overview": ""
      },
      {
        "id": "tvmaze:3409431",
        "title": "Wed 6 Mar",
        "season": 7,
        "episode": 29,
        "released": "2019-03-06",
        "overview": ""
      },
      {
        "id": "tvmaze:3409432",
        "title": "Thu 7 Mar",
        "season": 7,
        "episode": 30,
        "released": "2019-03-07",
        "overview": ""
      },
      {
        "id": "tvmaze:3409433",
        "title": "Mon 11 Mar",
        "season": 7,
        "episode": 31,
        "released": "2019-03-11",
        "overview": ""
      },
      {
        "id": "tvmaze:3409434",
        "title": "Tue 12 Mar",
        "season": 7,
        "episode": 32,
        "released": "2019-03-12",
        "overview": ""
      },
      {
        "id": "tvmaze:3409435",
        "title": "Wed 13 Mar",
        "season": 7,
        "episode": 33,
        "released": "2019-03-13",
        "overview": ""
      },
      {
        "id": "tvmaze:3409436",
        "title": "Thu 14 Mar",
        "season": 7,
        "episode": 34,
        "released": "2019-03-14",
        "overview": ""
      },
      {
        "id": "tvmaze:3409437",
        "title": "Mon 18 Mar",
        "season": 7,
        "episode": 35,
        "released": "2019-03-18",
        "overview": ""
      },
      {
        "id": "tvmaze:3409438",
        "title": "Tue 19 Mar",
        "season": 7,
        "episode": 36,
        "released": "2019-03-19",
        "overview": ""
      },
      {
        "id": "tvmaze:3409439",
        "title": "Wed 20 Mar",
        "season": 7,
        "episode": 37,
        "released": "2019-03-20",
        "overview": ""
      },
      {
        "id": "tvmaze:3409440",
        "title": "Thu 21 Mar",
        "season": 7,
        "episode": 38,
        "released": "2019-03-21",
        "overview": ""
      },
      {
        "id": "tvmaze:3409441",
        "title": "Mon 25 Mar",
        "season": 7,
        "episode": 39,
        "released": "2019-03-25",
        "overview": ""
      },
      {
        "id": "tvmaze:3409442",
        "title": "Tue 26 Mar",
        "season": 7,
        "episode": 40,
        "released": "2019-03-26",
        "overview": ""
      },
      {
        "id": "tvmaze:3409443",
        "title": "Wed 27 Mar",
        "season": 7,
        "episode": 41,
        "released": "2019-03-27",
        "overview": ""
      },
      {
        "id": "tvmaze:3409444",
        "title": "Thu 28 Mar",
        "season": 7,
        "episode": 42,
        "released": "2019-03-28",
        "overview": ""
      },
      {
        "id": "tvmaze:3409445",
        "title": "Mon 1 Apr",
        "season": 7,
        "episode": 43,
        "released": "2019-04-01",
        "overview": ""
      },
      {
        "id": "tvmaze:3409446",
        "title": "Tue 2 Apr",
        "season": 7,
        "episode": 44,
        "released": "2019-04-02",
        "overview": ""
      },
      {
        "id": "tvmaze:3409447",
        "title": "Wed 3 Apr",
        "season": 7,
        "episode": 45,
        "released": "2019-04-03",
        "overview": ""
      },
      {
        "id": "tvmaze:3409448",
        "title": "Thu 4 Apr",
        "season": 7,
        "episode": 46,
        "released": "2019-04-04",
        "overview": ""
      },
      {
        "id": "tvmaze:3409449",
        "title": "Mon 8 Apr",
        "season": 7,
        "episode": 47,
        "released": "2019-04-08",
        "overview": ""
      },
      {
        "id": "tvmaze:3409450",
        "title": "Tue 9 Apr",
        "season": 7,
        "episode": 48,
        "released": "2019-04-09",
        "overview": ""
      },
      {
        "id": "tvmaze:3409451",
        "title": "Wed 10 Apr",
        "season": 7,
        "episode": 49,
        "released": "2019-04-10",
        "overview": ""
      },
      {
        "id": "tvmaze:3409452",
        "title": "Thu 11 Apr",
        "season": 7,
        "episode": 50,
        "released": "2019-04-11",
        "overview": ""
      },
      {
        "id": "tvmaze:3409453",
        "title": "Mon 29 Apr",
        "season": 7,
        "episode": 51,
        "released": "2019-04-29",
        "overview": ""
      },
      {
        "id": "tvmaze:3409454",
        "title": "Tue 30 Apr",
        "season": 7,
        "episode": 52,
        "released": "2019-04-30",
        "overview": ""
      },
      {
        "id": "tvmaze:3409455",
        "title": "Wed 1 May",
        "season": 7,
        "episode": 53,
        "released": "2019-05-01",
        "overview": ""
      },
      {
        "id": "tvmaze:3409456",
        "title": "Thu 2 May",
        "season": 7,
        "episode": 54,
        "released": "2019-05-02",
        "overview": ""
      },
      {
        "id": "tvmaze:3409457",
        "title": "Fri 3 May",
        "season": 7,
        "episode": 55,
        "released": "2019-05-03",
        "overview": ""
      },
      {
        "id": "tvmaze:3409458",
        "title": "Mon 6 May",
        "season": 7,
        "episode": 56,
        "released": "2019-05-06",
        "overview": ""
      },
      {
        "id": "tvmaze:3409459",
        "title": "Mon 5 Aug",
        "season": 7,
        "episode": 57,
        "released": "2019-08-05",
        "overview": ""
      },
      {
        "id": "tvmaze:3409460",
        "title": "Tue 14 May",
        "season": 7,
        "episode": 58,
        "released": "2019-05-14",
        "overview": ""
      },
      {
        "id": "tvmaze:3409461",
        "title": "Mon 22 Jul",
        "season": 7,
        "episode": 59,
        "released": "2019-07-22",
        "overview": ""
      },
      {
        "id": "tvmaze:3409462",
        "title": "Thu 20 Jun",
        "season": 7,
        "episode": 60,
        "released": "2019-06-20",
        "overview": ""
      },
      {
        "id": "tvmaze:3409463",
        "title": "Thu 27 Jun",
        "season": 7,
        "episode": 61,
        "released": "2019-06-27",
        "overview": ""
      },
      {
        "id": "tvmaze:3409464",
        "title": "Tue 7 May",
        "season": 7,
        "episode": 62,
        "released": "2019-05-07",
        "overview": ""
      },
      {
        "id": "tvmaze:3409465",
        "title": "Wed 8 May",
        "season": 7,
        "episode": 63,
        "released": "2019-05-08",
        "overview": ""
      },
      {
        "id": "tvmaze:3409466",
        "title": "Thu 9 May",
        "season": 7,
        "episode": 64,
        "released": "2019-05-09",
        "overview": ""
      },
      {
        "id": "tvmaze:3409467",
        "title": "Mon 20 May",
        "season": 7,
        "episode": 65,
        "released": "2019-05-20",
        "overview": ""
      },
      {
        "id": "tvmaze:3409468",
        "title": "Tue 21 May",
        "season": 7,
        "episode": 66,
        "released": "2019-05-21",
        "overview": ""
      },
      {
        "id": "tvmaze:3409469",
        "title": "Wed 22 May",
        "season": 7,
        "episode": 67,
        "released": "2019-05-22",
        "overview": ""
      },
      {
        "id": "tvmaze:3409470",
        "title": "Thu 23 May",
        "season": 7,
        "episode": 68,
        "released": "2019-05-23",
        "overview": ""
      },
      {
        "id": "tvmaze:3409471",
        "title": "Thu 30 May",
        "season": 7,
        "episode": 69,
        "released": "2019-05-30",
        "overview": ""
      },
      {
        "id": "tvmaze:3409472",
        "title": "Mon 1 Jul",
        "season": 7,
        "episode": 70,
        "released": "2019-07-01",
        "overview": ""
      },
      {
        "id": "tvmaze:3409473",
        "title": "Mon 17 Jun",
        "season": 7,
        "episode": 71,
        "released": "2019-06-17",
        "overview": ""
      },
      {
        "id": "tvmaze:3409474",
        "title": "Wed 17 Jul",
        "season": 7,
        "episode": 72,
        "released": "2019-07-17",
        "overview": ""
      },
      {
        "id": "tvmaze:3409475",
        "title": "Tue 18 Jun",
        "season": 7,
        "episode": 73,
        "released": "2019-06-18",
        "overview": ""
      },
      {
        "id": "tvmaze:3409476",
        "title": "Wed 24 Jul",
        "season": 7,
        "episode": 74,
        "released": "2019-07-24",
        "overview": ""
      },
      {
        "id": "tvmaze:3409477",
        "title": "Wed 19 Jun",
        "season": 7,
        "episode": 75,
        "released": "2019-06-19",
        "overview": ""
      },
      {
        "id": "tvmaze:3409478",
        "title": "Thu 25 Jul",
        "season": 7,
        "episode": 76,
        "released": "2019-07-25",
        "overview": ""
      },
      {
        "id": "tvmaze:3409479",
        "title": "Wed 5 Jun",
        "season": 7,
        "episode": 77,
        "released": "2019-06-05",
        "overview": ""
      },
      {
        "id": "tvmaze:3409480",
        "title": "Mon 27 May",
        "season": 7,
        "episode": 78,
        "released": "2019-05-27",
        "overview": ""
      },
      {
        "id": "tvmaze:3409481",
        "title": "Mon 24 Jun",
        "season": 7,
        "episode": 79,
        "released": "2019-06-24",
        "overview": ""
      },
      {
        "id": "tvmaze:3409482",
        "title": "Tue 28 May",
        "season": 7,
        "episode": 80,
        "released": "2019-05-28",
        "overview": ""
      },
      {
        "id": "tvmaze:3409483",
        "title": "Tue 25 Jun",
        "season": 7,
        "episode": 81,
        "released": "2019-06-25",
        "overview": ""
      },
      {
        "id": "tvmaze:3409484",
        "title": "Thu 13 Jun",
        "season": 7,
        "episode": 82,
        "released": "2019-06-13",
        "overview": ""
      },
      {
        "id": "tvmaze:3409485",
        "title": "Wed 26 Jun",
        "season": 7,
        "episode": 83,
        "released": "2019-06-26",
        "overview": ""
      },
      {
        "id": "tvmaze:1847221",
        "title": "20/04/20",
        "season": 9,
        "episode": 7,
        "released": "2020-04-20",
        "overview": ""
      },
      {
        "id": "tvmaze:1847222",
        "title": "21/04/20",
        "season": 9,
        "episode": 8,
        "released": "2020-04-21",
        "overview": ""
      },
      {
        "id": "tvmaze:1847223",
        "title": "22/04/20",
        "season": 9,
        "episode": 9,
        "released": "2020-04-22",
        "overview": ""
      },
      {
        "id": "tvmaze:1847224",
        "title": "27/04/20",
        "season": 9,
        "episode": 10,
        "released": "2020-04-27",
        "overview": ""
      },
      {
        "id": "tvmaze:1847225",
        "title": "28/04/20",
        "season": 9,
        "episode": 11,
        "released": "2020-04-28",
        "overview": ""
      },
      {
        "id": "tvmaze:1847226",
        "title": "29/04/20",
        "season": 9,
        "episode": 12,
        "released": "2020-04-29",
        "overview": ""
      },
      {
        "id": "tvmaze:1856755",
        "title": "04/05/20",
        "season": 9,
        "episode": 13,
        "released": "2020-05-04",
        "overview": ""
      },
      {
        "id": "tvmaze:1856756",
        "title": "05/05/20",
        "season": 9,
        "episode": 14,
        "released": "2020-05-05",
        "overview": ""
      },
      {
        "id": "tvmaze:1856757",
        "title": "06/05/20",
        "season": 9,
        "episode": 15,
        "released": "2020-05-06",
        "overview": ""
      },
      {
        "id": "tvmaze:1859772",
        "title": "11/05/20",
        "season": 9,
        "episode": 16,
        "released": "2020-05-11",
        "overview": ""
      },
      {
        "id": "tvmaze:1859773",
        "title": "12/05/20",
        "season": 9,
        "episode": 17,
        "released": "2020-05-12",
        "overview": ""
      },
      {
        "id": "tvmaze:1859774",
        "title": "13/05/20",
        "season": 9,
        "episode": 18,
        "released": "2020-05-13",
        "overview": ""
      },
      {
        "id": "tvmaze:1863070",
        "title": "18/05/20",
        "season": 9,
        "episode": 19,
        "released": "2020-05-18",
        "overview": ""
      },
      {
        "id": "tvmaze:1863071",
        "title": "19/05/20",
        "season": 9,
        "episode": 20,
        "released": "2020-05-19",
        "overview": ""
      },
      {
        "id": "tvmaze:1863072",
        "title": "20/05/20",
        "season": 9,
        "episode": 21,
        "released": "2020-05-20",
        "overview": ""
      },
      {
        "id": "tvmaze:1863073",
        "title": "25/05/20",
        "season": 9,
        "episode": 22,
        "released": "2020-05-25",
        "overview": ""
      },
      {
        "id": "tvmaze:1867320",
        "title": "26/05/20",
        "season": 9,
        "episode": 23,
        "released": "2020-05-26",
        "overview": ""
      },
      {
        "id": "tvmaze:1867321",
        "title": "27/05/20",
        "season": 9,
        "episode": 24,
        "released": "2020-05-27",
        "overview": ""
      },
      {
        "id": "tvmaze:1876197",
        "title": "01/06/20",
        "season": 9,
        "episode": 25,
        "released": "2020-06-01",
        "overview": ""
      },
      {
        "id": "tvmaze:1876198",
        "title": "02/06/20",
        "season": 9,
        "episode": 26,
        "released": "2020-06-02",
        "overview": ""
      },
      {
        "id": "tvmaze:1876199",
        "title": "03/06/20",
        "season": 9,
        "episode": 27,
        "released": "2020-06-03",
        "overview": ""
      },
      {
        "id": "tvmaze:1878349",
        "title": "08/06/20",
        "season": 9,
        "episode": 28,
        "released": "2020-06-08",
        "overview": ""
      },
      {
        "id": "tvmaze:1878350",
        "title": "09/06/20",
        "season": 9,
        "episode": 29,
        "released": "2020-06-09",
        "overview": ""
      },
      {
        "id": "tvmaze:1878351",
        "title": "10/06/20",
        "season": 9,
        "episode": 30,
        "released": "2020-06-10",
        "overview": ""
      },
      {
        "id": "tvmaze:1884909",
        "title": "15/06/20",
        "season": 9,
        "episode": 31,
        "released": "2020-06-15",
        "overview": ""
      },
      {
        "id": "tvmaze:1884910",
        "title": "16/06/20",
        "season": 9,
        "episode": 32,
        "released": "2020-06-16",
        "overview": ""
      },
      {
        "id": "tvmaze:1884911",
        "title": "17/06/20",
        "season": 9,
        "episode": 33,
        "released": "2020-06-17",
        "overview": ""
      },
      {
        "id": "tvmaze:2740439",
        "title": "Episode 1",
        "season": 12,
        "episode": 1,
        "released": "2023-11-13",
        "overview": ""
      },
      {
        "id": "tvmaze:2740440",
        "title": "Episode 2",
        "season": 12,
        "episode": 2,
        "released": "2023-11-14",
        "overview": ""
      },
      {
        "id": "tvmaze:2740441",
        "title": "Episode 3",
        "season": 12,
        "episode": 3,
        "released": "2023-11-15",
        "overview": ""
      },
      {
        "id": "tvmaze:2740442",
        "title": "Episode 4",
        "season": 12,
        "episode": 4,
        "released": "2023-11-20",
        "overview": ""
      },
      {
        "id": "tvmaze:2740443",
        "title": "Episode 5",
        "season": 12,
        "episode": 5,
        "released": "2023-11-21",
        "overview": ""
      },
      {
        "id": "tvmaze:2740444",
        "title": "Episode 6",
        "season": 12,
        "episode": 6,
        "released": "2023-11-22",
        "overview": ""
      },
      {
        "id": "tvmaze:2740445",
        "title": "Episode 7",
        "season": 12,
        "episode": 7,
        "released": "2023-11-27",
        "overview": ""
      },
      {
        "id": "tvmaze:2740446",
        "title": "Episode 8",
        "season": 12,
        "episode": 8,
        "released": "2023-11-28",
        "overview": ""
      },
      {
        "id": "tvmaze:2740447",
        "title": "Episode 9",
        "season": 12,
        "episode": 9,
        "released": "2023-11-29",
        "overview": ""
      },
      {
        "id": "tvmaze:2740448",
        "title": "Episode 10",
        "season": 12,
        "episode": 10,
        "released": "2023-12-04",
        "overview": ""
      },
      {
        "id": "tvmaze:2740449",
        "title": "Episode 11",
        "season": 12,
        "episode": 11,
        "released": "2023-12-05",
        "overview": ""
      },
      {
        "id": "tvmaze:2740450",
        "title": "Episode 12",
        "season": 12,
        "episode": 12,
        "released": "2023-12-06",
        "overview": ""
      },
      {
        "id": "tvmaze:2740451",
        "title": "Episode 13",
        "season": 12,
        "episode": 13,
        "released": "2023-12-11",
        "overview": ""
      },
      {
        "id": "tvmaze:2740452",
        "title": "Episode 14",
        "season": 12,
        "episode": 14,
        "released": "2023-12-12",
        "overview": ""
      },
      {
        "id": "tvmaze:2740453",
        "title": "Episode 15",
        "season": 12,
        "episode": 15,
        "released": "2023-12-13",
        "overview": ""
      },
      {
        "id": "tvmaze:2740454",
        "title": "Episode 16",
        "season": 12,
        "episode": 16,
        "released": "2023-12-18",
        "overview": ""
      },
      {
        "id": "tvmaze:2740455",
        "title": "Episode 17",
        "season": 12,
        "episode": 17,
        "released": "2023-12-19",
        "overview": ""
      },
      {
        "id": "tvmaze:2740456",
        "title": "Episode 18",
        "season": 12,
        "episode": 18,
        "released": "2023-12-20",
        "overview": ""
      },
      {
        "id": "tvmaze:2740457",
        "title": "Episode 19",
        "season": 12,
        "episode": 19,
        "released": "2023-12-25",
        "overview": ""
      },
      {
        "id": "tvmaze:2740458",
        "title": "Episode 20",
        "season": 12,
        "episode": 20,
        "released": "2023-12-26",
        "overview": ""
      },
      {
        "id": "tvmaze:2740459",
        "title": "Episode 21",
        "season": 12,
        "episode": 21,
        "released": "2023-12-27",
        "overview": ""
      },
      {
        "id": "tvmaze:2740460",
        "title": "Episode 22",
        "season": 12,
        "episode": 22,
        "released": "2024-01-01",
        "overview": ""
      },
      {
        "id": "tvmaze:2740461",
        "title": "Episode 23",
        "season": 12,
        "episode": 23,
        "released": "2024-01-02",
        "overview": ""
      },
      {
        "id": "tvmaze:2740462",
        "title": "Episode 24",
        "season": 12,
        "episode": 24,
        "released": "2024-01-03",
        "overview": ""
      },
      {
        "id": "tvmaze:2740463",
        "title": "Episode 25",
        "season": 12,
        "episode": 25,
        "released": "2024-01-08",
        "overview": ""
      },
      {
        "id": "tvmaze:2740464",
        "title": "Episode 26",
        "season": 12,
        "episode": 26,
        "released": "2024-01-09",
        "overview": ""
      },
      {
        "id": "tvmaze:2740465",
        "title": "Episode 27",
        "season": 12,
        "episode": 27,
        "released": "2024-01-10",
        "overview": ""
      },
      {
        "id": "tvmaze:2740466",
        "title": "Episode 28",
        "season": 12,
        "episode": 28,
        "released": "2024-01-15",
        "overview": ""
      },
      {
        "id": "tvmaze:2740467",
        "title": "Episode 29",
        "season": 12,
        "episode": 29,
        "released": "2024-01-16",
        "overview": ""
      },
      {
        "id": "tvmaze:2740468",
        "title": "Episode 30",
        "season": 12,
        "episode": 30,
        "released": "2024-01-17",
        "overview": ""
      },
      {
        "id": "tvmaze:2740469",
        "title": "Episode 31",
        "season": 12,
        "episode": 31,
        "released": "2024-01-22",
        "overview": ""
      },
      {
        "id": "tvmaze:2740470",
        "title": "Episode 32",
        "season": 12,
        "episode": 32,
        "released": "2024-01-23",
        "overview": ""
      },
      {
        "id": "tvmaze:2740472",
        "title": "Episode 33",
        "season": 12,
        "episode": 33,
        "released": "2024-01-24",
        "overview": ""
      },
      {
        "id": "tvmaze:2755684",
        "title": "Episode 34",
        "season": 12,
        "episode": 34,
        "released": "2024-01-29",
        "overview": ""
      },
      {
        "id": "tvmaze:2755685",
        "title": "Episode 35",
        "season": 12,
        "episode": 35,
        "released": "2024-01-30",
        "overview": ""
      },
      {
        "id": "tvmaze:2755686",
        "title": "Episode 36",
        "season": 12,
        "episode": 36,
        "released": "2024-01-31",
        "overview": ""
      },
      {
        "id": "tvmaze:2755687",
        "title": "Episode 37",
        "season": 12,
        "episode": 37,
        "released": "2024-02-05",
        "overview": ""
      },
      {
        "id": "tvmaze:2755688",
        "title": "Episode 38",
        "season": 12,
        "episode": 38,
        "released": "2024-02-06",
        "overview": ""
      },
      {
        "id": "tvmaze:2755689",
        "title": "Episode 39",
        "season": 12,
        "episode": 39,
        "released": "2024-02-07",
        "overview": ""
      },
      {
        "id": "tvmaze:2755690",
        "title": "Episode 40",
        "season": 12,
        "episode": 40,
        "released": "2024-02-12",
        "overview": ""
      },
      {
        "id": "tvmaze:2755691",
        "title": "Episode 41",
        "season": 12,
        "episode": 41,
        "released": "2024-02-13",
        "overview": ""
      },
      {
        "id": "tvmaze:2755692",
        "title": "Episode 42",
        "season": 12,
        "episode": 42,
        "released": "2024-02-14",
        "overview": ""
      },
      {
        "id": "tvmaze:2755693",
        "title": "Episode 43",
        "season": 12,
        "episode": 43,
        "released": "2024-02-19",
        "overview": ""
      },
      {
        "id": "tvmaze:2755694",
        "title": "Episode 44",
        "season": 12,
        "episode": 44,
        "released": "2024-02-20",
        "overview": ""
      },
      {
        "id": "tvmaze:2755695",
        "title": "Episode 45",
        "season": 12,
        "episode": 45,
        "released": "2024-02-21",
        "overview": ""
      },
      {
        "id": "tvmaze:2755696",
        "title": "Episode 46",
        "season": 12,
        "episode": 46,
        "released": "2024-02-26",
        "overview": ""
      },
      {
        "id": "tvmaze:2755697",
        "title": "Episode 47",
        "season": 12,
        "episode": 47,
        "released": "2024-02-27",
        "overview": ""
      },
      {
        "id": "tvmaze:2755698",
        "title": "Episode 48",
        "season": 12,
        "episode": 48,
        "released": "2024-02-28",
        "overview": ""
      },
      {
        "id": "tvmaze:2771687",
        "title": "Episode 49",
        "season": 12,
        "episode": 49,
        "released": "2024-03-04",
        "overview": ""
      },
      {
        "id": "tvmaze:2771688",
        "title": "Episode 50",
        "season": 12,
        "episode": 50,
        "released": "2024-03-05",
        "overview": ""
      },
      {
        "id": "tvmaze:2771689",
        "title": "Episode 51",
        "season": 12,
        "episode": 51,
        "released": "2024-03-06",
        "overview": ""
      },
      {
        "id": "tvmaze:2771690",
        "title": "Episode 52",
        "season": 12,
        "episode": 52,
        "released": "2024-03-11",
        "overview": ""
      },
      {
        "id": "tvmaze:2771691",
        "title": "Episode 53",
        "season": 12,
        "episode": 53,
        "released": "2024-03-12",
        "overview": ""
      },
      {
        "id": "tvmaze:2771692",
        "title": "Episode 54",
        "season": 12,
        "episode": 54,
        "released": "2024-03-13",
        "overview": ""
      },
      {
        "id": "tvmaze:2771693",
        "title": "Episode 55",
        "season": 12,
        "episode": 55,
        "released": "2024-03-18",
        "overview": ""
      },
      {
        "id": "tvmaze:2771694",
        "title": "Episode 56",
        "season": 12,
        "episode": 56,
        "released": "2024-03-19",
        "overview": ""
      },
      {
        "id": "tvmaze:2771695",
        "title": "Episode 57",
        "season": 12,
        "episode": 57,
        "released": "2024-03-20",
        "overview": ""
      },
      {
        "id": "tvmaze:2771696",
        "title": "Episode 58",
        "season": 12,
        "episode": 58,
        "released": "2024-03-25",
        "overview": ""
      },
      {
        "id": "tvmaze:2771697",
        "title": "Episode 59",
        "season": 12,
        "episode": 59,
        "released": "2024-03-26",
        "overview": ""
      },
      {
        "id": "tvmaze:2771698",
        "title": "Episode 60",
        "season": 12,
        "episode": 60,
        "released": "2024-03-27",
        "overview": ""
      },
      {
        "id": "tvmaze:2817712",
        "title": "Episode 61",
        "season": 12,
        "episode": 61,
        "released": "2024-04-01",
        "overview": ""
      },
      {
        "id": "tvmaze:2817713",
        "title": "Episode 62",
        "season": 12,
        "episode": 62,
        "released": "2024-04-02",
        "overview": ""
      },
      {
        "id": "tvmaze:2817714",
        "title": "Episode 63",
        "season": 12,
        "episode": 63,
        "released": "2024-04-03",
        "overview": ""
      },
      {
        "id": "tvmaze:2817715",
        "title": "Episode 64",
        "season": 12,
        "episode": 64,
        "released": "2024-04-08",
        "overview": ""
      },
      {
        "id": "tvmaze:2817716",
        "title": "Episode 65",
        "season": 12,
        "episode": 65,
        "released": "2024-04-09",
        "overview": ""
      },
      {
        "id": "tvmaze:2817717",
        "title": "Episode 66",
        "season": 12,
        "episode": 66,
        "released": "2024-04-10",
        "overview": ""
      },
      {
        "id": "tvmaze:2817718",
        "title": "Episode 67",
        "season": 12,
        "episode": 67,
        "released": "2024-04-15",
        "overview": ""
      },
      {
        "id": "tvmaze:2817719",
        "title": "Episode 68",
        "season": 12,
        "episode": 68,
        "released": "2024-04-16",
        "overview": ""
      },
      {
        "id": "tvmaze:2817720",
        "title": "Episode 69",
        "season": 12,
        "episode": 69,
        "released": "2024-04-17",
        "overview": ""
      },
      {
        "id": "tvmaze:2817722",
        "title": "Episode 70",
        "season": 12,
        "episode": 70,
        "released": "2024-04-22",
        "overview": ""
      },
      {
        "id": "tvmaze:2817723",
        "title": "Episode 71",
        "season": 12,
        "episode": 71,
        "released": "2024-04-23",
        "overview": ""
      },
      {
        "id": "tvmaze:2817724",
        "title": "Episode 72",
        "season": 12,
        "episode": 72,
        "released": "2024-04-24",
        "overview": ""
      },
      {
        "id": "tvmaze:2817725",
        "title": "Episode 73",
        "season": 12,
        "episode": 73,
        "released": "2024-04-29",
        "overview": ""
      },
      {
        "id": "tvmaze:2817726",
        "title": "Episode 74",
        "season": 12,
        "episode": 74,
        "released": "2024-04-30",
        "overview": ""
      },
      {
        "id": "tvmaze:2817727",
        "title": "Episode 75",
        "season": 12,
        "episode": 75,
        "released": "2024-05-01",
        "overview": ""
      },
      {
        "id": "tvmaze:2849928",
        "title": "Episode 76",
        "season": 12,
        "episode": 76,
        "released": "2024-05-06",
        "overview": ""
      },
      {
        "id": "tvmaze:2849929",
        "title": "Episode 77",
        "season": 12,
        "episode": 77,
        "released": "2024-05-07",
        "overview": ""
      },
      {
        "id": "tvmaze:2849930",
        "title": "Episode 78",
        "season": 12,
        "episode": 78,
        "released": "2024-05-08",
        "overview": ""
      },
      {
        "id": "tvmaze:2849931",
        "title": "Episode 79",
        "season": 12,
        "episode": 79,
        "released": "2024-05-13",
        "overview": ""
      },
      {
        "id": "tvmaze:2849932",
        "title": "Episode 80",
        "season": 12,
        "episode": 80,
        "released": "2024-05-14",
        "overview": ""
      },
      {
        "id": "tvmaze:2849933",
        "title": "Episode 81",
        "season": 12,
        "episode": 81,
        "released": "2024-05-15",
        "overview": ""
      },
      {
        "id": "tvmaze:2849934",
        "title": "Episode 82",
        "season": 12,
        "episode": 82,
        "released": "2024-05-20",
        "overview": ""
      },
      {
        "id": "tvmaze:2849935",
        "title": "Episode 83",
        "season": 12,
        "episode": 83,
        "released": "2024-05-21",
        "overview": ""
      },
      {
        "id": "tvmaze:2849936",
        "title": "Episode 84",
        "season": 12,
        "episode": 84,
        "released": "2024-05-22",
        "overview": ""
      },
      {
        "id": "tvmaze:2849937",
        "title": "Episode 85",
        "season": 12,
        "episode": 85,
        "released": "2024-05-27",
        "overview": ""
      },
      {
        "id": "tvmaze:2849938",
        "title": "Episode 86",
        "season": 12,
        "episode": 86,
        "released": "2024-05-28",
        "overview": ""
      },
      {
        "id": "tvmaze:2849939",
        "title": "Episode 87",
        "season": 12,
        "episode": 87,
        "released": "2024-05-29",
        "overview": ""
      },
      {
        "id": "tvmaze:2892556",
        "title": "Episode 88",
        "season": 12,
        "episode": 88,
        "released": "2024-06-03",
        "overview": ""
      },
      {
        "id": "tvmaze:2892557",
        "title": "Episode 89",
        "season": 12,
        "episode": 89,
        "released": "2024-06-04",
        "overview": ""
      },
      {
        "id": "tvmaze:2892558",
        "title": "Episode 90",
        "season": 12,
        "episode": 90,
        "released": "2024-06-05",
        "overview": ""
      },
      {
        "id": "tvmaze:2892559",
        "title": "Episode 91",
        "season": 12,
        "episode": 91,
        "released": "2024-06-10",
        "overview": ""
      },
      {
        "id": "tvmaze:2892560",
        "title": "Episode 92",
        "season": 12,
        "episode": 92,
        "released": "2024-06-11",
        "overview": ""
      },
      {
        "id": "tvmaze:2892561",
        "title": "Episode 93",
        "season": 12,
        "episode": 93,
        "released": "2024-06-12",
        "overview": ""
      },
      {
        "id": "tvmaze:2892562",
        "title": "Episode 94",
        "season": 12,
        "episode": 94,
        "released": "2024-06-17",
        "overview": ""
      },
      {
        "id": "tvmaze:2892563",
        "title": "Episode 95",
        "season": 12,
        "episode": 95,
        "released": "2024-06-18",
        "overview": ""
      },
      {
        "id": "tvmaze:2892564",
        "title": "Episode 96",
        "season": 12,
        "episode": 96,
        "released": "2024-06-19",
        "overview": ""
      },
      {
        "id": "tvmaze:2892565",
        "title": "Episode 97",
        "season": 12,
        "episode": 97,
        "released": "2024-06-24",
        "overview": ""
      },
      {
        "id": "tvmaze:2892566",
        "title": "Episode 98",
        "season": 12,
        "episode": 98,
        "released": "2024-06-25",
        "overview": ""
      },
      {
        "id": "tvmaze:2892567",
        "title": "Episode 99",
        "season": 12,
        "episode": 99,
        "released": "2024-06-26",
        "overview": ""
      },
      {
        "id": "tvmaze:2926802",
        "title": "Episode 100",
        "season": 12,
        "episode": 100,
        "released": "2024-07-01",
        "overview": ""
      },
      {
        "id": "tvmaze:2926803",
        "title": "Episode 101",
        "season": 12,
        "episode": 101,
        "released": "2024-07-02",
        "overview": ""
      },
      {
        "id": "tvmaze:2926804",
        "title": "Episode 102",
        "season": 12,
        "episode": 102,
        "released": "2024-07-03",
        "overview": ""
      },
      {
        "id": "tvmaze:2926805",
        "title": "Episode 103",
        "season": 12,
        "episode": 103,
        "released": "2024-07-08",
        "overview": ""
      },
      {
        "id": "tvmaze:2926806",
        "title": "Episode 104",
        "season": 12,
        "episode": 104,
        "released": "2024-07-09",
        "overview": ""
      },
      {
        "id": "tvmaze:2926807",
        "title": "Episode 105",
        "season": 12,
        "episode": 105,
        "released": "2024-07-10",
        "overview": ""
      },
      {
        "id": "tvmaze:2926808",
        "title": "Episode 106",
        "season": 12,
        "episode": 106,
        "released": "2024-07-15",
        "overview": ""
      },
      {
        "id": "tvmaze:2926809",
        "title": "Episode 107",
        "season": 12,
        "episode": 107,
        "released": "2024-07-16",
        "overview": ""
      },
      {
        "id": "tvmaze:2926810",
        "title": "Episode 108",
        "season": 12,
        "episode": 108,
        "released": "2024-07-17",
        "overview": ""
      },
      {
        "id": "tvmaze:2926811",
        "title": "Episode 109",
        "season": 12,
        "episode": 109,
        "released": "2024-07-22",
        "overview": ""
      },
      {
        "id": "tvmaze:2926812",
        "title": "Episode 110",
        "season": 12,
        "episode": 110,
        "released": "2024-07-23",
        "overview": ""
      },
      {
        "id": "tvmaze:2926813",
        "title": "Episode 111",
        "season": 12,
        "episode": 111,
        "released": "2024-07-24",
        "overview": ""
      },
      {
        "id": "tvmaze:2926814",
        "title": "Episode 112",
        "season": 12,
        "episode": 112,
        "released": "2024-07-29",
        "overview": ""
      },
      {
        "id": "tvmaze:2926815",
        "title": "Episode 113",
        "season": 12,
        "episode": 113,
        "released": "2024-07-30",
        "overview": ""
      },
      {
        "id": "tvmaze:2926816",
        "title": "Episode 114",
        "season": 12,
        "episode": 114,
        "released": "2024-07-31",
        "overview": ""
      },
      {
        "id": "tvmaze:2970307",
        "title": "Episode 115",
        "season": 12,
        "episode": 115,
        "released": "2024-08-05",
        "overview": ""
      },
      {
        "id": "tvmaze:2970308",
        "title": "Episode 116",
        "season": 12,
        "episode": 116,
        "released": "2024-08-06",
        "overview": ""
      },
      {
        "id": "tvmaze:2970309",
        "title": "Episode 117",
        "season": 12,
        "episode": 117,
        "released": "2024-08-07",
        "overview": ""
      },
      {
        "id": "tvmaze:2970310",
        "title": "Episode 118",
        "season": 12,
        "episode": 118,
        "released": "2024-08-08",
        "overview": ""
      },
      {
        "id": "tvmaze:2970311",
        "title": "Episode 119",
        "season": 12,
        "episode": 119,
        "released": "2024-08-09",
        "overview": ""
      },
      {
        "id": "tvmaze:2970312",
        "title": "Episode 120",
        "season": 12,
        "episode": 120,
        "released": "2024-08-12",
        "overview": ""
      },
      {
        "id": "tvmaze:2970313",
        "title": "Episode 121",
        "season": 12,
        "episode": 121,
        "released": "2024-08-13",
        "overview": ""
      },
      {
        "id": "tvmaze:2970314",
        "title": "Episode 122",
        "season": 12,
        "episode": 122,
        "released": "2024-08-14",
        "overview": ""
      },
      {
        "id": "tvmaze:2970315",
        "title": "Episode 123",
        "season": 12,
        "episode": 123,
        "released": "2024-08-15",
        "overview": ""
      },
      {
        "id": "tvmaze:2970316",
        "title": "Episode 124",
        "season": 12,
        "episode": 124,
        "released": "2024-08-16",
        "overview": ""
      },
      {
        "id": "tvmaze:2970317",
        "title": "Episode 125",
        "season": 12,
        "episode": 125,
        "released": "2024-08-19",
        "overview": ""
      },
      {
        "id": "tvmaze:2970318",
        "title": "Episode 126",
        "season": 12,
        "episode": 126,
        "released": "2024-08-20",
        "overview": ""
      },
      {
        "id": "tvmaze:2974504",
        "title": "Episode 127",
        "season": 12,
        "episode": 127,
        "released": "2024-08-21",
        "overview": ""
      },
      {
        "id": "tvmaze:2974505",
        "title": "Episode 128",
        "season": 12,
        "episode": 128,
        "released": "2024-08-22",
        "overview": ""
      },
      {
        "id": "tvmaze:2974506",
        "title": "Episode 129",
        "season": 12,
        "episode": 129,
        "released": "2024-08-23",
        "overview": ""
      },
      {
        "id": "tvmaze:2974507",
        "title": "Episode 130",
        "season": 12,
        "episode": 130,
        "released": "2024-08-26",
        "overview": ""
      },
      {
        "id": "tvmaze:2974508",
        "title": "Episode 131",
        "season": 12,
        "episode": 131,
        "released": "2024-08-27",
        "overview": ""
      },
      {
        "id": "tvmaze:2974509",
        "title": "Episode 132",
        "season": 12,
        "episode": 132,
        "released": "2024-08-28",
        "overview": ""
      },
      {
        "id": "tvmaze:2974510",
        "title": "Episode 133",
        "season": 12,
        "episode": 133,
        "released": "2024-08-29",
        "overview": ""
      },
      {
        "id": "tvmaze:2974511",
        "title": "Episode 134",
        "season": 12,
        "episode": 134,
        "released": "2024-08-30",
        "overview": ""
      },
      {
        "id": "tvmaze:2998157",
        "title": "Episode 135",
        "season": 12,
        "episode": 135,
        "released": "2024-09-02",
        "overview": ""
      },
      {
        "id": "tvmaze:2998158",
        "title": "Episode 136",
        "season": 12,
        "episode": 136,
        "released": "2024-09-03",
        "overview": ""
      },
      {
        "id": "tvmaze:2998159",
        "title": "Episode 137",
        "season": 12,
        "episode": 137,
        "released": "2024-09-04",
        "overview": ""
      },
      {
        "id": "tvmaze:2998160",
        "title": "Episode 138",
        "season": 12,
        "episode": 138,
        "released": "2024-09-05",
        "overview": ""
      },
      {
        "id": "tvmaze:2998161",
        "title": "Episode 139",
        "season": 12,
        "episode": 139,
        "released": "2024-09-06",
        "overview": ""
      },
      {
        "id": "tvmaze:2998162",
        "title": "Episode 140",
        "season": 12,
        "episode": 140,
        "released": "2024-09-09",
        "overview": ""
      },
      {
        "id": "tvmaze:2998163",
        "title": "Episode 141",
        "season": 12,
        "episode": 141,
        "released": "2024-09-10",
        "overview": ""
      },
      {
        "id": "tvmaze:2998164",
        "title": "Episode 142",
        "season": 12,
        "episode": 142,
        "released": "2024-09-11",
        "overview": ""
      },
      {
        "id": "tvmaze:2998165",
        "title": "Episode 143",
        "season": 12,
        "episode": 143,
        "released": "2024-09-12",
        "overview": ""
      },
      {
        "id": "tvmaze:2998166",
        "title": "Episode 144",
        "season": 12,
        "episode": 144,
        "released": "2024-09-13",
        "overview": ""
      },
      {
        "id": "tvmaze:3007222",
        "title": "Episode 145",
        "season": 12,
        "episode": 145,
        "released": "2024-09-16",
        "overview": ""
      },
      {
        "id": "tvmaze:3007223",
        "title": "Episode 146",
        "season": 12,
        "episode": 146,
        "released": "2024-09-17",
        "overview": ""
      },
      {
        "id": "tvmaze:3007224",
        "title": "Episode 147",
        "season": 12,
        "episode": 147,
        "released": "2024-09-18",
        "overview": ""
      },
      {
        "id": "tvmaze:3007225",
        "title": "Episode 148",
        "season": 12,
        "episode": 148,
        "released": "2024-09-19",
        "overview": ""
      },
      {
        "id": "tvmaze:3007226",
        "title": "Episode 149",
        "season": 12,
        "episode": 149,
        "released": "2024-09-20",
        "overview": ""
      },
      {
        "id": "tvmaze:3007227",
        "title": "Episode 150",
        "season": 12,
        "episode": 150,
        "released": "2024-09-23",
        "overview": ""
      },
      {
        "id": "tvmaze:3060395",
        "title": "Episode 151",
        "season": 12,
        "episode": 151,
        "released": "2024-09-24",
        "overview": ""
      },
      {
        "id": "tvmaze:3060396",
        "title": "Episode 152",
        "season": 12,
        "episode": 152,
        "released": "2024-09-25",
        "overview": ""
      },
      {
        "id": "tvmaze:3060397",
        "title": "Episode 153",
        "season": 12,
        "episode": 153,
        "released": "2024-09-26",
        "overview": ""
      },
      {
        "id": "tvmaze:3060398",
        "title": "Episode 154",
        "season": 12,
        "episode": 154,
        "released": "2024-09-27",
        "overview": ""
      },
      {
        "id": "tvmaze:3060399",
        "title": "Episode 155",
        "season": 12,
        "episode": 155,
        "released": "2024-09-30",
        "overview": ""
      },
      {
        "id": "tvmaze:3060400",
        "title": "Episode 156",
