{
  "meta": {
    "id": "tvmaze:8566",
    "type": "series",
    "name": "Good Morning America",
    "description": "Good Morning America is a two-hour, live program anchored by Robin Roberts, George Stephanopoulos and Michael Strahan. Lara Spencer is the entertainmnt anchor, and Ginger Zee is the chief meteorologist.",
    "poster": "https://static.tvmaze.com/uploads/images/original_untouched/449/1122639.jpg",
    "background": "https://static.tvmaze.com/uploads/images/original_untouched/449/1122639.jpg",
    "videos": [
      {
        "id": "tvmaze:3457431",
        "title": "Samuel Arnold, Bruno Gouery",
        "season": 2025,
        "episode": 248,
        "released": "2025-12-12",
        "overview": "Actors Samuel Arnold and Bruno Gouery (\"Emily in Paris\"); Lori's Trend Lab: Holiday Hosting with \"GMA\" lifestyle contributor Lori Bergamotto; Deals &amp; Steals: Holiday Gifting with ABC e-commerce editor Tory Johnson."
      },
      {
        "id": "tvmaze:715223",
        "title": "November 3, 1975",
        "season": 1975,
        "episode": 1,
        "released": "1975-11-03",
        "overview": ""
      },
      {
        "id": "tvmaze:1524755",
        "title": "Episode 2",
        "season": 1975,
        "episode": 2,
        "released": "1975-11-04",
        "overview": ""
      },
      {
        "id": "tvmaze:1524756",
        "title": "Episode 3",
        "season": 1975,
        "episode": 3,
        "released": "1975-11-05",
        "overview": ""
      },
      {
        "id": "tvmaze:2087999",
        "title": "Dec 15, 1975",
        "season": 1975,
        "episode": 249,
        "released": "1975-12-15",
        "overview": ""
      },
      {
        "id": "tvmaze:1686250",
        "title": "Episode 1",
        "season": 1984,
        "episode": 1,
        "released": "1984-01-02",
        "overview": ""
      },
      {
        "id": "tvmaze:1524759",
        "title": "Episode 1",
        "season": 1985,
        "episode": 1,
        "released": "1985-01-01",
        "overview": ""
      },
      {
        "id": "tvmaze:1524757",
        "title": "January 1, 1986",
        "season": 1986,
        "episode": 1,
        "released": "1986-01-01",
        "overview": ""
      },
      {
        "id": "tvmaze:1524758",
        "title": "January 2, 1986",
        "season": 1986,
        "episode": 2,
        "released": "1986-01-02",
        "overview": ""
      },
      {
        "id": "tvmaze:1524766",
        "title": "January 3, 1986",
        "season": 1986,
        "episode": 3,
        "released": "1986-01-03",
        "overview": ""
      },
      {
        "id": "tvmaze:471079",
        "title": "March 30, 1990",
        "season": 1990,
        "episode": 1,
        "released": "1990-03-30",
        "overview": ""
      },
      {
        "id": "tvmaze:471080",
        "title": "12/23/03",
        "season": 2003,
        "episode": 1,
        "released": "2003-12-23",
        "overview": ""
      },
      {
        "id": "tvmaze:471081",
        "title": "12/22/03",
        "season": 2003,
        "episode": 2,
        "released": "2003-12-22",
        "overview": ""
      },
      {
        "id": "tvmaze:471082",
        "title": "12/24/03",
        "season": 2003,
        "episode": 3,
        "released": "2003-12-24",
        "overview": ""
      },
      {
        "id": "tvmaze:471083",
        "title": "12/26/03",
        "season": 2003,
        "episode": 4,
        "released": "2003-12-26",
        "overview": ""
      },
      {
        "id": "tvmaze:471084",
        "title": "12/25/03",
        "season": 2003,
        "episode": 5,
        "released": "2003-12-25",
        "overview": ""
      },
      {
        "id": "tvmaze:471085",
        "title": "2/16/04",
        "season": 2004,
        "episode": 1,
        "released": "2004-02-16",
        "overview": ""
      },
      {
        "id": "tvmaze:471086",
        "title": "6/12/04",
        "season": 2004,
        "episode": 2,
        "released": "2004-06-12",
        "overview": ""
      },
      {
        "id": "tvmaze:471087",
        "title": "LOST Special",
        "season": 2005,
        "episode": 1,
        "released": "2005-03-01",
        "overview": ""
      },
      {
        "id": "tvmaze:471088",
        "title": "Denzel Washington",
        "season": 2005,
        "episode": 2,
        "released": "2005-03-25",
        "overview": ""
      },
      {
        "id": "tvmaze:471089",
        "title": "Meeting The Bachlor",
        "season": 2005,
        "episode": 3,
        "released": "2005-03-28",
        "overview": ""
      },
      {
        "id": "tvmaze:471090",
        "title": "Lisa Marie Preseley",
        "season": 2005,
        "episode": 4,
        "released": "2005-03-29",
        "overview": ""
      },
      {
        "id": "tvmaze:471091",
        "title": "Remembering The John Paul II",
        "season": 2005,
        "episode": 5,
        "released": "2005-04-04",
        "overview": ""
      },
      {
        "id": "tvmaze:471092",
        "title": "Jane Fonda",
        "season": 2005,
        "episode": 6,
        "released": "2005-04-05",
        "overview": ""
      },
      {
        "id": "tvmaze:471093",
        "title": "Jane Fonda 2",
        "season": 2005,
        "episode": 7,
        "released": "2005-04-06",
        "overview": ""
      },
      {
        "id": "tvmaze:471094",
        "title": "Pope Remembered 2",
        "season": 2005,
        "episode": 8,
        "released": "2005-04-07",
        "overview": ""
      },
      {
        "id": "tvmaze:471095",
        "title": "Mariah Carey",
        "season": 2005,
        "episode": 9,
        "released": "2005-04-12",
        "overview": ""
      },
      {
        "id": "tvmaze:715245",
        "title": "Monday, April 18",
        "season": 2016,
        "episode": 77,
        "released": "2016-04-18",
        "overview": "\"GMA\" will hold a live town hall discussion with Republican Presidential Candidate Ted Cruz ahead of Tuesday's New York Primary; Senator Cruz will be joined by his wife, Heidi, for a portion of the discussion; George Stephanopoulos and Robin Roberts will moderate, and Cruz will address questions from voters in the audience, via remote across the country and on social media"
      },
      {
        "id": "tvmaze:715260",
        "title": "Tuesday, April 19",
        "season": 2016,
        "episode": 78,
        "released": "2016-04-19",
        "overview": "Actors Johnny Knoxville, Alex Pettyfer and Colin Hanks (\"Elvis &amp; Nixon\"); the couple voted off last night's \"Dancing with the Stars\"; Jesse Palmer reports from Orlando on all the exciting new attractions Disney is offering this summer – from Star Wars to Frozen to Animal Kingdom after dark; \"Passion for Profit\": GMA celebrates the young entrepreneurs who have pursued their dreams and made big profits doing something they love, with advice from \"Shark Tank\" host Barbara Corcoran"
      },
      {
        "id": "tvmaze:715270",
        "title": "Wednesday, April 20",
        "season": 2016,
        "episode": 79,
        "released": "2016-04-20",
        "overview": "Actress Brooke Burke-Charvet discusses her new book, \"Chicken Soup for the Soul: the Joy of Less,\" with Amy Newmark and provides tips on how to de-clutter our lives; an interview with the actors of HBO's \"Game of Thrones\"; editorial director Jess Cagle reveals People Magazine's Most Beautiful People issue; \"Passion to Profit\" week continues: the young fashion entrepreneurs who are rising stars in the business world, with advice from fashion designer Rebecca Minkoff"
      },
      {
        "id": "tvmaze:715281",
        "title": "Thursday, April 21",
        "season": 2016,
        "episode": 80,
        "released": "2016-04-21",
        "overview": "An interview with the actresses of \"Game of Thrones\"; \"Deals and Steals\" with contributor Tory Johnson; \"Passion for Profit\" continues with young entrepreneurs who are rising stars in the business world"
      },
      {
        "id": "tvmaze:715291",
        "title": "Friday, April 22",
        "season": 2016,
        "episode": 81,
        "released": "2016-04-22",
        "overview": "Actors Kevin Spacey and Michael Shannon (\"Elvis &amp; Nixon\"); actor Nikolaj Coster-Waldau (\"Game of Thrones\"); chef and television personality Aaron Sanchez"
      },
      {
        "id": "tvmaze:740274",
        "title": "Monday, April 25",
        "season": 2016,
        "episode": 82,
        "released": "2016-04-25",
        "overview": "An interview with the actresses of \"Game of Thrones\"; a performance by singer and songwriter Maren Morris; Martha Stewart Weddings Editor Darcy Miller with the latest wedding dress trends; \"Passion for Profit\" continues with young entrepreneurs who are rising stars in the business world."
      },
      {
        "id": "tvmaze:740277",
        "title": "Tuesday, April 26",
        "season": 2016,
        "episode": 83,
        "released": "2016-04-26",
        "overview": "Entrepreneur and philanthropist Phil Knight on his new memoir (\"Shoe Dog\"); food blogger Andie Mitchell (\"Cook Yourself Slim\"); \"The Knot\" Editor in Chief Kellie Gould with popular flower girl fashions; the couple voted off last night's \"Dancing with the Stars\"; \"GMA\"'s Infertility Series: one woman's journey freezing her eggs."
      },
      {
        "id": "tvmaze:740283",
        "title": "Wednesday, April 27",
        "season": 2016,
        "episode": 84,
        "released": "2016-04-27",
        "overview": "Actor Robert Downey, Jr. (\"Captain America: Civil War\"); Good Housekeeping's Lori Bergamotto discusses popular wedding trends; UFC Takeover; \"GMA\"'s Infertility series continues with people who are crowdsourcing their ability to have children in the future."
      },
      {
        "id": "tvmaze:740288",
        "title": "Thursday, April 28",
        "season": 2016,
        "episode": 85,
        "released": "2016-04-28",
        "overview": "Actresses Susan Sarandon and Geena Davis (\"25th Anniversary: Thelma &amp; Louise\"); \"Deals and Steals\" with contributor Tory Johnson; \"GMA\"'s Epic Wedding Event kicks off as 100 couples get married across America and across the globe in 24 hours; \"GMA\"'s Infertility series continues: the latest in new packaged fertility testing"
      },
      {
        "id": "tvmaze:740292",
        "title": "Friday, April 29",
        "season": 2016,
        "episode": 86,
        "released": "2016-04-29",
        "overview": "Actors Jennifer Aniston and Jason Sudeikis (\"Mother's Day\"); \"GMA\"'s Epic Wedding Event concludes as 16 couples get married live in Times Square; a performance by Boyz II Men."
      },
      {
        "id": "tvmaze:779275",
        "title": "Monday, May 2",
        "season": 2016,
        "episode": 87,
        "released": "2016-05-02",
        "overview": ""
      },
      {
        "id": "tvmaze:779276",
        "title": "Tuesday, May 3",
        "season": 2016,
        "episode": 88,
        "released": "2016-05-03",
        "overview": ""
      },
      {
        "id": "tvmaze:779277",
        "title": "Wednesday, May 4",
        "season": 2016,
        "episode": 89,
        "released": "2016-05-04",
        "overview": ""
      },
      {
        "id": "tvmaze:779278",
        "title": "Thursday, May 5",
        "season": 2016,
        "episode": 90,
        "released": "2016-05-05",
        "overview": ""
      },
      {
        "id": "tvmaze:779279",
        "title": "Friday, May 6",
        "season": 2016,
        "episode": 91,
        "released": "2016-05-06",
        "overview": ""
      },
      {
        "id": "tvmaze:779280",
        "title": "Monday, May 9",
        "season": 2016,
        "episode": 92,
        "released": "2016-05-09",
        "overview": "Robin Roberts sits down with Prince Harry and First Lady Michelle Obama for an exclusive interview in Orlando at the 2016 Invictus Games; a performance by country singer Cole Swindell; the quintuplets in TLC's new series \"OutDaughtered\"; \"GMA\"'s The Skin You're In series: New info about skin cancer and how to protect yourself; one couple's journey visiting all the US national parks"
      },
      {
        "id": "tvmaze:779281",
        "title": "Tuesday, May 10",
        "season": 2016,
        "episode": 93,
        "released": "2016-05-10",
        "overview": "\"GMA\" is live from Gunnison National Park in Colorado; a performance by the pop band Lukas Graham; the couple voted off last night's \"Dancing with the Stars\"; television personality John Walsh and his son Callahan on raising awareness for missing children; a look at the cutting edge surgery that allows you to throw away your reading glasses"
      },
      {
        "id": "tvmaze:779283",
        "title": "Wednesday, May 11",
        "season": 2016,
        "episode": 94,
        "released": "2016-05-11",
        "overview": "Pop superstar Demi Lovato; actress Lana Parrilla (\"Once Upon a Time\"); GMA's The Skin You're In series: Five-minute anti-aging fixes"
      },
      {
        "id": "tvmaze:779285",
        "title": "Thursday, May 12",
        "season": 2016,
        "episode": 95,
        "released": "2016-05-12",
        "overview": "Actor Ryan Gosling (\"The Nice Guys\"); behind the scenes of Broadway's Hamilton; \"Deals and Steals\" with contributor Tory Johnson; \"GMA\" is live from Smoky Mountains National Park in Tennessee; \"GMA\"'s The Skin You're In series"
      },
      {
        "id": "tvmaze:779287",
        "title": "Friday, May 13",
        "season": 2016,
        "episode": 96,
        "released": "2016-05-13",
        "overview": "Actor Russell Crowe (\"The Nice Guys\"); a performance by Meghan Trainor; GMA's \"The Skin You're In\" series"
      },
      {
        "id": "tvmaze:781416",
        "title": "Monday, May 16",
        "season": 2016,
        "episode": 97,
        "released": "2016-05-16",
        "overview": "Actor Michael Fassbender (\"X-Men: Apocalypse\"); \"GMA\" gets an exclusive look inside NFL star Devon Still's wedding"
      },
      {
        "id": "tvmaze:781417",
        "title": "Tuesday, May 17",
        "season": 2016,
        "episode": 98,
        "released": "2016-05-17",
        "overview": "Television personality, model, and new mom Chrissy Teigen; a performance by musician and producer KYGO; the couple voted off last night's \"Dancing with the Stars\""
      },
      {
        "id": "tvmaze:781418",
        "title": "Wednesday, May 18",
        "season": 2016,
        "episode": 99,
        "released": "2016-05-18",
        "overview": "Global superstar Celine Dion speaks out exclusively on how she is coping after the death of her husband and brother; a performance by the hit band Coldplay; \"GMA\" Senior Medical Contributor Dr. Jennifer Ashton discusses her new book, \"Eat This, Not That: When You're Expecting\"; young kids give advice to graduating college seniors; \"GMA\"'s Biggest Waste of Money Series: Groceries – the most common ways we waste money on groceries and tips for turning the waste into savings"
      },
      {
        "id": "tvmaze:781419",
        "title": "Thursday, May 19",
        "season": 2016,
        "episode": 100,
        "released": "2016-05-19",
        "overview": "Actor Anthony Mackie and Bryan Cranston (HBO's \"All the Way\"); television personality and philanthropist Pat Smith (\"Second Chances\"); \"Deals and Steals\" with contributor Tory Johnson; \"GMA\"'s Biggest Waste of Money Series: Make-Up – the most common ways we waste our money on make-up and tips for turning the waste into savings"
      },
      {
        "id": "tvmaze:781420",
        "title": "Friday, May 20",
        "season": 2016,
        "episode": 101,
        "released": "2016-05-20",
        "overview": "Grammy-nominated singer Ariana Grande kicks-off \"GMA\"'s summer concert series in Central Park's Rumsey Playfield; actor Matt Bomer (\"The Nice Guys\"); \"GMA\"'s Biggest Waste of Money Series: Cell Phones – the most common ways we waste money on cell phones and tips for turning the waste into savings"
      },
      {
        "id": "tvmaze:781421",
        "title": "Monday, May 23",
        "season": 2016,
        "episode": 102,
        "released": "2016-05-23",
        "overview": "\"The Bachelorette\" Jojo Fletcher; actor Sean Hayes (Broadway's \"Act of God\"); actor Matt Leblanc (BBC America's \"Top Gear\"); model Ashley Graham with her new swimwear line; all the highlights from last night's Billboard Music Awards."
      },
      {
        "id": "tvmaze:781422",
        "title": "Tuesday, May 24",
        "season": 2016,
        "episode": 103,
        "released": "2016-05-24",
        "overview": "Actress and singer Jennifer Lopez; an interview with actor James McAvoy and the new generation cast of X-Men: Apocalypse; former \"Bachelorette\" Andi Dorfman on her new book (\"It's Not Okay\"); behind the scenes of tonight's \"Dancing with the Stars\" finale; \"GMA\"'s series: \"What Your Kids Don't Want You To Know.\""
      },
      {
        "id": "tvmaze:781423",
        "title": "Wednesday, May 25",
        "season": 2016,
        "episode": 104,
        "released": "2016-05-25",
        "overview": "\"GMA\" rolls out the red carpet for the final three \"Dancing with the Stars\" couples following last night's season finale, with exclusive live interviews with the couples and questions from viewers; plus the finalists dazzle the audience with one more dance; singer and songwriter Pink on her single for \"Alice Through the Looking Glass.\""
      },
      {
        "id": "tvmaze:781424",
        "title": "Thursday, May 26",
        "season": 2016,
        "episode": 105,
        "released": "2016-05-26",
        "overview": "Actors Adam Sandler and David Spade (Netflix's \"The Do-Over\"); an interview with the cast of \"X-Men: Apocalypse,\" including Jennifer Lawrence, Sophie Turner, James McAvoy and Oscar Isaac; \"Deals and Steals\" with contributor Tory Johnson; ABC News anchor Dan Harris previews ABC's \"500 Questions\"; GMA's series: \"What Your Kids Don't Want You To Know.\""
      },
      {
        "id": "tvmaze:781425",
        "title": "Friday, May 27",
        "season": 2016,
        "episode": 106,
        "released": "2016-05-27",
        "overview": "Flo Rida performs as part of \"GMA\"'s summer concert series in Central Park's Rumsey Playfield; actress Anne Hathaway (\"Alice Through the Looking Glass\")."
      },
      {
        "id": "tvmaze:781426",
        "title": "Monday, May 30",
        "season": 2016,
        "episode": 107,
        "released": "2016-05-30",
        "overview": "Actress Goldie Hawn; actress Saoirse Ronan; interview with the cast of \"Roots\"; Netflix series \"Chef's Table\"; new series \"Weight Loss Win\" kicks off with Dr. Jennifer Ashton."
      },
      {
        "id": "tvmaze:781427",
        "title": "Tuesday, May 31",
        "season": 2016,
        "episode": 108,
        "released": "2016-05-31",
        "overview": "Viral internet ballerinas perform Jason Derulo routine live; Sam Claflin and Emilia Clarke (\"Me Before You\"); \"The Bachelorette\" fashion with Jojo Fletcher; chef Sandra Lee grilling segment; \"Weight Loss Win\" continues with \"Science of cheat days: do they really work?\""
      },
      {
        "id": "tvmaze:781428",
        "title": "Wednesday, June 1",
        "season": 2016,
        "episode": 109,
        "released": "2016-06-01",
        "overview": "Actress Penelope Cruz; performance by The Monkees; \"Weight Loss Win\" continues with \"Best moves to keep it off in the long run.\""
      },
      {
        "id": "tvmaze:781429",
        "title": "Thursday, June 2",
        "season": 2016,
        "episode": 110,
        "released": "2016-06-02",
        "overview": "Actress Julia Stiles (\"Blackway\"); \"Deals and Steals\" with contributor Tory Johnson; \"Weight Loss Win\" segment \"Oprah's message to her weight watchers.\""
      },
      {
        "id": "tvmaze:781430",
        "title": "Friday, June 3",
        "season": 2016,
        "episode": 111,
        "released": "2016-06-03",
        "overview": "Pitbull performs as part of \"GMA\"'s Summer Concert Series in Central Park; Behind the scenes on the set of \"Independence Day\"; \"Weight Loss Win\" series ends with \"Body fat scales: how well do they work?\""
      },
      {
        "id": "tvmaze:781431",
        "title": "Monday, June 6",
        "season": 2016,
        "episode": 112,
        "released": "2016-06-06",
        "overview": "A performance by the pop duo Tegan and Sara; Dr. Tanya Altman discusses her new book (\"What to Feed Your Baby\"); a sneak preview of tonight's \"The Bachelorette.\""
      },
      {
        "id": "tvmaze:781432",
        "title": "Tuesday, June 7",
        "season": 2016,
        "episode": 113,
        "released": "2016-06-07",
        "overview": "Actor Scott Speedman (TNT's \"Animal Kingdom\"); former \"Bachelorette\" Desiree Hartsock on her new book, \"My Fairytale Wedding: Planning Your Dream Wedding Without Breaking the Bank\"; animal expert Jack Hanna; Miss USA Olivia Jordan; Princess Diana's private chef, Darren McGrady, shares his memories; a preview of Robin Roberts' interview with R&amp;B singer Bobby Brown on a special edition of \"20/20,\" airing tonight on ABC."
      },
      {
        "id": "tvmaze:781433",
        "title": "Wednesday, June 8",
        "season": 2016,
        "episode": 114,
        "released": "2016-06-08",
        "overview": "NFL star quarterback Cam Newton; the November Project workout; beach snack hacks with food editor and writer Elettra Wiedemann."
      },
      {
        "id": "tvmaze:781434",
        "title": "Thursday, June 9",
        "season": 2016,
        "episode": 115,
        "released": "2016-06-09",
        "overview": "Actor Patrick Wilson (\"The Conjuring 2\"); actor Mike Epps (\"Uncle Buck); former LA District Attorney Gil Garcetti (ESPN's 30 for 30 Documentary \"OJ: Made in America\"); \"Deals and Steals\" with contributor Tory Johnson."
      },
      {
        "id": "tvmaze:781435",
        "title": "Friday, June 10",
        "season": 2016,
        "episode": 116,
        "released": "2016-06-10",
        "overview": "Music superstar Iggy Azalea performs as part of \"GMA's\" summer concert series in Central Park's Rumsey Playfield; People and Entertainment Weekly Editorial Director Jess Cagle and actor Jerry O'Connell (ABC's \"People's List\")"
      },
      {
        "id": "tvmaze:781436",
        "title": "Monday, June 13",
        "season": 2016,
        "episode": 117,
        "released": "2016-06-13",
        "overview": "Actor Liam Hemsworth (\"Independence Day: Resurgence\"); award-winning R&amp;B singer Bobby Brown (\"Every Little Step: My Story\"); actors Kevin Hart and Dwayne \"The Rock\" Johnson (\"Central Intelligence\"); chef George Duran with a Father's Day Cook-Off; EIGHT finalists announced in GMA's Musical.ly challenge."
      },
      {
        "id": "tvmaze:781437",
        "title": "Tuesday, June 14",
        "season": 2016,
        "episode": 118,
        "released": "2016-06-14",
        "overview": "Robin Roberts reports from Shanghai; television personality Ellen DeGeneres (\"Finding Dory\"); actress Vivica A. Fox (\"Independence Day: Resurgence\"); former NBA star Yao Ming; four finalists announced in \"GMA\"'s Musical.ly challenge"
      },
      {
        "id": "tvmaze:781438",
        "title": "Wednesday, June 15",
        "season": 2016,
        "episode": 119,
        "released": "2016-06-15",
        "overview": "Robin Roberts live from Shanghai Disney Resort; chefs Wolfgang Puck and Alan Orreal preview the food of Shanghai Disney; the Mandarin-language version of \"The Lion King\" premieres at the resort; ABC News' Bob Woodruff takes viewers' on all the rides and attractions"
      },
      {
        "id": "tvmaze:781439",
        "title": "Thursday, June 16",
        "season": 2016,
        "episode": 120,
        "released": "2016-06-16",
        "overview": "Oprah Winfrey (OWN's original series \"Greenleaf\"); a reunion with the cast of \"Ugly Betty\"; Deals and Steals\" with contributor Tory Johnson; the 2 finalists announced in GMA's Musical.ly challenge"
      },
      {
        "id": "tvmaze:781440",
        "title": "Friday, June 17",
        "season": 2016,
        "episode": 121,
        "released": "2016-06-17",
        "overview": "Pop superstar Demi Lovato performs as part of \"GMA\"'s summer concert series in Central Park's Rumsey Playfield; actor Ty Burrell (\"Finding Dory\" and ABC's \"Modern Family\"); the winner is announced in \"GMA\"'s Musical.ly challenge"
      },
      {
        "id": "tvmaze:781441",
        "title": "Monday, June 20",
        "season": 2016,
        "episode": 122,
        "released": "2016-06-20",
        "overview": "The cast of \"Orange Is The New Black\": Uzo Aduba, Taylor Schilling, Laura Prepon, Blair Brown and Kate Mulgrew; actor Alexander Skarsgård (\"Tarzan\"); Ginger Zee is live from Fort Myers, Florida, on National Seashell Day."
      },
      {
        "id": "tvmaze:781442",
        "title": "Tuesday, June 21",
        "season": 2016,
        "episode": 123,
        "released": "2016-06-21",
        "overview": "Professional wrestler and WWE Champion John Cena; actress Julia Louis-Dreyfus (HBO's \"Veep\"); actresses Anna Kendrick and Aubrey Plaza (\"Mike and Dave Need Wedding Dates\"); \"GMA\" and Redbook's series: \"Secrets to a Better Marriage.\""
      },
      {
        "id": "tvmaze:781443",
        "title": "Wednesday, June 22",
        "season": 2016,
        "episode": 124,
        "released": "2016-06-22",
        "overview": "Actor Liam Hemsworth (\"Independence Day: Resurgence\"); actress Uzo Aduba (\"Orange Is the New Black\"); television personality and author Bethenny Frankel; a performance by Fitz and the Tantrums; \"GMA\" and Redbook's series: \"Secrets to a Better Marriage.\""
      },
      {
        "id": "tvmaze:781444",
        "title": "Thursday, June 23",
        "season": 2016,
        "episode": 125,
        "released": "2016-06-23",
        "overview": "The cast of \"Independence Day\"; actress Penelope Wilton (Showtime's \"The BFG\"); Facebook executive and author Sheryl Sandberg (\"Lean In\"); \"Deals and Steals\" with contributor Tory Johnson; chef and New York City restaurant owner Chris Santos."
      },
      {
        "id": "tvmaze:781445",
        "title": "Friday, June 24",
        "season": 2016,
        "episode": 126,
        "released": "2016-06-24",
        "overview": "Country music star Brad Paisley performs as part of \"GMA\"'s summer concert series in Central Park's Rumsey Playfield; ABC News' John Quinones (\"What Would You Do?\")"
      },
      {
        "id": "tvmaze:781446",
        "title": "Monday, June 27",
        "season": 2016,
        "episode": 127,
        "released": "2016-06-27",
        "overview": ""
      },
      {
        "id": "tvmaze:781447",
        "title": "Tuesday, June 28",
        "season": 2016,
        "episode": 128,
        "released": "2016-06-28",
        "overview": ""
      },
      {
        "id": "tvmaze:781448",
        "title": "Wednesday, June 29",
        "season": 2016,
        "episode": 129,
        "released": "2016-06-29",
        "overview": ""
      },
      {
        "id": "tvmaze:781449",
        "title": "Thursday, June 30",
        "season": 2016,
        "episode": 130,
        "released": "2016-06-30",
        "overview": ""
      },
      {
        "id": "tvmaze:781450",
        "title": "Friday, July 1",
        "season": 2016,
        "episode": 131,
        "released": "2016-07-01",
        "overview": ""
      },
      {
        "id": "tvmaze:781451",
        "title": "Monday, July 4",
        "season": 2016,
        "episode": 132,
        "released": "2016-07-04",
        "overview": ""
      },
      {
        "id": "tvmaze:781452",
        "title": "Tuesday, July 5",
        "season": 2016,
        "episode": 133,
        "released": "2016-07-05",
        "overview": ""
      },
      {
        "id": "tvmaze:781453",
        "title": "Wednesday, July 6",
        "season": 2016,
        "episode": 134,
        "released": "2016-07-06",
        "overview": ""
      },
      {
        "id": "tvmaze:781454",
        "title": "Thursday, July 7",
        "season": 2016,
        "episode": 135,
        "released": "2016-07-07",
        "overview": ""
      },
      {
        "id": "tvmaze:781455",
        "title": "Friday, July 8",
        "season": 2016,
        "episode": 136,
        "released": "2016-07-08",
        "overview": ""
      },
      {
        "id": "tvmaze:781456",
        "title": "Monday, July 11",
        "season": 2016,
        "episode": 137,
        "released": "2016-07-11",
        "overview": ""
      },
      {
        "id": "tvmaze:781457",
        "title": "Tuesday, July 12",
        "season": 2016,
        "episode": 138,
        "released": "2016-07-12",
        "overview": ""
      },
      {
        "id": "tvmaze:781458",
        "title": "Wednesday, July 13",
        "season": 2016,
        "episode": 139,
        "released": "2016-07-13",
        "overview": ""
      },
      {
        "id": "tvmaze:781459",
        "title": "Thursday, July 14",
        "season": 2016,
        "episode": 140,
        "released": "2016-07-14",
        "overview": ""
      },
      {
        "id": "tvmaze:781460",
        "title": "Friday, July 15",
        "season": 2016,
        "episode": 141,
        "released": "2016-07-15",
        "overview": ""
      },
      {
        "id": "tvmaze:781461",
        "title": "Monday, July 18",
        "season": 2016,
        "episode": 142,
        "released": "2016-07-18",
        "overview": ""
      },
      {
        "id": "tvmaze:781462",
        "title": "Tuesday, July 19",
        "season": 2016,
        "episode": 143,
        "released": "2016-07-19",
        "overview": ""
      },
      {
        "id": "tvmaze:781463",
        "title": "Wednesday, July 20",
        "season": 2016,
        "episode": 144,
        "released": "2016-07-20",
        "overview": ""
      },
      {
        "id": "tvmaze:781464",
        "title": "Thursday, July 21",
        "season": 2016,
        "episode": 145,
        "released": "2016-07-21",
        "overview": ""
      },
      {
        "id": "tvmaze:781465",
        "title": "Friday, July 22",
        "season": 2016,
        "episode": 146,
        "released": "2016-07-22",
        "overview": ""
      },
      {
        "id": "tvmaze:781466",
        "title": "Monday, July 25",
        "season": 2016,
        "episode": 147,
        "released": "2016-07-25",
        "overview": ""
      },
      {
        "id": "tvmaze:781467",
        "title": "Tuesday, July 26",
        "season": 2016,
        "episode": 148,
        "released": "2016-07-26",
        "overview": ""
      },
      {
        "id": "tvmaze:781468",
        "title": "Wednesday, July 27",
        "season": 2016,
        "episode": 149,
        "released": "2016-07-27",
        "overview": ""
      },
      {
        "id": "tvmaze:781469",
        "title": "Thursday, July 28",
        "season": 2016,
        "episode": 150,
        "released": "2016-07-28",
        "overview": ""
      },
      {
        "id": "tvmaze:781470",
        "title": "Friday, July 29",
        "season": 2016,
        "episode": 151,
        "released": "2016-07-29",
        "overview": ""
      },
      {
        "id": "tvmaze:781471",
        "title": "Monday, August 1",
        "season": 2016,
        "episode": 152,
        "released": "2016-08-01",
        "overview": ""
      },
      {
        "id": "tvmaze:781472",
        "title": "Tuesday, August 2",
        "season": 2016,
        "episode": 153,
        "released": "2016-08-02",
        "overview": ""
      },
      {
        "id": "tvmaze:781473",
        "title": "Wednesday, August 3",
        "season": 2016,
        "episode": 154,
        "released": "2016-08-03",
        "overview": ""
      },
      {
        "id": "tvmaze:781474",
        "title": "Thursday, August 4",
        "season": 2016,
        "episode": 155,
        "released": "2016-08-04",
        "overview": ""
      },
      {
        "id": "tvmaze:781475",
        "title": "Friday, August 5",
        "season": 2016,
        "episode": 156,
        "released": "2016-08-05",
        "overview": ""
      },
      {
        "id": "tvmaze:781476",
        "title": "Monday, August 8",
        "season": 2016,
        "episode": 157,
        "released": "2016-08-08",
        "overview": ""
      },
      {
        "id": "tvmaze:781477",
        "title": "Tuesday, August 9",
        "season": 2016,
        "episode": 158,
        "released": "2016-08-09",
        "overview": ""
      },
      {
        "id": "tvmaze:781478",
        "title": "Wednesday, August 10",
        "season": 2016,
        "episode": 159,
        "released": "2016-08-10",
        "overview": ""
      },
      {
        "id": "tvmaze:781479",
        "title": "Thursday, August 11",
        "season": 2016,
        "episode": 160,
        "released": "2016-08-11",
        "overview": ""
      },
      {
        "id": "tvmaze:781480",
        "title": "Friday, August 12",
        "season": 2016,
        "episode": 161,
        "released": "2016-08-12",
        "overview": ""
      },
      {
        "id": "tvmaze:781481",
        "title": "Monday, August 15",
        "season": 2016,
        "episode": 162,
        "released": "2016-08-15",
        "overview": ""
      },
      {
        "id": "tvmaze:781482",
        "title": "Tuesday, August 16",
        "season": 2016,
        "episode": 163,
        "released": "2016-08-16",
        "overview": ""
      },
      {
        "id": "tvmaze:781483",
        "title": "Wednesday, August 17",
        "season": 2016,
        "episode": 164,
        "released": "2016-08-17",
        "overview": ""
      },
      {
        "id": "tvmaze:781484",
        "title": "Thursday, August 18",
        "season": 2016,
        "episode": 165,
        "released": "2016-08-18",
        "overview": ""
      },
      {
        "id": "tvmaze:781485",
        "title": "Friday, August 19",
        "season": 2016,
        "episode": 166,
        "released": "2016-08-19",
        "overview": ""
      },
      {
        "id": "tvmaze:781486",
        "title": "Monday, August 22",
        "season": 2016,
        "episode": 167,
        "released": "2016-08-22",
        "overview": ""
      },
      {
        "id": "tvmaze:781487",
        "title": "Tuesday, August 23",
        "season": 2016,
        "episode": 168,
        "released": "2016-08-23",
        "overview": ""
      },
      {
        "id": "tvmaze:781488",
        "title": "Wednesday, August 24",
        "season": 2016,
        "episode": 169,
        "released": "2016-08-24",
        "overview": ""
      },
      {
        "id": "tvmaze:781489",
        "title": "Thursday, August 25",
        "season": 2016,
        "episode": 170,
        "released": "2016-08-25",
        "overview": ""
      },
      {
        "id": "tvmaze:781490",
        "title": "Friday, August 26",
        "season": 2016,
        "episode": 171,
        "released": "2016-08-26",
        "overview": ""
      },
      {
        "id": "tvmaze:781491",
        "title": "Monday, August 29",
        "season": 2016,
        "episode": 172,
        "released": "2016-08-29",
        "overview": ""
      },
      {
        "id": "tvmaze:781492",
        "title": "Tuesday, August 30",
        "season": 2016,
        "episode": 173,
        "released": "2016-08-30",
        "overview": ""
      },
      {
        "id": "tvmaze:781493",
        "title": "Wednesday, August 31",
        "season": 2016,
        "episode": 174,
        "released": "2016-08-31",
        "overview": ""
      },
      {
        "id": "tvmaze:781494",
        "title": "Thursday, September 1",
        "season": 2016,
        "episode": 175,
        "released": "2016-09-01",
        "overview": ""
      },
      {
        "id": "tvmaze:781495",
        "title": "Friday, September 2",
        "season": 2016,
        "episode": 176,
        "released": "2016-09-02",
        "overview": ""
      },
      {
        "id": "tvmaze:949103",
        "title": "Episode 197",
        "season": 2016,
        "episode": 197,
        "released": "2016-10-03",
        "overview": ""
      },
      {
        "id": "tvmaze:949104",
        "title": "Episode 198",
        "season": 2016,
        "episode": 198,
        "released": "2016-10-04",
        "overview": ""
      },
      {
        "id": "tvmaze:949105",
        "title": "Episode 199",
        "season": 2016,
        "episode": 199,
        "released": "2016-10-05",
        "overview": ""
      },
      {
        "id": "tvmaze:949106",
        "title": "Episode 200",
        "season": 2016,
        "episode": 200,
        "released": "2016-10-06",
        "overview": ""
      },
      {
        "id": "tvmaze:949108",
        "title": "Episode 201",
        "season": 2016,
        "episode": 201,
        "released": "2016-10-07",
        "overview": ""
      },
      {
        "id": "tvmaze:949109",
        "title": "Episode 202",
        "season": 2016,
        "episode": 202,
        "released": "2016-10-10",
        "overview": ""
      },
      {
        "id": "tvmaze:949110",
        "title": "Episode 203",
        "season": 2016,
        "episode": 203,
        "released": "2016-10-11",
        "overview": ""
      },
      {
        "id": "tvmaze:949111",
        "title": "Episode 204",
        "season": 2016,
        "episode": 204,
        "released": "2016-10-12",
        "overview": ""
      },
      {
        "id": "tvmaze:949112",
        "title": "Episode 205",
        "season": 2016,
        "episode": 205,
        "released": "2016-10-13",
        "overview": ""
      },
      {
        "id": "tvmaze:949113",
        "title": "Episode 206",
        "season": 2016,
        "episode": 206,
        "released": "2016-10-14",
        "overview": ""
      },
      {
        "id": "tvmaze:949114",
        "title": "Episode 207",
        "season": 2016,
        "episode": 207,
        "released": "2016-10-17",
        "overview": ""
      },
      {
        "id": "tvmaze:949115",
        "title": "Episode 208",
        "season": 2016,
        "episode": 208,
        "released": "2016-10-18",
        "overview": ""
      },
      {
        "id": "tvmaze:949116",
        "title": "Episode 209",
        "season": 2016,
        "episode": 209,
        "released": "2016-10-19",
        "overview": ""
      },
      {
        "id": "tvmaze:949117",
        "title": "Episode 210",
        "season": 2016,
        "episode": 210,
        "released": "2016-10-20",
        "overview": ""
      },
      {
        "id": "tvmaze:949118",
        "title": "Episode 211",
        "season": 2016,
        "episode": 211,
        "released": "2016-10-21",
        "overview": ""
      },
      {
        "id": "tvmaze:949119",
        "title": "Episode 212",
        "season": 2016,
        "episode": 212,
        "released": "2016-10-24",
        "overview": ""
      },
      {
        "id": "tvmaze:949120",
        "title": "Episode 213",
        "season": 2016,
        "episode": 213,
        "released": "2016-10-25",
        "overview": ""
      },
      {
        "id": "tvmaze:949121",
        "title": "Episode 214",
        "season": 2016,
        "episode": 214,
        "released": "2016-10-26",
        "overview": ""
      },
      {
        "id": "tvmaze:949122",
        "title": "Episode 215",
        "season": 2016,
        "episode": 215,
        "released": "2016-10-27",
        "overview": ""
      },
      {
        "id": "tvmaze:949123",
        "title": "Episode 216",
        "season": 2016,
        "episode": 216,
        "released": "2016-10-28",
        "overview": ""
      },
      {
        "id": "tvmaze:949124",
        "title": "Episode 217",
        "season": 2016,
        "episode": 217,
        "released": "2016-10-31",
        "overview": ""
      },
      {
        "id": "tvmaze:949125",
        "title": "Episode 218",
        "season": 2016,
        "episode": 218,
        "released": "2016-11-01",
        "overview": ""
      },
      {
        "id": "tvmaze:949126",
        "title": "Episode 219",
        "season": 2016,
        "episode": 219,
        "released": "2016-11-02",
        "overview": ""
      },
      {
        "id": "tvmaze:949127",
        "title": "Episode 220",
        "season": 2016,
        "episode": 220,
        "released": "2016-11-03",
        "overview": ""
      },
      {
        "id": "tvmaze:949128",
        "title": "Episode 221",
        "season": 2016,
        "episode": 221,
        "released": "2016-11-04",
        "overview": ""
      },
      {
        "id": "tvmaze:1006085",
        "title": "11/07/16: FBI Director Confirms Original Decision on Clinton Email Investigation",
        "season": 2016,
        "episode": 222,
        "released": "2016-11-07",
        "overview": "Nate Silver Looks at the 2016 Election by the Numbers; Missing California Mother's Cellphone Found"
      },
      {
        "id": "tvmaze:1006140",
        "title": "11/08/16: Hillary Clinton, Donald Trump Leave Election to Voters",
        "season": 2016,
        "episode": 223,
        "released": "2016-11-08",
        "overview": "Impact of Presidential Candidates' Families on Election; Kids Write Letters to Future President of the United States"
      },
      {
        "id": "tvmaze:1006142",
        "title": "11/09/16: Donald Trump Becomes President-Elect of the US",
        "season": 2016,
        "episode": 224,
        "released": "2016-11-09",
        "overview": "Hillary Clinton Loses Presidential Race Despite Leading in Polls; How to Talk to Your Kids About the Election"
      },
      {
        "id": "tvmaze:1006144",
        "title": "11/10/16: Thousands Across US Protest President-Elect Trump",
        "season": 2016,
        "episode": 225,
        "released": "2016-11-10",
        "overview": "Obamas, Trumps to Meet at White House; Lawsuits Dog Trump, Even After Election Victory."
      },
      {
        "id": "tvmaze:1006146",
        "title": "11/11/16: Donald Trump Receives Presidential Security Protection",
        "season": 2016,
        "episode": 226,
        "released": "2016-11-11",
        "overview": "RNC Chairman Reince Priebus on Trump Administration; Inspirational Marine Turns Adversity Into Triumph."
      },
      {
        "id": "tvmaze:1006148",
        "title": "11/14/16: Reince Priebus Talks About Joining the Donald Trump Administration",
        "season": 2016,
        "episode": 227,
        "released": "2016-11-14",
        "overview": "Kate McKinnon Performs 'Hallelujah' as Hillary Clinton in SNL Opening Sketch; America's First All-Female Quintuplets Visit on 'GMA'"
      },
      {
        "id": "tvmaze:1006151",
        "title": "11/15/16: Megyn Kelly on the 2016 Presidential Election, Donald Trump",
        "season": 2016,
        "episode": 228,
        "released": "2016-11-15",
        "overview": "President Obama Weighs In on Donald Trump's Presidency; People Magazine's 'Sexiest Man Alive' Revealed."
      },
      {
        "id": "tvmaze:1006153",
        "title": "11/16/16: Utah HS Student Accused of Slashing Classmates in Locker Room",
        "season": 2016,
        "episode": 229,
        "released": "2016-11-16",
        "overview": "Can Virtual Reality Headsets Affect Your Child's Heath?; Mary J. Blige Performs 'Thick of It'"
      },
      {
        "id": "tvmaze:1006156",
        "title": "11/17/16: Hillary Clinton Speaks Out as Trump Builds His Team",
        "season": 2016,
        "episode": 230,
        "released": "2016-11-17",
        "overview": "Officer in Deadly Live-Streamed Shooting Charged With Manslaughter; Jon Bon Jovi Donates $5,000 to Repair Ben Franklin's Grave Site"
      },
      {
        "id": "tvmaze:1006158",
        "title": "11/18/16: Trump Picks Lt. Gen. Michael Flynn as National Security Advisor",
        "season": 2016,
        "episode": 231,
        "released": "2016-11-18",
        "overview": "Mumps Outbreak Expands Across US College Campuses; 1st Blizzard of the Season Makes Way Across the Mountain West"
      },
      {
        "id": "tvmaze:1006160",
        "title": "11/21/16: Powerful Winter Storm Slams the Northeast",
        "season": 2016,
        "episode": 232,
        "released": "2016-11-21",
        "overview": "Best Moments From the 2016 American Music Awards; Dwayne 'The Rock' Johnson Shed 'Manly Tears' During 'Moana'"
      },
      {
        "id": "tvmaze:1006161",
        "title": "11/22/16: At Least 5 Killed in Chattanooga School Bus Crash",
        "season": 2016,
        "episode": 233,
        "released": "2016-11-22",
        "overview": "Donald Trump Plans First 100 Days in Office; \"GMA\" Pawdoption: The Final Tally and Top Doggie Moments."
      },
      {
        "id": "tvmaze:1006162",
        "title": "11/23/16: Winter Storm to Impact Millions Over Holiday Weekend",
        "season": 2016,
        "episode": 234,
        "released": "2016-11-23",
        "overview": "Trump Picks SC Gov. Nikki Haley for UN Post, Changes Course on Campaign Issues; \"DWTS\" Finalists Join Us Live on \"GMA.\""
      },
      {
        "id": "tvmaze:1006163",
        "title": "11/24/16: Thanksgiving 911: All-Star Chefs Cook Live",
        "season": 2016,
        "episode": 235,
        "released": "2016-11-24",
        "overview": "Politics at the Thanksgiving Table Can Be a Recipe for Disaster Post-Election; Garth Brooks and Trisha Yearwood Perform 'Whiskey to Wine'"
      },
      {
        "id": "tvmaze:1006164",
        "title": "11/25/16: 'The Brady Bunch' Mom Florence Henderson Dies at 82",
        "season": 2016,
        "episode": 236,
        "released": "2016-11-25",
        "overview": "Black Friday Sales Draw in Millions Across the Country; Chef Dan Churchill Shares Thanksgiving Leftover Recipes"
      },
      {
        "id": "tvmaze:1006165",
        "title": "11/28/16: Trump Calls Vote Recount a 'Green Party Scam'",
        "season": 2016,
        "episode": 237,
        "released": "2016-11-28",
        "overview": "Cuba to Observe 9 Days of Mourning After Fidel Castro's Death; Felicity Jones Talks \"Rogue One: A Star Wars Story.\""
      },
      {
        "id": "tvmaze:1006166",
        "title": "11/29/16: Charter Aircraft Crashes in Columbia, Leaving 75 Dead",
        "season": 2016,
        "episode": 238,
        "released": "2016-11-29",
        "overview": "Authorities Search Home of Suspected Ohio State Attacker; Suspected South Carolina Shooter to Represent Himself in Mass Murder Trial"
      },
      {
        "id": "tvmaze:1006167",
        "title": "11/30/16: Tennessee Forest Fire Forces Mass Evacuation",
        "season": 2016,
        "episode": 239,
        "released": "2016-11-30",
        "overview": "Diego Luna Talks New 'Star Wars' Movie; Kacey Musgraves Performs 'Rudolph the Red Nosed Reindeer'"
      },
      {
        "id": "tvmaze:1006168",
        "title": "12/01/16: Protests Erupt After Officer Not Charged in Fatal Shooting",
        "season": 2016,
        "episode": 240,
        "released": "2016-12-01",
        "overview": "Husband of 'Super Mom' Describes Her Release; The Adorable 3-Year-Old McClure Twins Appear Live on 'GMA'"
      },
      {
        "id": "tvmaze:1006169",
        "title": "12/02/16: Parents Disarm Son Who Brought Guns to School",
        "season": 2016,
        "episode": 241,
        "released": "2016-12-02",
        "overview": "Buzz Aldrin Medically Evacuated From the South Pole; Billie Jean King, Marc Benioff Talk Workplace Equality"
      },
      {
        "id": "tvmaze:1006172",
        "title": "12/05/16",
        "season": 2016,
        "episode": 242,
        "released": "2016-12-05",
        "overview": "Actor Jason Bateman (\"Office Christmas Party\"); actress Helen Mirren (\"Collateral Beauty\"); television host STEVE HARVEY (\"Jump\"); celebrity chef Brian Malarkey with holiday recipes."
      },
      {
        "id": "tvmaze:1006185",
        "title": "12/06/16",
        "season": 2016,
        "episode": 243,
        "released": "2016-12-06",
        "overview": "Actresses Olivia Munn and Kate McKinnon (\"Office Christmas Party\"); actress Katie Holmes (\"All We Had\"); country music star Naomi Judd"
      },
      {
        "id": "tvmaze:1006198",
        "title": "12/07/16",
        "season": 2016,
        "episode": 244,
        "released": "2016-12-07",
        "overview": "Actor Chris Pratt (\"Passengers\"); actor Ben Mendelsohn (\"Rogue One: A Star Wars Story\")"
      },
      {
        "id": "tvmaze:1006230",
        "title": "12/08/16",
        "season": 2016,
        "episode": 245,
        "released": "2016-12-08",
        "overview": "Actor Edward Norton (\"Collateral Beauty\"); actor Riz Ahmed (\"Rogue One: A Star Wars Story\"); \"Deals and Steals\" with contributor Tory Johnson; DIY expert Nicole Farb with holiday gift wrapping tips"
      },
      {
        "id": "tvmaze:1006253",
        "title": "12/09/16",
        "season": 2016,
        "episode": 246,
        "released": "2016-12-09",
        "overview": "Actor Jake Gyllenhaal (\"Nocturnal Animals\"); actress Jennifer Aniston and the cast of \"Office Christmas Party\"; a performance by country music singer Brett Eldredge"
      },
      {
        "id": "tvmaze:1217588",
        "title": "12/10/16",
        "season": 2016,
        "episode": 247,
        "released": "2016-12-10",
        "overview": ""
      },
      {
        "id": "tvmaze:1217589",
        "title": "12/11/16",
        "season": 2016,
        "episode": 248,
        "released": "2016-12-11",
        "overview": ""
      },
      {
        "id": "tvmaze:1217590",
        "title": "12/12/16",
        "season": 2016,
        "episode": 249,
        "released": "2016-12-12",
        "overview": ""
      },
      {
        "id": "tvmaze:1217591",
        "title": "12/13/16",
        "season": 2016,
        "episode": 250,
        "released": "2016-12-13",
        "overview": ""
      },
      {
        "id": "tvmaze:1217592",
        "title": "12/14/16",
        "season": 2016,
        "episode": 251,
        "released": "2016-12-14",
        "overview": ""
      },
      {
        "id": "tvmaze:1217593",
        "title": "12/15/16",
        "season": 2016,
        "episode": 252,
        "released": "2016-12-15",
        "overview": ""
      },
      {
        "id": "tvmaze:1217594",
        "title": "12/16/16",
        "season": 2016,
        "episode": 253,
        "released": "2016-12-16",
        "overview": ""
      },
      {
        "id": "tvmaze:1217595",
        "title": "12/17/16",
        "season": 2016,
        "episode": 254,
        "released": "2016-12-17",
        "overview": ""
      },
      {
        "id": "tvmaze:1217596",
        "title": "12/18/16",
        "season": 2016,
        "episode": 255,
        "released": "2016-12-18",
        "overview": ""
      },
      {
        "id": "tvmaze:1217597",
        "title": "12/19/16",
        "season": 2016,
        "episode": 256,
        "released": "2016-12-19",
        "overview": ""
      },
      {
        "id": "tvmaze:1217598",
        "title": "12/20/16",
        "season": 2016,
        "episode": 257,
        "released": "2016-12-20",
        "overview": ""
      },
      {
        "id": "tvmaze:1217599",
        "title": "12/21/16",
        "season": 2016,
        "episode": 258,
        "released": "2016-12-21",
        "overview": ""
      },
      {
        "id": "tvmaze:1217600",
        "title": "12/22/16",
        "season": 2016,
        "episode": 259,
        "released": "2016-12-22",
        "overview": ""
      },
      {
        "id": "tvmaze:1217601",
        "title": "12/23/16",
        "season": 2016,
        "episode": 260,
        "released": "2016-12-23",
        "overview": ""
      },
      {
        "id": "tvmaze:1217602",
        "title": "12/24/16",
        "season": 2016,
        "episode": 261,
        "released": "2016-12-24",
        "overview": ""
      },
      {
        "id": "tvmaze:1217603",
        "title": "12/25/16",
        "season": 2016,
        "episode": 262,
        "released": "2016-12-25",
        "overview": ""
      },
      {
        "id": "tvmaze:1217604",
        "title": "12/26/16",
        "season": 2016,
        "episode": 263,
        "released": "2016-12-26",
        "overview": ""
      },
      {
        "id": "tvmaze:1217605",
        "title": "12/27/16",
        "season": 2016,
        "episode": 264,
        "released": "2016-12-27",
        "overview": ""
      },
      {
        "id": "tvmaze:1217606",
        "title": "12/28/16",
        "season": 2016,
        "episode": 265,
        "released": "2016-12-28",
        "overview": ""
      },
      {
        "id": "tvmaze:1217607",
        "title": "12/29/16",
        "season": 2016,
        "episode": 266,
        "released": "2016-12-29",
        "overview": ""
      },
      {
        "id": "tvmaze:1217608",
        "title": "12/30/16",
        "season": 2016,
        "episode": 267,
        "released": "2016-12-30",
        "overview": ""
      },
      {
        "id": "tvmaze:1217609",
        "title": "12/31/16",
        "season": 2016,
        "episode": 268,
        "released": "2016-12-31",
        "overview": ""
      },
      {
        "id": "tvmaze:1217610",
        "title": "Episode 1",
        "season": 2017,
        "episode": 1,
        "released": "2017-01-02",
        "overview": ""
      },
      {
        "id": "tvmaze:1217611",
        "title": "Episode 2",
        "season": 2017,
        "episode": 2,
        "released": "2017-01-03",
        "overview": ""
      },
      {
        "id": "tvmaze:1217612",
        "title": "Episode 3",
        "season": 2017,
        "episode": 3,
        "released": "2017-01-04",
        "overview": ""
      },
      {
        "id": "tvmaze:1217613",
        "title": "Episode 4",
        "season": 2017,
        "episode": 4,
        "released": "2017-01-05",
        "overview": ""
      },
      {
        "id": "tvmaze:1217614",
        "title": "Episode 5",
        "season": 2017,
        "episode": 5,
        "released": "2017-01-06",
        "overview": ""
      },
      {
        "id": "tvmaze:1217616",
        "title": "Episode 6",
        "season": 2017,
        "episode": 6,
        "released": "2017-01-09",
        "overview": ""
      },
      {
        "id": "tvmaze:1217617",
        "title": "Episode 7",
        "season": 2017,
        "episode": 7,
        "released": "2017-01-10",
        "overview": ""
      },
      {
        "id": "tvmaze:1217619",
        "title": "Episode 8",
        "season": 2017,
        "episode": 8,
        "released": "2017-01-11",
        "overview": ""
      },
      {
        "id": "tvmaze:1217620",
        "title": "Episode 9",
        "season": 2017,
        "episode": 9,
        "released": "2017-01-12",
        "overview": ""
      },
      {
        "id": "tvmaze:1217622",
        "title": "Episode 10",
        "season": 2017,
        "episode": 10,
        "released": "2017-01-13",
        "overview": ""
      },
      {
        "id": "tvmaze:1217623",
        "title": "Episode 11",
        "season": 2017,
        "episode": 11,
        "released": "2017-01-16",
        "overview": ""
      },
      {
        "id": "tvmaze:1217624",
        "title": "Episode 12",
        "season": 2017,
        "episode": 12,
        "released": "2017-01-17",
        "overview": ""
      },
      {
        "id": "tvmaze:1217625",
        "title": "Episode 13",
        "season": 2017,
        "episode": 13,
        "released": "2017-01-18",
        "overview": ""
      },
      {
        "id": "tvmaze:1217627",
        "title": "Episode 14",
        "season": 2017,
        "episode": 14,
        "released": "2017-01-19",
        "overview": ""
      },
      {
        "id": "tvmaze:1217628",
        "title": "Episode 15",
        "season": 2017,
        "episode": 15,
        "released": "2017-01-20",
        "overview": ""
      },
      {
        "id": "tvmaze:1217629",
        "title": "Episode 16",
        "season": 2017,
        "episode": 16,
        "released": "2017-01-23",
        "overview": ""
      },
      {
        "id": "tvmaze:1217631",
        "title": "Episode 17",
        "season": 2017,
        "episode": 17,
        "released": "2017-01-24",
        "overview": ""
      },
      {
        "id": "tvmaze:1217632",
        "title": "Episode 18",
        "season": 2017,
        "episode": 18,
        "released": "2017-01-25",
        "overview": ""
      },
      {
        "id": "tvmaze:1217634",
        "title": "Episode 19",
        "season": 2017,
        "episode": 19,
        "released": "2017-01-26",
        "overview": ""
      },
      {
        "id": "tvmaze:1217636",
        "title": "Episode 20",
        "season": 2017,
        "episode": 20,
        "released": "2017-01-27",
        "overview": ""
      },
      {
        "id": "tvmaze:1217638",
        "title": "Episode 21",
        "season": 2017,
        "episode": 21,
        "released": "2017-01-30",
        "overview": ""
      },
      {
        "id": "tvmaze:1217640",
        "title": "Episode 22",
        "season": 2017,
        "episode": 22,
        "released": "2017-01-31",
        "overview": ""
      },
      {
        "id": "tvmaze:1217642",
        "title": "Episode 23",
        "season": 2017,
        "episode": 23,
        "released": "2017-02-01",
        "overview": ""
      },
      {
        "id": "tvmaze:1217643",
        "title": "Episode 24",
        "season": 2017,
        "episode": 24,
        "released": "2017-02-02",
        "overview": ""
      },
      {
        "id": "tvmaze:1217644",
        "title": "Episode 25",
        "season": 2017,
        "episode": 25,
        "released": "2017-02-03",
        "overview": ""
      },
      {
        "id": "tvmaze:1217645",
        "title": "Episode 26",
        "season": 2017,
        "episode": 26,
        "released": "2017-02-06",
        "overview": ""
      },
      {
        "id": "tvmaze:1217647",
        "title": "Episode 27",
        "season": 2017,
        "episode": 27,
        "released": "2017-02-07",
        "overview": ""
      },
      {
        "id": "tvmaze:1217648",
        "title": "Episode 28",
        "season": 2017,
        "episode": 28,
        "released": "2017-02-08",
        "overview": ""
      },
      {
        "id": "tvmaze:1217649",
        "title": "Episode 29",
        "season": 2017,
        "episode": 29,
        "released": "2017-02-09",
        "overview": ""
      },
      {
        "id": "tvmaze:1217650",
        "title": "Episode 30",
        "season": 2017,
        "episode": 30,
        "released": "2017-02-10",
        "overview": ""
      },
      {
        "id": "tvmaze:1217664",
        "title": "Episode 31",
        "season": 2017,
        "episode": 31,
        "released": "2017-02-13",
        "overview": ""
      },
      {
        "id": "tvmaze:1217665",
        "title": "Episode 32",
        "season": 2017,
        "episode": 32,
        "released": "2017-02-14",
        "overview": ""
      },
      {
        "id": "tvmaze:1217666",
        "title": "Episode 33",
        "season": 2017,
        "episode": 33,
        "released": "2017-02-15",
        "overview": ""
      },
      {
        "id": "tvmaze:1217667",
        "title": "Episode 34",
        "season": 2017,
        "episode": 34,
        "released": "2017-02-16",
        "overview": ""
      },
      {
        "id": "tvmaze:1217668",
        "title": "Episode 35",
        "season": 2017,
        "episode": 35,
        "released": "2017-02-17",
        "overview": ""
      },
      {
        "id": "tvmaze:1217669",
        "title": "Episode 36",
        "season": 2017,
        "episode": 36,
        "released": "2017-02-20",
        "overview": ""
      },
      {
        "id": "tvmaze:1217670",
        "title": "Episode 37",
        "season": 2017,
        "episode": 37,
        "released": "2017-02-21",
        "overview": ""
      },
      {
        "id": "tvmaze:1217671",
        "title": "Episode 38",
        "season": 2017,
        "episode": 38,
        "released": "2017-02-22",
        "overview": ""
      },
      {
        "id": "tvmaze:1217672",
        "title": "Episode 39",
        "season": 2017,
        "episode": 39,
        "released": "2017-02-23",
        "overview": ""
      },
      {
        "id": "tvmaze:1217673",
        "title": "Episode 40",
        "season": 2017,
        "episode": 40,
        "released": "2017-02-24",
        "overview": ""
      },
      {
        "id": "tvmaze:1217674",
        "title": "Episode 41",
        "season": 2017,
        "episode": 41,
        "released": "2017-02-27",
        "overview": ""
      },
      {
        "id": "tvmaze:1217676",
        "title": "Episode 42",
        "season": 2017,
        "episode": 42,
        "released": "2017-02-28",
        "overview": ""
      },
      {
        "id": "tvmaze:1217677",
        "title": "Episode 43",
        "season": 2017,
        "episode": 43,
        "released": "2017-03-01",
        "overview": ""
      },
      {
        "id": "tvmaze:1073146",
        "title": "Episode 44",
        "season": 2017,
        "episode": 44,
        "released": "2017-03-02",
        "overview": ""
      },
      {
        "id": "tvmaze:1073147",
        "title": "Episode 45",
        "season": 2017,
        "episode": 45,
        "released": "2017-03-03",
        "overview": ""
      },
      {
        "id": "tvmaze:1073148",
        "title": "Episode 46",
        "season": 2017,
        "episode": 46,
        "released": "2017-03-06",
        "overview": ""
      },
      {
        "id": "tvmaze:1073149",
        "title": "Episode 47",
        "season": 2017,
        "episode": 47,
        "released": "2017-03-07",
        "overview": ""
      },
      {
        "id": "tvmaze:1073150",
        "title": "Episode 48",
        "season": 2017,
        "episode": 48,
        "released": "2017-03-08",
        "overview": ""
      },
      {
        "id": "tvmaze:1217678",
        "title": "Episode 49",
        "season": 2017,
        "episode": 49,
        "released": "2017-03-09",
        "overview": ""
      },
      {
        "id": "tvmaze:1217679",
        "title": "Episode 50",
        "season": 2017,
        "episode": 50,
        "released": "2017-03-10",
        "overview": ""
      },
      {
        "id": "tvmaze:1076060",
        "title": "Episode 51",
        "season": 2017,
        "episode": 51,
        "released": "2017-03-13",
        "overview": ""
      },
      {
        "id": "tvmaze:1076061",
        "title": "Episode 52",
        "season": 2017,
        "episode": 52,
        "released": "2017-03-14",
        "overview": ""
      },
      {
        "id": "tvmaze:1076063",
        "title": "Episode 53",
        "season": 2017,
        "episode": 53,
        "released": "2017-03-15",
        "overview": ""
      },
      {
        "id": "tvmaze:1076064",
        "title": "Episode 54",
        "season": 2017,
        "episode": 54,
        "released": "2017-03-16",
        "overview": ""
      },
      {
        "id": "tvmaze:1076066",
        "title": "Episode 55",
        "season": 2017,
        "episode": 55,
        "released": "2017-03-17",
        "overview": ""
      },
      {
        "id": "tvmaze:1217680",
        "title": "Episode 56",
        "season": 2017,
        "episode": 56,
        "released": "2017-03-20",
        "overview": ""
      },
      {
        "id": "tvmaze:1217681",
        "title": "Episode 57",
        "season": 2017,
        "episode": 57,
        "released": "2017-03-21",
        "overview": ""
      },
      {
        "id": "tvmaze:1094875",
        "title": "Episode 58",
        "season": 2017,
        "episode": 58,
        "released": "2017-03-22",
        "overview": ""
      },
      {
        "id": "tvmaze:1094877",
        "title": "Episode 59",
        "season": 2017,
        "episode": 59,
        "released": "2017-03-23",
        "overview": ""
      },
      {
        "id": "tvmaze:1094878",
        "title": "Episode 60",
        "season": 2017,
        "episode": 60,
        "released": "2017-03-24",
        "overview": ""
      },
      {
        "id": "tvmaze:1094879",
        "title": "Episode 61",
        "season": 2017,
        "episode": 61,
        "released": "2017-03-27",
        "overview": ""
      },
      {
        "id": "tvmaze:1094880",
        "title": "Episode 62",
        "season": 2017,
        "episode": 62,
        "released": "2017-03-28",
        "overview": ""
      },
      {
        "id": "tvmaze:1217708",
        "title": "Episode 63",
        "season": 2017,
        "episode": 63,
        "released": "2017-03-29",
        "overview": ""
      },
      {
        "id": "tvmaze:1217709",
        "title": "Episode 64",
        "season": 2017,
        "episode": 64,
        "released": "2017-03-30",
        "overview": ""
      },
      {
        "id": "tvmaze:1217710",
        "title": "Episode 65",
        "season": 2017,
        "episode": 65,
        "released": "2017-03-31",
        "overview": ""
      },
      {
        "id": "tvmaze:1217711",
        "title": "Episode 66",
        "season": 2017,
        "episode": 66,
        "released": "2017-04-03",
        "overview": ""
      },
      {
        "id": "tvmaze:1217712",
        "title": "Episode 67",
        "season": 2017,
        "episode": 67,
        "released": "2017-04-04",
        "overview": ""
      },
      {
        "id": "tvmaze:1217713",
        "title": "Episode 68",
        "season": 2017,
        "episode": 68,
        "released": "2017-04-05",
        "overview": ""
      },
      {
        "id": "tvmaze:1217714",
        "title": "Episode 69",
        "season": 2017,
        "episode": 69,
        "released": "2017-04-06",
        "overview": ""
      },
      {
        "id": "tvmaze:1217715",
        "title": "Episode 70",
        "season": 2017,
        "episode": 70,
        "released": "2017-04-07",
        "overview": ""
      },
      {
        "id": "tvmaze:1217716",
        "title": "Episode 71",
        "season": 2017,
        "episode": 71,
        "released": "2017-04-10",
        "overview": ""
      },
      {
        "id": "tvmaze:1217717",
        "title": "Episode 72",
        "season": 2017,
        "episode": 72,
        "released": "2017-04-11",
        "overview": ""
      },
      {
        "id": "tvmaze:1217718",
        "title": "Episode 73",
        "season": 2017,
        "episode": 73,
        "released": "2017-04-12",
        "overview": ""
      },
      {
        "id": "tvmaze:1217719",
        "title": "Episode 74",
        "season": 2017,
        "episode": 74,
        "released": "2017-04-13",
        "overview": ""
      },
      {
        "id": "tvmaze:1217720",
        "title": "Episode 75",
        "season": 2017,
        "episode": 75,
        "released": "2017-04-14",
        "overview": ""
      },
      {
        "id": "tvmaze:1217721",
        "title": "Episode 76",
        "season": 2017,
        "episode": 76,
        "released": "2017-04-17",
        "overview": ""
      },
      {
        "id": "tvmaze:1217722",
        "title": "Episode 77",
        "season": 2017,
        "episode": 77,
        "released": "2017-04-18",
        "overview": ""
      },
      {
        "id": "tvmaze:1217723",
        "title": "Episode 78",
        "season": 2017,
        "episode": 78,
        "released": "2017-04-19",
        "overview": ""
      },
      {
        "id": "tvmaze:1217724",
        "title": "Episode 79",
        "season": 2017,
        "episode": 79,
        "released": "2017-04-20",
        "overview": ""
      },
      {
        "id": "tvmaze:1217725",
        "title": "Episode 80",
        "season": 2017,
        "episode": 80,
        "released": "2017-04-21",
        "overview": ""
      },
      {
        "id": "tvmaze:1217726",
        "title": "Episode 81",
        "season": 2017,
        "episode": 81,
        "released": "2017-04-24",
        "overview": ""
      },
      {
        "id": "tvmaze:1217727",
        "title": "Episode 82",
        "season": 2017,
        "episode": 82,
        "released": "2017-04-25",
        "overview": ""
      },
      {
        "id": "tvmaze:1217728",
        "title": "Episode 83",
        "season": 2017,
        "episode": 83,
        "released": "2017-04-26",
        "overview": ""
      },
      {
        "id": "tvmaze:1217729",
        "title": "Episode 84",
        "season": 2017,
        "episode": 84,
        "released": "2017-04-27",
        "overview": ""
      },
      {
        "id": "tvmaze:1217730",
        "title": "Episode 85",
        "season": 2017,
        "episode": 85,
        "released": "2017-04-28",
        "overview": ""
      },
      {
        "id": "tvmaze:1217731",
        "title": "Episode 86",
        "season": 2017,
        "episode": 86,
        "released": "2017-05-01",
        "overview": ""
      },
      {
        "id": "tvmaze:1217732",
        "title": "Episode 87",
        "season": 2017,
        "episode": 87,
        "released": "2017-05-02",
        "overview": ""
      },
      {
        "id": "tvmaze:1217733",
        "title": "Episode 88",
        "season": 2017,
        "episode": 88,
        "released": "2017-05-03",
        "overview": ""
      },
      {
        "id": "tvmaze:1217734",
        "title": "Episode 89",
        "season": 2017,
        "episode": 89,
        "released": "2017-05-04",
        "overview": ""
      },
      {
        "id": "tvmaze:1217736",
        "title": "Episode 90",
        "season": 2017,
        "episode": 90,
        "released": "2017-05-05",
        "overview": ""
      },
      {
        "id": "tvmaze:1217737",
        "title": "Episode 91",
        "season": 2017,
        "episode": 91,
        "released": "2017-05-08",
        "overview": ""
      },
      {
        "id": "tvmaze:1217739",
        "title": "Episode 92",
        "season": 2017,
        "episode": 92,
        "released": "2017-05-09",
        "overview": ""
      },
      {
        "id": "tvmaze:1217741",
        "title": "Episode 93",
        "season": 2017,
        "episode": 93,
        "released": "2017-05-10",
        "overview": ""
      },
      {
        "id": "tvmaze:1217742",
        "title": "Episode 94",
        "season": 2017,
        "episode": 94,
        "released": "2017-05-11",
        "overview": ""
      },
      {
        "id": "tvmaze:1217744",
        "title": "Episode 95",
        "season": 2017,
        "episode": 95,
        "released": "2017-05-12",
        "overview": ""
      },
      {
        "id": "tvmaze:1217746",
        "title": "Episode 96",
        "season": 2017,
        "episode": 96,
        "released": "2017-05-15",
        "overview": ""
      },
      {
        "id": "tvmaze:1217748",
        "title": "Episode 97",
        "season": 2017,
        "episode": 97,
        "released": "2017-05-16",
        "overview": ""
      },
      {
        "id": "tvmaze:1217749",
        "title": "Episode 98",
        "season": 2017,
        "episode": 98,
        "released": "2017-05-17",
        "overview": ""
      },
      {
        "id": "tvmaze:1217751",
        "title": "Episode 99",
        "season": 2017,
        "episode": 99,
        "released": "2017-05-18",
        "overview": ""
      },
      {
        "id": "tvmaze:1217753",
        "title": "Episode 100",
        "season": 2017,
        "episode": 100,
        "released": "2017-05-19",
        "overview": ""
      },
      {
        "id": "tvmaze:1217754",
        "title": "Episode 101",
        "season": 2017,
        "episode": 101,
        "released": "2017-05-22",
        "overview": ""
      },
      {
        "id": "tvmaze:1217756",
        "title": "Episode 102",
        "season": 2017,
        "episode": 102,
        "released": "2017-05-23",
        "overview": ""
      },
      {
        "id": "tvmaze:1217757",
        "title": "Episode 103",
        "season": 2017,
        "episode": 103,
        "released": "2017-05-24",
        "overview": ""
      },
      {
        "id": "tvmaze:1217758",
        "title": "Episode 104",
        "season": 2017,
        "episode": 104,
        "released": "2017-05-25",
        "overview": ""
      },
      {
        "id": "tvmaze:1217760",
        "title": "Episode 105",
        "season": 2017,
        "episode": 105,
        "released": "2017-05-26",
        "overview": ""
      },
      {
        "id": "tvmaze:1217761",
        "title": "Episode 106",
        "season": 2017,
        "episode": 106,
        "released": "2017-05-29",
        "overview": ""
      },
      {
        "id": "tvmaze:1217762",
        "title": "Episode 107",
        "season": 2017,
        "episode": 107,
        "released": "2017-05-30",
        "overview": ""
      },
      {
        "id": "tvmaze:1217763",
        "title": "Episode 108",
        "season": 2017,
        "episode": 108,
        "released": "2017-05-31",
        "overview": ""
      },
      {
        "id": "tvmaze:1217764",
        "title": "Episode 109",
        "season": 2017,
        "episode": 109,
        "released": "2017-06-01",
        "overview": ""
      },
      {
        "id": "tvmaze:1217765",
        "title": "Episode 110",
        "season": 2017,
        "episode": 110,
        "released": "2017-06-02",
        "overview": ""
      },
      {
        "id": "tvmaze:1217766",
        "title": "Episode 111",
        "season": 2017,
        "episode": 111,
        "released": "2017-06-05",
        "overview": ""
      },
      {
        "id": "tvmaze:1217767",
        "title": "Episode 112",
        "season": 2017,
        "episode": 112,
        "released": "2017-06-06",
        "overview": ""
      },
      {
        "id": "tvmaze:1217768",
        "title": "Episode 113",
        "season": 2017,
        "episode": 113,
        "released": "2017-06-07",
        "overview": ""
      },
      {
        "id": "tvmaze:1217769",
        "title": "Episode 114",
        "season": 2017,
        "episode": 114,
        "released": "2017-06-08",
        "overview": ""
      },
      {
        "id": "tvmaze:1217770",
        "title": "Episode 115",
        "season": 2017,
        "episode": 115,
        "released": "2017-06-09",
        "overview": ""
      },
      {
        "id": "tvmaze:1217771",
        "title": "Episode 116",
        "season": 2017,
        "episode": 116,
        "released": "2017-06-12",
        "overview": ""
      },
      {
        "id": "tvmaze:1217772",
        "title": "Episode 117",
        "season": 2017,
        "episode": 117,
        "released": "2017-06-13",
        "overview": ""
      },
      {
        "id": "tvmaze:1217773",
        "title": "Episode 118",
        "season": 2017,
        "episode": 118,
        "released": "2017-06-14",
        "overview": ""
      },
      {
        "id": "tvmaze:1217774",
        "title": "Episode 119",
        "season": 2017,
        "episode": 119,
        "released": "2017-06-15",
        "overview": ""
      },
      {
        "id": "tvmaze:1217775",
        "title": "Episode 120",
        "season": 2017,
        "episode": 120,
        "released": "2017-06-16",
        "overview": ""
      },
      {
        "id": "tvmaze:1217776",
        "title": "Episode 121",
        "season": 2017,
        "episode": 121,
        "released": "2017-06-19",
        "overview": ""
      },
      {
        "id": "tvmaze:1217777",
        "title": "Episode 122",
        "season": 2017,
        "episode": 122,
        "released": "2017-06-20",
        "overview": ""
      },
      {
        "id": "tvmaze:1217778",
        "title": "Episode 123",
        "season": 2017,
        "episode": 123,
        "released": "2017-06-21",
        "overview": ""
      },
      {
        "id": "tvmaze:1217779",
        "title": "Episode 124",
        "season": 2017,
        "episode": 124,
        "released": "2017-06-22",
        "overview": ""
      },
      {
        "id": "tvmaze:1217780",
        "title": "Episode 125",
        "season": 2017,
        "episode": 125,
        "released": "2017-06-23",
        "overview": ""
      },
      {
        "id": "tvmaze:1217781",
        "title": "Episode 126",
        "season": 2017,
        "episode": 126,
        "released": "2017-06-26",
        "overview": ""
      },
      {
        "id": "tvmaze:1217782",
        "title": "Episode 127",
        "season": 2017,
        "episode": 127,
        "released": "2017-06-27",
        "overview": ""
      },
      {
        "id": "tvmaze:1217783",
        "title": "Episode 128",
        "season": 2017,
        "episode": 128,
        "released": "2017-06-28",
        "overview": ""
      },
      {
        "id": "tvmaze:1217784",
        "title": "Episode 129",
        "season": 2017,
        "episode": 129,
        "released": "2017-06-29",
        "overview": ""
      },
      {
        "id": "tvmaze:1217785",
        "title": "Episode 130",
        "season": 2017,
        "episode": 130,
        "released": "2017-06-30",
        "overview": ""
      },
      {
        "id": "tvmaze:1217786",
        "title": "Episode 131",
        "season": 2017,
        "episode": 131,
        "released": "2017-07-03",
        "overview": ""
      },
      {
        "id": "tvmaze:1217787",
        "title": "Episode 132",
        "season": 2017,
        "episode": 132,
        "released": "2017-07-04",
        "overview": ""
      },
      {
        "id": "tvmaze:1217788",
        "title": "Episode 133",
        "season": 2017,
        "episode": 133,
        "released": "2017-07-05",
        "overview": ""
      },
      {
        "id": "tvmaze:1217789",
        "title": "Episode 134",
        "season": 2017,
        "episode": 134,
        "released": "2017-07-06",
        "overview": ""
      },
      {
        "id": "tvmaze:1217790",
        "title": "Episode 135",
        "season": 2017,
        "episode": 135,
        "released": "2017-07-07",
        "overview": ""
      },
      {
        "id": "tvmaze:1217791",
        "title": "Episode 136",
        "season": 2017,
        "episode": 136,
        "released": "2017-07-10",
        "overview": ""
      },
      {
        "id": "tvmaze:1217792",
        "title": "Episode 137",
        "season": 2017,
        "episode": 137,
        "released": "2017-07-11",
        "overview": ""
      },
      {
        "id": "tvmaze:1217793",
        "title": "Episode 138",
        "season": 2017,
        "episode": 138,
        "released": "2017-07-12",
        "overview": ""
      },
      {
        "id": "tvmaze:1217794",
        "title": "Episode 139",
        "season": 2017,
        "episode": 139,
        "released": "2017-07-13",
        "overview": ""
      },
      {
        "id": "tvmaze:1217795",
        "title": "Episode 140",
        "season": 2017,
        "episode": 140,
        "released": "2017-07-14",
        "overview": ""
      },
      {
        "id": "tvmaze:1217796",
        "title": "Episode 141",
        "season": 2017,
        "episode": 141,
        "released": "2017-07-17",
        "overview": ""
      },
      {
        "id": "tvmaze:1217797",
        "title": "Episode 142",
        "season": 2017,
        "episode": 142,
        "released": "2017-07-18",
        "overview": ""
      },
      {
        "id": "tvmaze:1217798",
        "title": "Episode 143",
        "season": 2017,
        "episode": 143,
        "released": "2017-07-19",
        "overview": ""
      },
      {
        "id": "tvmaze:1217799",
        "title": "Episode 144",
        "season": 2017,
        "episode": 144,
        "released": "2017-07-20",
        "overview": ""
      },
      {
        "id": "tvmaze:1217800",
        "title": "Episode 145",
        "season": 2017,
        "episode": 145,
        "released": "2017-07-21",
        "overview": ""
      },
      {
        "id": "tvmaze:1217801",
        "title": "Episode 146",
        "season": 2017,
        "episode": 146,
        "released": "2017-07-24",
        "overview": ""
      },
      {
        "id": "tvmaze:1217802",
        "title": "Episode 147",
        "season": 2017,
        "episode": 147,
        "released": "2017-07-25",
        "overview": ""
      },
      {
        "id": "tvmaze:1217805",
        "title": "Episode 148",
        "season": 2017,
        "episode": 148,
        "released": "2017-07-26",
        "overview": ""
      },
      {
        "id": "tvmaze:1217807",
        "title": "Episode 149",
        "season": 2017,
        "episode": 149,
        "released": "2017-07-27",
        "overview": ""
      },
      {
        "id": "tvmaze:1217809",
        "title": "Episode 150",
        "season": 2017,
        "episode": 150,
        "released": "2017-07-28",
        "overview": "GMA Summer Concert performance by Imagine Dragons; a workout in Central Park with actor and comedian Kevin Hart."
      },
      {
        "id": "tvmaze:1217812",
        "title": "Episode 151",
        "season": 2017,
        "episode": 151,
        "released": "2017-07-31",
        "overview": ""
      },
      {
        "id": "tvmaze:1217820",
        "title": "Episode 152",
        "season": 2017,
        "episode": 152,
        "released": "2017-08-01",
        "overview": "Co-anchors report the morning's top headlines from a set in Times Square. The show features a combination of breaking news, interviews, in-depth reporting and weather. The program covers important issues with key figures from around the world and a wide spectrum of topics, including medicine, finance, consumer issues, computer technology, education and gardening."
      },
      {
        "id": "tvmaze:1217821",
        "title": "Episode 153",
        "season": 2017,
        "episode": 153,
        "released": "2017-08-02",
        "overview": "Co-anchors report the morning's top headlines from a set in Times Square. The show features a combination of breaking news, interviews, in-depth reporting and weather. The program covers important issues with key figures from around the world and a wide spectrum of topics, including medicine, finance, consumer issues, computer technology, education and gardening."
      },
      {
        "id": "tvmaze:1217822",
        "title": "Episode 154",
        "season": 2017,
        "episode": 154,
        "released": "2017-08-03",
        "overview": ""
      },
      {
        "id": "tvmaze:1217823",
        "title": "Episode 155",
        "season": 2017,
        "episode": 155,
        "released": "2017-08-04",
        "overview": ""
      },
      {
        "id": "tvmaze:1217824",
        "title": "Episode 156",
        "season": 2017,
        "episode": 156,
        "released": "2017-08-07",
        "overview": "Actors Shia LaBeouf and Zack Gottsagen; author Marty Smith; deals and steals with Tory Johnson."
      },
      {
        "id": "tvmaze:1217825",
        "title": "Episode 157",
        "season": 2017,
        "episode": 157,
        "released": "2017-08-08",
        "overview": "Rachel Lindsay of \"The Bachelorette\" and her fiance; actor Jeff Bridges; actors David Tennant, Danny Pudi and Ben Schwartz."
      },
      {
        "id": "tvmaze:1217826",
        "title": "Episode 158",
        "season": 2017,
        "episode": 158,
        "released": "2017-08-09",
        "overview": "Kesha performs."
      },
      {
        "id": "tvmaze:1217827",
        "title": "Episode 159",
        "season": 2017,
        "episode": 159,
        "released": "2017-08-10",
        "overview": "Actor Christopher Meloni; Deals and Steals with Tory Johnson; Macklemore performs."
      },
      {
        "id": "tvmaze:1217828",
        "title": "Episode 160",
        "season": 2017,
        "episode": 160,
        "released": "2017-08-11",
        "overview": "Actor Anthony Anderson; Bleachers performs."
      },
      {
        "id": "tvmaze:1217829",
        "title": "Episode 161",
        "season": 2017,
        "episode": 161,
        "released": "2017-08-14",
        "overview": "Actresses Danielle MacDonald, Cathy Moriarty and Bridget Everett (\"Patti Cake$\"); Robin Roberts' \"Stress Busters\" series begins."
      },
      {
        "id": "tvmaze:1217830",
        "title": "Episode 162",
        "season": 2017,
        "episode": 162,
        "released": "2017-08-15",
        "overview": ""
      },
      {
        "id": "tvmaze:1217831",
        "title": "Episode 163",
        "season": 2017,
        "episode": 163,
        "released": "2017-08-16",
        "overview": ""
      },
      {
        "id": "tvmaze:1217832",
        "title": "Episode 164",
        "season": 2017,
        "episode": 164,
        "released": "2017-08-17",
        "overview": ""
      },
      {
        "id": "tvmaze:1217833",
        "title": "Episode 165",
        "season": 2017,
        "episode": 165,
        "released": "2017-08-18",
        "overview": ""
      },
      {
        "id": "tvmaze:1217834",
        "title": "Episode 166",
        "season": 2017,
        "episode": 166,
        "released": "2017-08-21",
        "overview": ""
      },
      {
        "id": "tvmaze:1217835",
        "title": "Episode 167",
        "season": 2017,
        "episode": 167,
        "released": "2017-08-22",
        "overview": ""
      },
      {
        "id": "tvmaze:1217836",
        "title": "Episode 168",
        "season": 2017,
        "episode": 168,
        "released": "2017-08-23",
        "overview": ""
      },
      {
        "id": "tvmaze:1217837",
        "title": "Episode 169",
        "season": 2017,
        "episode": 169,
        "released": "2017-08-24",
        "overview": ""
      },
      {
        "id": "tvmaze:1217838",
        "title": "Episode 170",
        "season": 2017,
        "episode": 170,
        "released": "2017-08-25",
        "overview": ""
      },
      {
        "id": "tvmaze:1217839",
        "title": "Episode 171",
        "season": 2017,
        "episode": 171,
        "released": "2017-08-28",
        "overview": ""
      },
      {
        "id": "tvmaze:1217840",
        "title": "Episode 172",
        "season": 2017,
        "episode": 172,
        "released": "2017-08-29",
        "overview": ""
      },
      {
        "id": "tvmaze:1217841",
        "title": "Episode 173",
        "season": 2017,
        "episode": 173,
        "released": "2017-08-30",
        "overview": ""
      },
      {
        "id": "tvmaze:1217842",
        "title": "Episode 174",
        "season": 2017,
        "episode": 174,
        "released": "2017-08-31",
        "overview": ""
      },
      {
        "id": "tvmaze:1217843",
        "title": "Episode 175",
        "season": 2017,
        "episode": 175,
        "released": "2017-09-01",
        "overview": ""
      },
      {
        "id": "tvmaze:1217844",
        "title": "Episode 176",
        "season": 2017,
        "episode": 176,
        "released": "2017-09-04",
        "overview": ""
      },
      {
        "id": "tvmaze:1217845",
        "title": "Episode 177",
        "season": 2017,
        "episode": 177,
        "released": "2017-09-05",
        "overview": ""
      },
      {
        "id": "tvmaze:1217846",
        "title": "Episode 178",
        "season": 2017,
        "episode": 178,
        "released": "2017-09-06",
        "overview": ""
      },
      {
        "id": "tvmaze:1217847",
        "title": "Episode 179",
        "season": 2017,
        "episode": 179,
        "released": "2017-09-07",
        "overview": ""
      },
      {
        "id": "tvmaze:1217848",
        "title": "Episode 180",
        "season": 2017,
        "episode": 180,
        "released": "2017-09-08",
        "overview": ""
      },
      {
        "id": "tvmaze:1217849",
        "title": "Episode 181",
        "season": 2017,
        "episode": 181,
        "released": "2017-09-11",
        "overview": ""
      },
      {
        "id": "tvmaze:1217850",
        "title": "Episode 182",
        "season": 2017,
        "episode": 182,
        "released": "2017-09-12",
        "overview": ""
      },
      {
        "id": "tvmaze:1217851",
        "title": "Episode 183",
        "season": 2017,
        "episode": 183,
        "released": "2017-09-13",
        "overview": ""
      },
      {
        "id": "tvmaze:1217852",
        "title": "Episode 184",
        "season": 2017,
        "episode": 184,
        "released": "2017-09-14",
        "overview": ""
      },
      {
        "id": "tvmaze:1226613",
        "title": "Episode 185",
        "season": 2017,
        "episode": 185,
        "released": "2017-09-15",
        "overview": ""
      },
      {
        "id": "tvmaze:1226614",
        "title": "Episode 186",
        "season": 2017,
        "episode": 186,
        "released": "2017-09-18",
        "overview": ""
      },
      {
        "id": "tvmaze:1226615",
        "title": "Episode 187",
        "season": 2017,
        "episode": 187,
        "released": "2017-09-19",
        "overview": ""
      },
      {
        "id": "tvmaze:1226616",
        "title": "Episode 188",
        "season": 2017,
        "episode": 188,
        "released": "2017-09-20",
        "overview": ""
      },
      {
        "id": "tvmaze:1241209",
        "title": "Episode 189",
        "season": 2017,
        "episode": 189,
        "released": "2017-09-21",
        "overview": ""
      },
      {
        "id": "tvmaze:1241210",
        "title": "Episode 190",
        "season": 2017,
        "episode": 190,
        "released": "2017-09-22",
        "overview": ""
      },
      {
        "id": "tvmaze:1241211",
        "title": "Episode 191",
        "season": 2017,
        "episode": 191,
        "released": "2017-09-25",
        "overview": ""
      },
      {
        "id": "tvmaze:1241212",
        "title": "Episode 192",
        "season": 2017,
        "episode": 192,
        "released": "2017-09-26",
        "overview": ""
      },
      {
        "id": "tvmaze:1241213",
        "title": "Episode 193",
        "season": 2017,
        "episode": 193,
        "released": "2017-09-27",
        "overview": ""
      },
      {
        "id": "tvmaze:1241214",
        "title": "Episode 194",
        "season": 2017,
        "episode": 194,
        "released": "2017-09-28",
        "overview": ""
      },
      {
        "id": "tvmaze:1241215",
        "title": "Episode 195",
        "season": 2017,
        "episode": 195,
        "released": "2017-09-29",
        "overview": ""
      },
      {
        "id": "tvmaze:1241216",
        "title": "Episode 196",
        "season": 2017,
        "episode": 196,
        "released": "2017-10-02",
        "overview": ""
      },
      {
        "id": "tvmaze:1241217",
        "title": "Episode 197",
        "season": 2017,
        "episode": 197,
        "released": "2017-10-03",
        "overview": ""
      },
      {
        "id": "tvmaze:1241218",
        "title": "Episode 198",
        "season": 2017,
        "episode": 198,
        "released": "2017-10-04",
        "overview": ""
      },
      {
        "id": "tvmaze:1241219",
        "title": "Episode 199",
        "season": 2017,
        "episode": 199,
        "released": "2017-10-05",
        "overview": ""
      },
      {
        "id": "tvmaze:1241220",
        "title": "Episode 200",
        "season": 2017,
        "episode": 200,
        "released": "2017-10-06",
        "overview": ""
      },
      {
        "id": "tvmaze:1241221",
        "title": "Episode 201",
        "season": 2017,
        "episode": 201,
        "released": "2017-10-09",
        "overview": ""
      },
      {
        "id": "tvmaze:1241222",
        "title": "Episode 202",
        "season": 2017,
        "episode": 202,
        "released": "2017-10-10",
        "overview": ""
      },
      {
        "id": "tvmaze:1241223",
        "title": "Episode 203",
        "season": 2017,
        "episode": 203,
        "released": "2017-10-11",
        "overview": ""
      },
      {
        "id": "tvmaze:1241224",
        "title": "Episode 204",
        "season": 2017,
        "episode": 204,
        "released": "2017-10-12",
        "overview": ""
      },
      {
        "id": "tvmaze:1241225",
        "title": "Episode 205",
        "season": 2017,
        "episode": 205,
        "released": "2017-10-13",
        "overview": ""
      },
      {
        "id": "tvmaze:1241226",
        "title": "Episode 206",
        "season": 2017,
        "episode": 206,
        "released": "2017-10-16",
        "overview": ""
      },
      {
        "id": "tvmaze:1241227",
        "title": "Episode 207",
        "season": 2017,
        "episode": 207,
        "released": "2017-10-17",
        "overview": ""
      },
      {
        "id": "tvmaze:1241228",
        "title": "Episode 208",
        "season": 2017,
        "episode": 208,
        "released": "2017-10-18",
        "overview": ""
      },
      {
        "id": "tvmaze:1241229",
        "title": "Episode 209",
        "season": 2017,
        "episode": 209,
        "released": "2017-10-19",
        "overview": ""
      },
      {
        "id": "tvmaze:1241230",
        "title": "Episode 210",
        "season": 2017,
        "episode": 210,
        "released": "2017-10-20",
        "overview": ""
      },
      {
        "id": "tvmaze:1241231",
        "title": "Episode 211",
        "season": 2017,
        "episode": 211,
        "released": "2017-10-23",
        "overview": ""
      },
      {
        "id": "tvmaze:1241232",
        "title": "Episode 212",
        "season": 2017,
        "episode": 212,
        "released": "2017-10-24",
        "overview": ""
      },
      {
        "id": "tvmaze:1241233",
        "title": "Episode 213",
        "season": 2017,
        "episode": 213,
        "released": "2017-10-25",
        "overview": ""
      },
      {
        "id": "tvmaze:1241234",
        "title": "Episode 214",
        "season": 2017,
        "episode": 214,
        "released": "2017-10-26",
        "overview": ""
      },
      {
        "id": "tvmaze:1241235",
        "title": "Episode 215",
        "season": 2017,
        "episode": 215,
        "released": "2017-10-27",
        "overview": ""
      },
      {
        "id": "tvmaze:1241236",
        "title": "Episode 216",
        "season": 2017,
        "episode": 216,
        "released": "2017-10-30",
        "overview": ""
      },
      {
        "id": "tvmaze:1241237",
        "title": "Episode 217",
        "season": 2017,
        "episode": 217,
        "released": "2017-10-31",
        "overview": ""
      },
      {
        "id": "tvmaze:1241238",
        "title": "Episode 218",
        "season": 2017,
        "episode": 218,
        "released": "2017-11-01",
        "overview": ""
      },
      {
        "id": "tvmaze:1268638",
        "title": "Episode 219",
        "season": 2017,
        "episode": 219,
        "released": "2017-11-02",
        "overview": ""
      },
      {
        "id": "tvmaze:1268639",
        "title": "Episode 220",
        "season": 2017,
        "episode": 220,
        "released": "2017-11-03",
        "overview": ""
      },
      {
        "id": "tvmaze:1268640",
        "title": "Episode 221",
        "season": 2017,
        "episode": 221,
        "released": "2017-11-06",
        "overview": ""
      },
      {
        "id": "tvmaze:1268641",
        "title": "Episode 222",
        "season": 2017,
        "episode": 222,
        "released": "2017-11-07",
        "overview": ""
      },
      {
        "id": "tvmaze:1268642",
        "title": "Episode 223",
        "season": 2017,
        "episode": 223,
        "released": "2017-11-08",
        "overview": ""
      },
      {
        "id": "tvmaze:1272075",
        "title": "Episode 224",
        "season": 2017,
        "episode": 224,
        "released": "2017-11-09",
        "overview": ""
      },
      {
        "id": "tvmaze:1272076",
        "title": "Episode 225",
        "season": 2017,
        "episode": 225,
        "released": "2017-11-10",
        "overview": ""
      },
      {
        "id": "tvmaze:1272077",
        "title": "Episode 226",
        "season": 2017,
        "episode": 226,
        "released": "2017-11-13",
        "overview": ""
      },
      {
        "id": "tvmaze:1272078",
        "title": "Episode 227",
        "season": 2017,
        "episode": 227,
        "released": "2017-08-15",
        "overview": "Robin Roberts' \"Stress Busters\" series continues"
      },
      {
        "id": "tvmaze:1272079",
        "title": "Episode 228",
        "season": 2017,
        "episode": 228,
        "released": "2017-08-16",
        "overview": "Live performance of \"Despacito\" by Luis Fonsi; Robin Roberts' \"Stress Busters\" series continues."
      },
      {
        "id": "tvmaze:1272080",
        "title": "Episode 229",
        "season": 2017,
        "episode": 229,
        "released": "2017-08-17",
        "overview": "Actor Nikolaj Coster-Waldau (\"Game of Thrones\"); actor Christopher Meloni (\"Wet Hot American Summer: Ten Years Later\"); Deals and Steals with contributor Tory Johnson."
      },
      {
        "id": "tvmaze:1272081",
        "title": "Episode 230",
        "season": 2017,
        "episode": 230,
        "released": "2017-08-18",
        "overview": "GMA Summer Concert performance by Demi Lovato."
      },
      {
        "id": "tvmaze:1272082",
        "title": "Episode 231",
        "season": 2017,
        "episode": 231,
        "released": "2017-08-19",
        "overview": "Co-anchors report the morning's top headlines from a set in Times Square. The show features a combination of breaking news, interviews, in-depth reporting and weather. The program covers important issues with key figures from around the world and a wide spectrum of topics, including medicine, finance, consumer issues, computer technology, education and gardening."
      },
      {
        "id": "tvmaze:1272083",
        "title": "Episode 232",
        "season": 2017,
        "episode": 232,
        "released": "2017-08-20",
        "overview": "Co-anchors report the morning's top headlines from a set in Times Square. The show features a combination of breaking news, interviews, in-depth reporting and weather. The program covers important issues with key figures from around the world and a wide spectrum of topics, including medicine, finance, consumer issues, computer technology, education and gardening."
      },
      {
        "id": "tvmaze:1272084",
        "title": "Episode 233",
        "season": 2017,
        "episode": 233,
        "released": "2017-08-21",
        "overview": "Co-anchors report the morning's top headlines from a set in Times Square. The show features a combination of breaking news, interviews, in-depth reporting and weather. The program covers important issues with key figures from around the world and a wide spectrum of topics, including medicine, finance, consumer issues, computer technology, education and gardening."
      },
      {
        "id": "tvmaze:1272085",
        "title": "Episode 234",
        "season": 2017,
        "episode": 234,
        "released": "2017-08-22",
