{
  "meta": {
    "id": "tvmaze:4189",
    "type": "series",
    "name": "General Hospital",
    "description": "General Hospital, which celebrated its golden anniversary on April 1, 2013, continues its tradition of passion, intrigue and adventure that takes place in the fictional town of Port Charles in upstate New York. The glamour and excitement of those who have come to find their destinies in this familiar seaport town intertwine with the lives, loves and fortunes of beloved, well-known faces. As always, love, danger and mind blowing plot twists continue to abound on General Hospital with contemporary storylines and unforgettable characters.",
    "poster": "https://static.tvmaze.com/uploads/images/original_untouched/521/1302689.jpg",
    "background": "https://static.tvmaze.com/uploads/images/original_untouched/521/1302689.jpg",
    "videos": [
      {
        "id": "tvmaze:3467371",
        "title": "Ep. #15855",
        "season": 2025,
        "episode": 237,
        "released": "2025-12-12",
        "overview": ""
      },
      {
        "id": "tvmaze:1393515",
        "title": "Ep. #1",
        "season": 1963,
        "episode": 1,
        "released": "1963-04-01",
        "overview": ""
      },
      {
        "id": "tvmaze:2246849",
        "title": "Ep. #2",
        "season": 1963,
        "episode": 2,
        "released": "1963-04-02",
        "overview": ""
      },
      {
        "id": "tvmaze:941138",
        "title": "Thurs Jun 27 1963",
        "season": 1963,
        "episode": 65,
        "released": "1963-06-27",
        "overview": ""
      },
      {
        "id": "tvmaze:941139",
        "title": "Fri Jun 28 1963",
        "season": 1963,
        "episode": 66,
        "released": "1963-06-28",
        "overview": ""
      },
      {
        "id": "tvmaze:2219958",
        "title": "Ep. #05309",
        "season": 1984,
        "episode": 1,
        "released": "1984-01-02",
        "overview": ""
      },
      {
        "id": "tvmaze:1484898",
        "title": "Ep. #5573",
        "season": 1985,
        "episode": 6,
        "released": "1985-01-08",
        "overview": ""
      },
      {
        "id": "tvmaze:1484899",
        "title": "Ep. #5644",
        "season": 1985,
        "episode": 72,
        "released": "1985-04-18",
        "overview": ""
      },
      {
        "id": "tvmaze:2218456",
        "title": "Ep. #05833",
        "season": 1986,
        "episode": 1,
        "released": "1986-01-01",
        "overview": ""
      },
      {
        "id": "tvmaze:2218494",
        "title": "Ep. #05834",
        "season": 1986,
        "episode": 2,
        "released": "1986-01-02",
        "overview": ""
      },
      {
        "id": "tvmaze:2218495",
        "title": "Ep. #05835",
        "season": 1986,
        "episode": 3,
        "released": "1986-01-03",
        "overview": ""
      },
      {
        "id": "tvmaze:2218496",
        "title": "Ep. #05836",
        "season": 1986,
        "episode": 4,
        "released": "1986-01-06",
        "overview": ""
      },
      {
        "id": "tvmaze:2218498",
        "title": "Ep. #05837",
        "season": 1986,
        "episode": 5,
        "released": "1986-01-07",
        "overview": ""
      },
      {
        "id": "tvmaze:2218651",
        "title": "Ep. #05838",
        "season": 1986,
        "episode": 6,
        "released": "1986-01-08",
        "overview": ""
      },
      {
        "id": "tvmaze:2218652",
        "title": "Ep. #05839",
        "season": 1986,
        "episode": 7,
        "released": "1986-01-09",
        "overview": ""
      },
      {
        "id": "tvmaze:2218949",
        "title": "Ep. #05840",
        "season": 1986,
        "episode": 8,
        "released": "1986-01-10",
        "overview": ""
      },
      {
        "id": "tvmaze:2218950",
        "title": "Ep. #05841",
        "season": 1986,
        "episode": 9,
        "released": "1986-01-13",
        "overview": ""
      },
      {
        "id": "tvmaze:2218497",
        "title": "Ep. #06013",
        "season": 1986,
        "episode": 100,
        "released": "1986-09-12",
        "overview": ""
      },
      {
        "id": "tvmaze:937215",
        "title": "Thurs Jan 1 1987",
        "season": 1987,
        "episode": 1,
        "released": "1987-01-01",
        "overview": ""
      },
      {
        "id": "tvmaze:274755",
        "title": "Fri Jan 2 1987",
        "season": 1987,
        "episode": 2,
        "released": "1987-01-02",
        "overview": ""
      },
      {
        "id": "tvmaze:893863",
        "title": "Tuesday January 6 1987",
        "season": 1987,
        "episode": 3,
        "released": "1987-01-06",
        "overview": ""
      },
      {
        "id": "tvmaze:893864",
        "title": "Wednesday January 7 1987",
        "season": 1987,
        "episode": 4,
        "released": "1987-01-07",
        "overview": ""
      },
      {
        "id": "tvmaze:893865",
        "title": "Thursday January 8 1987",
        "season": 1987,
        "episode": 5,
        "released": "1987-01-08",
        "overview": ""
      },
      {
        "id": "tvmaze:935878",
        "title": "Friday January 9 1987",
        "season": 1987,
        "episode": 6,
        "released": "1987-01-09",
        "overview": ""
      },
      {
        "id": "tvmaze:935880",
        "title": "Mon Jan 12 1987",
        "season": 1987,
        "episode": 7,
        "released": "1987-01-12",
        "overview": ""
      },
      {
        "id": "tvmaze:935881",
        "title": "Tues Jan 13 1987",
        "season": 1987,
        "episode": 8,
        "released": "1987-01-13",
        "overview": ""
      },
      {
        "id": "tvmaze:274758",
        "title": "Tuesday January 13 1987",
        "season": 1987,
        "episode": 9,
        "released": "1987-01-13",
        "overview": ""
      },
      {
        "id": "tvmaze:935883",
        "title": "Thurs Jan 15 1987",
        "season": 1987,
        "episode": 10,
        "released": "1987-01-15",
        "overview": ""
      },
      {
        "id": "tvmaze:935907",
        "title": "Fri Jan 16 1987",
        "season": 1987,
        "episode": 11,
        "released": "1987-01-16",
        "overview": ""
      },
      {
        "id": "tvmaze:935908",
        "title": "Monday January 19 1987",
        "season": 1987,
        "episode": 12,
        "released": "1987-01-19",
        "overview": ""
      },
      {
        "id": "tvmaze:936558",
        "title": "Tuesday January 20 1987",
        "season": 1987,
        "episode": 13,
        "released": "1987-01-20",
        "overview": ""
      },
      {
        "id": "tvmaze:936559",
        "title": "Wednesday January 21 1987",
        "season": 1987,
        "episode": 14,
        "released": "1987-01-21",
        "overview": ""
      },
      {
        "id": "tvmaze:936560",
        "title": "Thursday January 22 1987",
        "season": 1987,
        "episode": 15,
        "released": "1987-01-22",
        "overview": ""
      },
      {
        "id": "tvmaze:1287934",
        "title": "Thurs Jan 22 1987",
        "season": 1987,
        "episode": 16,
        "released": "1987-01-22",
        "overview": ""
      },
      {
        "id": "tvmaze:1287940",
        "title": "Fri Jan 23 1987",
        "season": 1987,
        "episode": 17,
        "released": "1987-01-23",
        "overview": ""
      },
      {
        "id": "tvmaze:1287947",
        "title": "Monday January 26 1987",
        "season": 1987,
        "episode": 18,
        "released": "1987-01-26",
        "overview": ""
      },
      {
        "id": "tvmaze:1287948",
        "title": "Tuesday January 27 1987",
        "season": 1987,
        "episode": 19,
        "released": "1987-01-27",
        "overview": ""
      },
      {
        "id": "tvmaze:1287949",
        "title": "Wednesday January 28 1987",
        "season": 1987,
        "episode": 20,
        "released": "1987-01-28",
        "overview": ""
      },
      {
        "id": "tvmaze:1287951",
        "title": "Thursday January 29 1987",
        "season": 1987,
        "episode": 21,
        "released": "1987-01-29",
        "overview": ""
      },
      {
        "id": "tvmaze:1287964",
        "title": "Friday January 30 1987",
        "season": 1987,
        "episode": 22,
        "released": "1987-01-30",
        "overview": ""
      },
      {
        "id": "tvmaze:1287968",
        "title": "Mon Feb 02 1987",
        "season": 1987,
        "episode": 23,
        "released": "1987-02-02",
        "overview": ""
      },
      {
        "id": "tvmaze:1288996",
        "title": "Tues Feb 3 1987",
        "season": 1987,
        "episode": 24,
        "released": "1987-02-03",
        "overview": ""
      },
      {
        "id": "tvmaze:1288999",
        "title": "Wed Feb 4 1987",
        "season": 1987,
        "episode": 25,
        "released": "1987-02-04",
        "overview": ""
      },
      {
        "id": "tvmaze:1289000",
        "title": "Thurs Feb 5 1987",
        "season": 1987,
        "episode": 26,
        "released": "1987-02-05",
        "overview": ""
      },
      {
        "id": "tvmaze:1289002",
        "title": "Fri Feb 6 1987",
        "season": 1987,
        "episode": 27,
        "released": "1987-02-06",
        "overview": ""
      },
      {
        "id": "tvmaze:1289019",
        "title": "Monday February 09 1987",
        "season": 1987,
        "episode": 28,
        "released": "1987-02-09",
        "overview": ""
      },
      {
        "id": "tvmaze:1289021",
        "title": "Tuesday February 10 1987",
        "season": 1987,
        "episode": 29,
        "released": "1987-02-10",
        "overview": ""
      },
      {
        "id": "tvmaze:1289033",
        "title": "Wednesday February 11 1987",
        "season": 1987,
        "episode": 30,
        "released": "1987-02-11",
        "overview": ""
      },
      {
        "id": "tvmaze:1289047",
        "title": "Thursday February 12 1987",
        "season": 1987,
        "episode": 31,
        "released": "1987-02-12",
        "overview": ""
      },
      {
        "id": "tvmaze:1289049",
        "title": "Friday February 13 1987",
        "season": 1987,
        "episode": 32,
        "released": "1987-02-13",
        "overview": ""
      },
      {
        "id": "tvmaze:1289063",
        "title": "Mon Feb 16 1987",
        "season": 1987,
        "episode": 33,
        "released": "1987-02-16",
        "overview": ""
      },
      {
        "id": "tvmaze:938152",
        "title": "Tues Feb 17 1987",
        "season": 1987,
        "episode": 34,
        "released": "1987-02-17",
        "overview": ""
      },
      {
        "id": "tvmaze:938153",
        "title": "Wed Feb 18 1987",
        "season": 1987,
        "episode": 35,
        "released": "1987-02-18",
        "overview": ""
      },
      {
        "id": "tvmaze:938154",
        "title": "Thurs Feb 19 1987",
        "season": 1987,
        "episode": 36,
        "released": "1987-02-19",
        "overview": ""
      },
      {
        "id": "tvmaze:938155",
        "title": "Fri Feb 20 1987",
        "season": 1987,
        "episode": 37,
        "released": "1987-02-20",
        "overview": ""
      },
      {
        "id": "tvmaze:938165",
        "title": "Monday February 23 1987",
        "season": 1987,
        "episode": 38,
        "released": "1987-02-23",
        "overview": ""
      },
      {
        "id": "tvmaze:938166",
        "title": "Wednesday February 24 1987",
        "season": 1987,
        "episode": 39,
        "released": "1987-02-24",
        "overview": ""
      },
      {
        "id": "tvmaze:938167",
        "title": "Wednesday February 25 1987",
        "season": 1987,
        "episode": 40,
        "released": "1987-02-25",
        "overview": ""
      },
      {
        "id": "tvmaze:938168",
        "title": "Thursday February 26 1987",
        "season": 1987,
        "episode": 41,
        "released": "1987-02-26",
        "overview": ""
      },
      {
        "id": "tvmaze:938169",
        "title": "Friday February 27 1987",
        "season": 1987,
        "episode": 42,
        "released": "1987-02-27",
        "overview": ""
      },
      {
        "id": "tvmaze:939027",
        "title": "Monday March 02 1987",
        "season": 1987,
        "episode": 43,
        "released": "1987-03-02",
        "overview": ""
      },
      {
        "id": "tvmaze:939033",
        "title": "Tuesday March 3 1987",
        "season": 1987,
        "episode": 44,
        "released": "1987-03-03",
        "overview": ""
      },
      {
        "id": "tvmaze:939035",
        "title": "Wednesday March 4 1987",
        "season": 1987,
        "episode": 45,
        "released": "1987-03-04",
        "overview": ""
      },
      {
        "id": "tvmaze:939039",
        "title": "Thursday March 5 1987",
        "season": 1987,
        "episode": 46,
        "released": "1987-03-05",
        "overview": ""
      },
      {
        "id": "tvmaze:939040",
        "title": "Friday Marh 6 1987",
        "season": 1987,
        "episode": 47,
        "released": "1987-03-06",
        "overview": ""
      },
      {
        "id": "tvmaze:939066",
        "title": "Mon Mar 09 1987",
        "season": 1987,
        "episode": 48,
        "released": "1987-03-09",
        "overview": ""
      },
      {
        "id": "tvmaze:939067",
        "title": "Tues Mar 10 1987",
        "season": 1987,
        "episode": 49,
        "released": "1987-03-10",
        "overview": ""
      },
      {
        "id": "tvmaze:939068",
        "title": "Wed Mar 11 1987",
        "season": 1987,
        "episode": 50,
        "released": "1987-03-11",
        "overview": ""
      },
      {
        "id": "tvmaze:939069",
        "title": "Thurs Mar 12 1987",
        "season": 1987,
        "episode": 51,
        "released": "1987-03-12",
        "overview": ""
      },
      {
        "id": "tvmaze:939070",
        "title": "Fri Mar 13 1987",
        "season": 1987,
        "episode": 52,
        "released": "1987-03-13",
        "overview": ""
      },
      {
        "id": "tvmaze:941126",
        "title": "Mon Mar 16 1987",
        "season": 1987,
        "episode": 53,
        "released": "1987-03-16",
        "overview": ""
      },
      {
        "id": "tvmaze:941127",
        "title": "Tues Mar 17 1987",
        "season": 1987,
        "episode": 54,
        "released": "1987-03-17",
        "overview": ""
      },
      {
        "id": "tvmaze:941128",
        "title": "Wed Mar 18 1987",
        "season": 1987,
        "episode": 55,
        "released": "1987-03-18",
        "overview": ""
      },
      {
        "id": "tvmaze:941129",
        "title": "Thurs Mar 19 1987",
        "season": 1987,
        "episode": 56,
        "released": "1987-03-19",
        "overview": ""
      },
      {
        "id": "tvmaze:941130",
        "title": "Fri Mar 20 1987",
        "season": 1987,
        "episode": 57,
        "released": "1987-03-20",
        "overview": ""
      },
      {
        "id": "tvmaze:941131",
        "title": "Monday March 23 1987",
        "season": 1987,
        "episode": 58,
        "released": "1987-03-23",
        "overview": ""
      },
      {
        "id": "tvmaze:941132",
        "title": "Tuesday March 24 1987",
        "season": 1987,
        "episode": 59,
        "released": "1987-03-24",
        "overview": ""
      },
      {
        "id": "tvmaze:941133",
        "title": "Wednesday March 25 1987",
        "season": 1987,
        "episode": 60,
        "released": "1987-03-25",
        "overview": ""
      },
      {
        "id": "tvmaze:941134",
        "title": "Thursday March 26 1987",
        "season": 1987,
        "episode": 61,
        "released": "1987-03-26",
        "overview": ""
      },
      {
        "id": "tvmaze:941135",
        "title": "Friday March 27 1987",
        "season": 1987,
        "episode": 62,
        "released": "1987-03-27",
        "overview": ""
      },
      {
        "id": "tvmaze:941136",
        "title": "Mon Mar 30 1987",
        "season": 1987,
        "episode": 63,
        "released": "1987-03-30",
        "overview": ""
      },
      {
        "id": "tvmaze:941137",
        "title": "Tues Mar 31 1987",
        "season": 1987,
        "episode": 64,
        "released": "1987-03-31",
        "overview": ""
      },
      {
        "id": "tvmaze:935882",
        "title": "Wed Jan 14 1987",
        "season": 1987,
        "episode": 90,
        "released": "1987-01-14",
        "overview": ""
      },
      {
        "id": "tvmaze:936561",
        "title": "Friday January 23 1987",
        "season": 1987,
        "episode": 91,
        "released": "1987-01-23",
        "overview": ""
      },
      {
        "id": "tvmaze:936562",
        "title": "Mon Jan 26 1987",
        "season": 1987,
        "episode": 92,
        "released": "1987-01-26",
        "overview": ""
      },
      {
        "id": "tvmaze:937202",
        "title": "Tues Jan 27 1987",
        "season": 1987,
        "episode": 93,
        "released": "1987-01-27",
        "overview": ""
      },
      {
        "id": "tvmaze:937205",
        "title": "Wed Jan 28 1987",
        "season": 1987,
        "episode": 94,
        "released": "1987-01-28",
        "overview": ""
      },
      {
        "id": "tvmaze:937207",
        "title": "Thurs Jan 29 1987",
        "season": 1987,
        "episode": 200,
        "released": "1987-01-29",
        "overview": ""
      },
      {
        "id": "tvmaze:937213",
        "title": "Fri Jan 30 1987",
        "season": 1987,
        "episode": 210,
        "released": "1987-01-30",
        "overview": ""
      },
      {
        "id": "tvmaze:938127",
        "title": "Monday January 05 1987",
        "season": 1987,
        "episode": 220,
        "released": "1987-01-05",
        "overview": ""
      },
      {
        "id": "tvmaze:938128",
        "title": "Tuesday January 6 1987",
        "season": 1987,
        "episode": 221,
        "released": "1987-01-06",
        "overview": ""
      },
      {
        "id": "tvmaze:938129",
        "title": "Wed Jan 7 1987",
        "season": 1987,
        "episode": 222,
        "released": "1987-01-07",
        "overview": ""
      },
      {
        "id": "tvmaze:938145",
        "title": "Thurs Jan 8 1987",
        "season": 1987,
        "episode": 223,
        "released": "1987-01-08",
        "overview": ""
      },
      {
        "id": "tvmaze:274756",
        "title": "Fri Jan 9 1987",
        "season": 1987,
        "episode": 224,
        "released": "1987-01-09",
        "overview": ""
      },
      {
        "id": "tvmaze:274757",
        "title": "Monday January 12 1987",
        "season": 1987,
        "episode": 225,
        "released": "1987-01-12",
        "overview": ""
      },
      {
        "id": "tvmaze:274759",
        "title": "Wednesday January 14 1987",
        "season": 1987,
        "episode": 226,
        "released": "1987-01-14",
        "overview": ""
      },
      {
        "id": "tvmaze:938151",
        "title": "Thursday January 15 1987",
        "season": 1987,
        "episode": 227,
        "released": "1987-01-15",
        "overview": ""
      },
      {
        "id": "tvmaze:1287897",
        "title": "Friday January 16 1987",
        "season": 1987,
        "episode": 228,
        "released": "1987-01-16",
        "overview": ""
      },
      {
        "id": "tvmaze:1287900",
        "title": "Mon Jan 19 1987",
        "season": 1987,
        "episode": 229,
        "released": "1987-01-19",
        "overview": ""
      },
      {
        "id": "tvmaze:1287906",
        "title": "Tues Jan 20 1987",
        "season": 1987,
        "episode": 230,
        "released": "1987-01-20",
        "overview": ""
      },
      {
        "id": "tvmaze:1287933",
        "title": "Wed Jan 21 1987",
        "season": 1987,
        "episode": 231,
        "released": "1987-01-21",
        "overview": ""
      },
      {
        "id": "tvmaze:1223926",
        "title": "Fri Jan 1 1988",
        "season": 1988,
        "episode": 1,
        "released": "1988-01-01",
        "overview": ""
      },
      {
        "id": "tvmaze:1223931",
        "title": "Monday January 04 1988",
        "season": 1988,
        "episode": 2,
        "released": "1988-01-04",
        "overview": ""
      },
      {
        "id": "tvmaze:1223935",
        "title": "Tuesday January 05 1988",
        "season": 1988,
        "episode": 3,
        "released": "1988-01-05",
        "overview": ""
      },
      {
        "id": "tvmaze:1223957",
        "title": "Wednesday January 06 1988",
        "season": 1988,
        "episode": 4,
        "released": "1988-01-06",
        "overview": ""
      },
      {
        "id": "tvmaze:1223958",
        "title": "Thursday January 07 1988",
        "season": 1988,
        "episode": 5,
        "released": "1988-01-07",
        "overview": ""
      },
      {
        "id": "tvmaze:1223959",
        "title": "Friday January 08 1988",
        "season": 1988,
        "episode": 7,
        "released": "1988-01-08",
        "overview": ""
      },
      {
        "id": "tvmaze:1223960",
        "title": "Mon Jan 11 1988",
        "season": 1988,
        "episode": 8,
        "released": "1988-01-11",
        "overview": ""
      },
      {
        "id": "tvmaze:1223961",
        "title": "Tues Jan 12 1988",
        "season": 1988,
        "episode": 9,
        "released": "1988-01-12",
        "overview": ""
      },
      {
        "id": "tvmaze:1223962",
        "title": "Wed Jan 13 1988",
        "season": 1988,
        "episode": 10,
        "released": "1988-01-13",
        "overview": ""
      },
      {
        "id": "tvmaze:1223963",
        "title": "Thurs Jan 14 1988",
        "season": 1988,
        "episode": 11,
        "released": "1988-01-14",
        "overview": ""
      },
      {
        "id": "tvmaze:1223964",
        "title": "Fri Jan 15 1988",
        "season": 1988,
        "episode": 12,
        "released": "1988-01-15",
        "overview": ""
      },
      {
        "id": "tvmaze:1223965",
        "title": "Monday January 18 1988",
        "season": 1988,
        "episode": 13,
        "released": "1988-01-18",
        "overview": ""
      },
      {
        "id": "tvmaze:1223983",
        "title": "Tuesday January 19 1988",
        "season": 1988,
        "episode": 14,
        "released": "1988-01-19",
        "overview": ""
      },
      {
        "id": "tvmaze:1224000",
        "title": "Wednesday January 20 1988",
        "season": 1988,
        "episode": 15,
        "released": "1988-01-20",
        "overview": ""
      },
      {
        "id": "tvmaze:1224011",
        "title": "Thursday January 21 1988",
        "season": 1988,
        "episode": 16,
        "released": "1988-01-21",
        "overview": ""
      },
      {
        "id": "tvmaze:1224020",
        "title": "Friday January 22 1988",
        "season": 1988,
        "episode": 17,
        "released": "1988-01-22",
        "overview": ""
      },
      {
        "id": "tvmaze:1224036",
        "title": "Mon Jan 25 1988",
        "season": 1988,
        "episode": 18,
        "released": "1988-01-25",
        "overview": ""
      },
      {
        "id": "tvmaze:1224044",
        "title": "Tues Jan 26 1988",
        "season": 1988,
        "episode": 19,
        "released": "1988-01-26",
        "overview": ""
      },
      {
        "id": "tvmaze:1224055",
        "title": "Wed Jan 27 1988",
        "season": 1988,
        "episode": 20,
        "released": "1988-01-27",
        "overview": ""
      },
      {
        "id": "tvmaze:1224057",
        "title": "Thurs Jan 28 1988",
        "season": 1988,
        "episode": 21,
        "released": "1988-01-28",
        "overview": ""
      },
      {
        "id": "tvmaze:1224058",
        "title": "Fri Jan 29 1988",
        "season": 1988,
        "episode": 22,
        "released": "1988-01-29",
        "overview": ""
      },
      {
        "id": "tvmaze:1224059",
        "title": "Monday February 01 1988",
        "season": 1988,
        "episode": 23,
        "released": "1988-02-01",
        "overview": ""
      },
      {
        "id": "tvmaze:1291275",
        "title": "Tuesday February 02 1988",
        "season": 1988,
        "episode": 24,
        "released": "1988-02-02",
        "overview": ""
      },
      {
        "id": "tvmaze:1291277",
        "title": "Wednesday February 03 1988",
        "season": 1988,
        "episode": 25,
        "released": "1988-02-03",
        "overview": ""
      },
      {
        "id": "tvmaze:1291278",
        "title": "Thursday February 04 1988",
        "season": 1988,
        "episode": 26,
        "released": "1988-02-04",
        "overview": ""
      },
      {
        "id": "tvmaze:1291279",
        "title": "Friday February 05 1988",
        "season": 1988,
        "episode": 27,
        "released": "1988-02-05",
        "overview": ""
      },
      {
        "id": "tvmaze:1291280",
        "title": "Mon Feb 8 1988",
        "season": 1988,
        "episode": 28,
        "released": "1988-02-08",
        "overview": ""
      },
      {
        "id": "tvmaze:1291282",
        "title": "Tues Feb 9 1988",
        "season": 1988,
        "episode": 29,
        "released": "1988-02-09",
        "overview": ""
      },
      {
        "id": "tvmaze:1291283",
        "title": "Wed Feb 10 1988",
        "season": 1988,
        "episode": 30,
        "released": "1988-02-10",
        "overview": ""
      },
      {
        "id": "tvmaze:1291284",
        "title": "Thurs Feb 11 1988",
        "season": 1988,
        "episode": 31,
        "released": "1988-02-11",
        "overview": ""
      },
      {
        "id": "tvmaze:1291285",
        "title": "Fri Feb 12 1988",
        "season": 1988,
        "episode": 32,
        "released": "1988-02-12",
        "overview": ""
      },
      {
        "id": "tvmaze:1291287",
        "title": "Monday February 15 1988",
        "season": 1988,
        "episode": 33,
        "released": "1988-02-15",
        "overview": ""
      },
      {
        "id": "tvmaze:1291288",
        "title": "Tuesday February 16 1988",
        "season": 1988,
        "episode": 34,
        "released": "1988-02-16",
        "overview": ""
      },
      {
        "id": "tvmaze:1291289",
        "title": "Wednesday February 17 1988",
        "season": 1988,
        "episode": 35,
        "released": "1988-02-17",
        "overview": ""
      },
      {
        "id": "tvmaze:1291290",
        "title": "Thursday February 18 1988",
        "season": 1988,
        "episode": 36,
        "released": "1988-02-18",
        "overview": ""
      },
      {
        "id": "tvmaze:1291293",
        "title": "Friday February 19 1988",
        "season": 1988,
        "episode": 37,
        "released": "1988-02-19",
        "overview": ""
      },
      {
        "id": "tvmaze:1291300",
        "title": "Mon Feb 22 1988",
        "season": 1988,
        "episode": 38,
        "released": "1988-02-22",
        "overview": ""
      },
      {
        "id": "tvmaze:1291301",
        "title": "Tues Feb 23 1988",
        "season": 1988,
        "episode": 39,
        "released": "1988-02-23",
        "overview": ""
      },
      {
        "id": "tvmaze:1291302",
        "title": "Wed Feb 24 1988",
        "season": 1988,
        "episode": 40,
        "released": "1988-02-24",
        "overview": ""
      },
      {
        "id": "tvmaze:1291303",
        "title": "Thurs Feb 25 1988",
        "season": 1988,
        "episode": 41,
        "released": "1988-02-25",
        "overview": ""
      },
      {
        "id": "tvmaze:1291304",
        "title": "Fri Feb 26 1988",
        "season": 1988,
        "episode": 42,
        "released": "1988-02-26",
        "overview": ""
      },
      {
        "id": "tvmaze:1291305",
        "title": "Monday February 29 1988",
        "season": 1988,
        "episode": 43,
        "released": "1988-02-29",
        "overview": ""
      },
      {
        "id": "tvmaze:1325273",
        "title": "Tuesday March 01 1988",
        "season": 1988,
        "episode": 44,
        "released": "1988-03-01",
        "overview": ""
      },
      {
        "id": "tvmaze:1325274",
        "title": "Wednesday March 02 1988",
        "season": 1988,
        "episode": 45,
        "released": "1988-03-02",
        "overview": ""
      },
      {
        "id": "tvmaze:1325275",
        "title": "Thursday March 03 1988",
        "season": 1988,
        "episode": 46,
        "released": "1988-03-03",
        "overview": ""
      },
      {
        "id": "tvmaze:1325276",
        "title": "Friday March 04 1988",
        "season": 1988,
        "episode": 47,
        "released": "1988-03-04",
        "overview": ""
      },
      {
        "id": "tvmaze:1325277",
        "title": "Mon Mar 7 1988",
        "season": 1988,
        "episode": 48,
        "released": "1988-03-07",
        "overview": ""
      },
      {
        "id": "tvmaze:1325278",
        "title": "Tues Mar 8 1988",
        "season": 1988,
        "episode": 49,
        "released": "1988-03-08",
        "overview": ""
      },
      {
        "id": "tvmaze:1325279",
        "title": "Wed Mar 9 1988",
        "season": 1988,
        "episode": 50,
        "released": "1988-03-09",
        "overview": ""
      },
      {
        "id": "tvmaze:1325280",
        "title": "Thurs Mar 10 1988",
        "season": 1988,
        "episode": 51,
        "released": "1988-03-10",
        "overview": ""
      },
      {
        "id": "tvmaze:1325281",
        "title": "Fri Mar 11 1988",
        "season": 1988,
        "episode": 52,
        "released": "1988-03-11",
        "overview": ""
      },
      {
        "id": "tvmaze:1325282",
        "title": "Monday March 14 1988",
        "season": 1988,
        "episode": 53,
        "released": "1988-03-14",
        "overview": ""
      },
      {
        "id": "tvmaze:1325283",
        "title": "Tuesday March 15 1988",
        "season": 1988,
        "episode": 54,
        "released": "1988-03-15",
        "overview": ""
      },
      {
        "id": "tvmaze:1325284",
        "title": "Wednesday March 16 1988",
        "season": 1988,
        "episode": 55,
        "released": "1988-03-16",
        "overview": ""
      },
      {
        "id": "tvmaze:1325285",
        "title": "Thursday March 17 1988",
        "season": 1988,
        "episode": 56,
        "released": "1988-03-17",
        "overview": ""
      },
      {
        "id": "tvmaze:1325286",
        "title": "Friday March 18 1988",
        "season": 1988,
        "episode": 57,
        "released": "1988-03-18",
        "overview": ""
      },
      {
        "id": "tvmaze:1325287",
        "title": "Mon Mar 21 1988",
        "season": 1988,
        "episode": 58,
        "released": "1988-03-21",
        "overview": ""
      },
      {
        "id": "tvmaze:1325288",
        "title": "Tues Mar 22 1988",
        "season": 1988,
        "episode": 59,
        "released": "1988-03-22",
        "overview": ""
      },
      {
        "id": "tvmaze:1325289",
        "title": "Wed Mar 23 1988",
        "season": 1988,
        "episode": 60,
        "released": "1988-03-23",
        "overview": ""
      },
      {
        "id": "tvmaze:1325290",
        "title": "Thurs Mar 24 1988",
        "season": 1988,
        "episode": 61,
        "released": "1988-03-24",
        "overview": ""
      },
      {
        "id": "tvmaze:1325291",
        "title": "Fri Mar 25 1988",
        "season": 1988,
        "episode": 62,
        "released": "1988-03-25",
        "overview": ""
      },
      {
        "id": "tvmaze:1325292",
        "title": "Monday March 28 1988",
        "season": 1988,
        "episode": 63,
        "released": "1988-03-28",
        "overview": ""
      },
      {
        "id": "tvmaze:1325293",
        "title": "Tuesday March 29 1988",
        "season": 1988,
        "episode": 64,
        "released": "1988-03-29",
        "overview": ""
      },
      {
        "id": "tvmaze:1325294",
        "title": "Wednesday March 30 1988",
        "season": 1988,
        "episode": 65,
        "released": "1988-03-30",
        "overview": ""
      },
      {
        "id": "tvmaze:1325295",
        "title": "Thursday March 31 1988",
        "season": 1988,
        "episode": 66,
        "released": "1988-03-31",
        "overview": ""
      },
      {
        "id": "tvmaze:1225319",
        "title": "Jan 2 1989",
        "season": 1989,
        "episode": 1,
        "released": "1989-01-02",
        "overview": ""
      },
      {
        "id": "tvmaze:1225321",
        "title": "Jan 3 1989",
        "season": 1989,
        "episode": 2,
        "released": "1989-01-03",
        "overview": ""
      },
      {
        "id": "tvmaze:1225323",
        "title": "Jan 4 1989",
        "season": 1989,
        "episode": 3,
        "released": "1989-01-04",
        "overview": ""
      },
      {
        "id": "tvmaze:1225326",
        "title": "Jan 5 1989",
        "season": 1989,
        "episode": 5,
        "released": "1989-01-05",
        "overview": ""
      },
      {
        "id": "tvmaze:1225327",
        "title": "Jan 6 1989",
        "season": 1989,
        "episode": 6,
        "released": "1989-01-06",
        "overview": ""
      },
      {
        "id": "tvmaze:1225328",
        "title": "January 09 1989",
        "season": 1989,
        "episode": 7,
        "released": "1989-01-09",
        "overview": ""
      },
      {
        "id": "tvmaze:1225329",
        "title": "Tuesday January 10 1989",
        "season": 1989,
        "episode": 8,
        "released": "1989-01-10",
        "overview": ""
      },
      {
        "id": "tvmaze:1225330",
        "title": "Wednesday January 11 1989",
        "season": 1989,
        "episode": 9,
        "released": "1989-01-11",
        "overview": ""
      },
      {
        "id": "tvmaze:1225331",
        "title": "Thursday January 12 1989",
        "season": 1989,
        "episode": 10,
        "released": "1989-01-12",
        "overview": ""
      },
      {
        "id": "tvmaze:1225332",
        "title": "Friday January 13 1989",
        "season": 1989,
        "episode": 11,
        "released": "1989-01-13",
        "overview": ""
      },
      {
        "id": "tvmaze:1225333",
        "title": "Mon Jan 16 1989",
        "season": 1989,
        "episode": 12,
        "released": "1989-01-16",
        "overview": ""
      },
      {
        "id": "tvmaze:1225334",
        "title": "Tues Jan 17 1989",
        "season": 1989,
        "episode": 13,
        "released": "1989-01-17",
        "overview": ""
      },
      {
        "id": "tvmaze:1225335",
        "title": "Wed Jan 18 1989",
        "season": 1989,
        "episode": 14,
        "released": "1989-01-18",
        "overview": ""
      },
      {
        "id": "tvmaze:1225336",
        "title": "Thurs Jan 19 1989",
        "season": 1989,
        "episode": 15,
        "released": "1989-01-19",
        "overview": ""
      },
      {
        "id": "tvmaze:1225337",
        "title": "Fri Jan 20 1989",
        "season": 1989,
        "episode": 16,
        "released": "1989-01-20",
        "overview": ""
      },
      {
        "id": "tvmaze:1225338",
        "title": "Monday January 23 1989",
        "season": 1989,
        "episode": 17,
        "released": "1989-01-23",
        "overview": ""
      },
      {
        "id": "tvmaze:1225339",
        "title": "Tuesday January 24 1989",
        "season": 1989,
        "episode": 18,
        "released": "1989-01-24",
        "overview": ""
      },
      {
        "id": "tvmaze:1225340",
        "title": "Wednesday January 25 1989",
        "season": 1989,
        "episode": 19,
        "released": "1989-01-25",
        "overview": ""
      },
      {
        "id": "tvmaze:1225341",
        "title": "Thursday January 26 1989",
        "season": 1989,
        "episode": 20,
        "released": "1989-01-26",
        "overview": ""
      },
      {
        "id": "tvmaze:1225342",
        "title": "Friday January 27 1989",
        "season": 1989,
        "episode": 21,
        "released": "1989-01-27",
        "overview": ""
      },
      {
        "id": "tvmaze:1225343",
        "title": "Mon Jan 30 1989",
        "season": 1989,
        "episode": 22,
        "released": "1989-01-30",
        "overview": ""
      },
      {
        "id": "tvmaze:1225344",
        "title": "Tues Jan 31 1989",
        "season": 1989,
        "episode": 23,
        "released": "1989-01-31",
        "overview": ""
      },
      {
        "id": "tvmaze:1325296",
        "title": "Wed Feb 01 1989",
        "season": 1989,
        "episode": 24,
        "released": "1989-02-01",
        "overview": ""
      },
      {
        "id": "tvmaze:1325297",
        "title": "Thurs Feb 02 1989",
        "season": 1989,
        "episode": 25,
        "released": "1989-02-02",
        "overview": ""
      },
      {
        "id": "tvmaze:1325298",
        "title": "Fri Feb 03 1989",
        "season": 1989,
        "episode": 26,
        "released": "1989-02-03",
        "overview": ""
      },
      {
        "id": "tvmaze:1325299",
        "title": "Monday February 6 1989",
        "season": 1989,
        "episode": 27,
        "released": "1989-02-06",
        "overview": ""
      },
      {
        "id": "tvmaze:1325300",
        "title": "Tuesday February 7 1989",
        "season": 1989,
        "episode": 28,
        "released": "1989-02-07",
        "overview": ""
      },
      {
        "id": "tvmaze:1325301",
        "title": "Wednesday February 8 1989",
        "season": 1989,
        "episode": 29,
        "released": "1989-02-08",
        "overview": ""
      },
      {
        "id": "tvmaze:1325302",
        "title": "Thursday February 9 1989",
        "season": 1989,
        "episode": 30,
        "released": "1989-02-09",
        "overview": ""
      },
      {
        "id": "tvmaze:1325303",
        "title": "Friday February 10 1989",
        "season": 1989,
        "episode": 31,
        "released": "1989-02-10",
        "overview": ""
      },
      {
        "id": "tvmaze:1325304",
        "title": "Mon Feb 13 1989",
        "season": 1989,
        "episode": 32,
        "released": "1989-02-13",
        "overview": ""
      },
      {
        "id": "tvmaze:1325305",
        "title": "Tues Feb 14 1989",
        "season": 1989,
        "episode": 33,
        "released": "1989-02-14",
        "overview": ""
      },
      {
        "id": "tvmaze:1325306",
        "title": "Wed Feb 15 1989",
        "season": 1989,
        "episode": 34,
        "released": "1989-02-15",
        "overview": ""
      },
      {
        "id": "tvmaze:1325307",
        "title": "Thurs Feb 16 1989",
        "season": 1989,
        "episode": 35,
        "released": "1989-02-16",
        "overview": ""
      },
      {
        "id": "tvmaze:1325308",
        "title": "Fri Feb 17 1989",
        "season": 1989,
        "episode": 37,
        "released": "1989-02-17",
        "overview": ""
      },
      {
        "id": "tvmaze:1325309",
        "title": "Monday February 20 1989",
        "season": 1989,
        "episode": 38,
        "released": "1989-02-20",
        "overview": ""
      },
      {
        "id": "tvmaze:1325310",
        "title": "Tuesday February 21 1989",
        "season": 1989,
        "episode": 39,
        "released": "1989-02-21",
        "overview": ""
      },
      {
        "id": "tvmaze:1325311",
        "title": "Wednesday February 22 1989",
        "season": 1989,
        "episode": 40,
        "released": "1989-02-22",
        "overview": ""
      },
      {
        "id": "tvmaze:1325312",
        "title": "Thursday February 23 1989",
        "season": 1989,
        "episode": 41,
        "released": "1989-02-23",
        "overview": ""
      },
      {
        "id": "tvmaze:1325313",
        "title": "Friday February 24 1989",
        "season": 1989,
        "episode": 42,
        "released": "1989-02-24",
        "overview": ""
      },
      {
        "id": "tvmaze:1325314",
        "title": "Mon Feb 27 1989",
        "season": 1989,
        "episode": 43,
        "released": "1989-02-27",
        "overview": ""
      },
      {
        "id": "tvmaze:1325315",
        "title": "Tues Feb 28 1989",
        "season": 1989,
        "episode": 44,
        "released": "1989-02-28",
        "overview": ""
      },
      {
        "id": "tvmaze:1225345",
        "title": "Mon Jan 01 1990",
        "season": 1990,
        "episode": 1,
        "released": "1990-01-01",
        "overview": ""
      },
      {
        "id": "tvmaze:1225397",
        "title": "Tues Jan 02 1990",
        "season": 1990,
        "episode": 2,
        "released": "1990-01-02",
        "overview": ""
      },
      {
        "id": "tvmaze:1225398",
        "title": "Wed Jan 03 1990",
        "season": 1990,
        "episode": 3,
        "released": "1990-01-03",
        "overview": ""
      },
      {
        "id": "tvmaze:1225399",
        "title": "Thurs Jan 04 1990",
        "season": 1990,
        "episode": 4,
        "released": "1990-01-04",
        "overview": ""
      },
      {
        "id": "tvmaze:1225400",
        "title": "Fri Jan 05 1990",
        "season": 1990,
        "episode": 5,
        "released": "1990-01-05",
        "overview": ""
      },
      {
        "id": "tvmaze:1225401",
        "title": "Monday January 8 1990",
        "season": 1990,
        "episode": 6,
        "released": "1990-01-08",
        "overview": ""
      },
      {
        "id": "tvmaze:1225402",
        "title": "Tuesday January 9 1990",
        "season": 1990,
        "episode": 7,
        "released": "1990-01-09",
        "overview": ""
      },
      {
        "id": "tvmaze:1225403",
        "title": "Wednesday January 10 1990",
        "season": 1990,
        "episode": 8,
        "released": "1990-01-10",
        "overview": ""
      },
      {
        "id": "tvmaze:1225404",
        "title": "Thursday January 11 1990",
        "season": 1990,
        "episode": 9,
        "released": "1990-01-11",
        "overview": ""
      },
      {
        "id": "tvmaze:1225405",
        "title": "Friday January 12 1990",
        "season": 1990,
        "episode": 10,
        "released": "1990-01-12",
        "overview": ""
      },
      {
        "id": "tvmaze:1225406",
        "title": "Mon Jan 15 1990",
        "season": 1990,
        "episode": 11,
        "released": "1990-01-15",
        "overview": ""
      },
      {
        "id": "tvmaze:1225407",
        "title": "Tues Jan 16 1990",
        "season": 1990,
        "episode": 12,
        "released": "1990-01-16",
        "overview": ""
      },
      {
        "id": "tvmaze:1225408",
        "title": "Wed Jan 17 1990",
        "season": 1990,
        "episode": 13,
        "released": "1990-01-17",
        "overview": ""
      },
      {
        "id": "tvmaze:1225409",
        "title": "Thurs Jan 18 1990",
        "season": 1990,
        "episode": 14,
        "released": "1990-01-18",
        "overview": ""
      },
      {
        "id": "tvmaze:1225410",
        "title": "Fri Jan 19 1990",
        "season": 1990,
        "episode": 15,
        "released": "1990-01-19",
        "overview": ""
      },
      {
        "id": "tvmaze:1225411",
        "title": "Monday January 22 1990",
        "season": 1990,
        "episode": 16,
        "released": "1990-01-22",
        "overview": ""
      },
      {
        "id": "tvmaze:1225412",
        "title": "Tuesday January 23 1990",
        "season": 1990,
        "episode": 17,
        "released": "1990-01-23",
        "overview": ""
      },
      {
        "id": "tvmaze:1225413",
        "title": "Wednesday Janaury 24 1990",
        "season": 1990,
        "episode": 18,
        "released": "1990-01-24",
        "overview": ""
      },
      {
        "id": "tvmaze:1225414",
        "title": "Thursday January 25 1990",
        "season": 1990,
        "episode": 19,
        "released": "1990-01-25",
        "overview": ""
      },
      {
        "id": "tvmaze:1325316",
        "title": "Friday January 26 1990",
        "season": 1990,
        "episode": 20,
        "released": "1990-01-26",
        "overview": ""
      },
      {
        "id": "tvmaze:1225415",
        "title": "Mon Jan 29 1990",
        "season": 1990,
        "episode": 21,
        "released": "1990-01-29",
        "overview": ""
      },
      {
        "id": "tvmaze:1225416",
        "title": "Tues Jan 30 1990",
        "season": 1990,
        "episode": 22,
        "released": "1990-01-30",
        "overview": ""
      },
      {
        "id": "tvmaze:1225417",
        "title": "Wed Jan 31 1990",
        "season": 1990,
        "episode": 23,
        "released": "1990-01-31",
        "overview": ""
      },
      {
        "id": "tvmaze:1225418",
        "title": "Tues Jan 1 1991",
        "season": 1991,
        "episode": 4,
        "released": "1991-01-01",
        "overview": ""
      },
      {
        "id": "tvmaze:1225419",
        "title": "Wed Jan 2 1991",
        "season": 1991,
        "episode": 5,
        "released": "1991-01-02",
        "overview": ""
      },
      {
        "id": "tvmaze:1225420",
        "title": "Thurs Jan 3 1991",
        "season": 1991,
        "episode": 6,
        "released": "1991-01-03",
        "overview": ""
      },
      {
        "id": "tvmaze:1225421",
        "title": "Fri Jan 4 1991",
        "season": 1991,
        "episode": 7,
        "released": "1991-01-04",
        "overview": ""
      },
      {
        "id": "tvmaze:1225422",
        "title": "Monday January 07 1991",
        "season": 1991,
        "episode": 8,
        "released": "1991-01-07",
        "overview": ""
      },
      {
        "id": "tvmaze:1225423",
        "title": "Tuesday January 08 1991",
        "season": 1991,
        "episode": 9,
        "released": "1991-01-08",
        "overview": ""
      },
      {
        "id": "tvmaze:1225424",
        "title": "Wednesday January 09 1991",
        "season": 1991,
        "episode": 10,
        "released": "1991-01-09",
        "overview": ""
      },
      {
        "id": "tvmaze:1225425",
        "title": "Thursday January 10 1991",
        "season": 1991,
        "episode": 11,
        "released": "1991-01-10",
        "overview": ""
      },
      {
        "id": "tvmaze:1226715",
        "title": "Friday January 11 1991",
        "season": 1991,
        "episode": 12,
        "released": "1991-01-11",
        "overview": ""
      },
      {
        "id": "tvmaze:1226716",
        "title": "Mon Jan 14 1991",
        "season": 1991,
        "episode": 13,
        "released": "1991-01-14",
        "overview": ""
      },
      {
        "id": "tvmaze:1226720",
        "title": "Tues Jan 15 1991",
        "season": 1991,
        "episode": 14,
        "released": "1991-01-15",
        "overview": ""
      },
      {
        "id": "tvmaze:1226732",
        "title": "Wed Jan 16 1991",
        "season": 1991,
        "episode": 15,
        "released": "1991-01-16",
        "overview": ""
      },
      {
        "id": "tvmaze:1226743",
        "title": "Thurs Jan 17 1991",
        "season": 1991,
        "episode": 16,
        "released": "1991-01-17",
        "overview": ""
      },
      {
        "id": "tvmaze:1226756",
        "title": "Fri Jan 18 1991",
        "season": 1991,
        "episode": 17,
        "released": "1991-01-18",
        "overview": ""
      },
      {
        "id": "tvmaze:1226878",
        "title": "Monday January 21 1991",
        "season": 1991,
        "episode": 18,
        "released": "1991-01-21",
        "overview": ""
      },
      {
        "id": "tvmaze:1226882",
        "title": "Tuesday January 22 1991",
        "season": 1991,
        "episode": 19,
        "released": "1991-01-22",
        "overview": ""
      },
      {
        "id": "tvmaze:1226884",
        "title": "Wednesday January 23 1991",
        "season": 1991,
        "episode": 20,
        "released": "1991-01-23",
        "overview": ""
      },
      {
        "id": "tvmaze:1226885",
        "title": "Thursday January 24 1991",
        "season": 1991,
        "episode": 21,
        "released": "1991-01-24",
        "overview": ""
      },
      {
        "id": "tvmaze:1226888",
        "title": "Friday January 25 1991",
        "season": 1991,
        "episode": 22,
        "released": "1991-01-25",
        "overview": ""
      },
      {
        "id": "tvmaze:1325317",
        "title": "Mon Jan 28 1991",
        "season": 1991,
        "episode": 23,
        "released": "1991-01-28",
        "overview": ""
      },
      {
        "id": "tvmaze:1325318",
        "title": "Tues Jan 29 1991",
        "season": 1991,
        "episode": 24,
        "released": "1991-01-29",
        "overview": ""
      },
      {
        "id": "tvmaze:1325319",
        "title": "Wed Jan 30 1991",
        "season": 1991,
        "episode": 25,
        "released": "1991-01-30",
        "overview": ""
      },
      {
        "id": "tvmaze:1325683",
        "title": "Thurs Jan 31 1991",
        "season": 1991,
        "episode": 27,
        "released": "1991-01-31",
        "overview": ""
      },
      {
        "id": "tvmaze:274760",
        "title": "January 8 1993",
        "season": 1993,
        "episode": 6,
        "released": "1993-01-08",
        "overview": ""
      },
      {
        "id": "tvmaze:274761",
        "title": "Jan 11 1993",
        "season": 1993,
        "episode": 7,
        "released": "1993-01-11",
        "overview": ""
      },
      {
        "id": "tvmaze:274762",
        "title": "Tues Jan 12 1993",
        "season": 1993,
        "episode": 8,
        "released": "1993-01-12",
        "overview": ""
      },
      {
        "id": "tvmaze:274763",
        "title": "Wed Jan 13 1993",
        "season": 1993,
        "episode": 9,
        "released": "1993-01-13",
        "overview": ""
      },
      {
        "id": "tvmaze:274764",
        "title": "Thurs Jan 14 1993",
        "season": 1993,
        "episode": 10,
        "released": "1993-01-14",
        "overview": ""
      },
      {
        "id": "tvmaze:274765",
        "title": "Fri Jan 15 1993",
        "season": 1993,
        "episode": 11,
        "released": "1993-01-15",
        "overview": ""
      },
      {
        "id": "tvmaze:274766",
        "title": "Monday January 18 1993",
        "season": 1993,
        "episode": 12,
        "released": "1993-01-18",
        "overview": ""
      },
      {
        "id": "tvmaze:274767",
        "title": "Tuesday January 19 1993",
        "season": 1993,
        "episode": 13,
        "released": "1993-01-19",
        "overview": ""
      },
      {
        "id": "tvmaze:826086",
        "title": "Wednesday January 20 1993",
        "season": 1993,
        "episode": 21,
        "released": "1993-01-20",
        "overview": ""
      },
      {
        "id": "tvmaze:274768",
        "title": "Thursday January 21 1993",
        "season": 1993,
        "episode": 22,
        "released": "1993-01-21",
        "overview": ""
      },
      {
        "id": "tvmaze:894347",
        "title": "Friday January 22 1993",
        "season": 1993,
        "episode": 23,
        "released": "1993-01-22",
        "overview": ""
      },
      {
        "id": "tvmaze:894348",
        "title": "Mon Jan 25 1993",
        "season": 1993,
        "episode": 24,
        "released": "1993-01-25",
        "overview": ""
      },
      {
        "id": "tvmaze:1155101",
        "title": "Tues Jan 26 1993",
        "season": 1993,
        "episode": 25,
        "released": "1993-01-26",
        "overview": ""
      },
      {
        "id": "tvmaze:1155102",
        "title": "Wed Jan 27 1993",
        "season": 1993,
        "episode": 26,
        "released": "1993-01-27",
        "overview": ""
      },
      {
        "id": "tvmaze:1155105",
        "title": "Thurs Jan 28 1993",
        "season": 1993,
        "episode": 27,
        "released": "1993-01-28",
        "overview": ""
      },
      {
        "id": "tvmaze:1155106",
        "title": "Fri Jan 29 1993",
        "season": 1993,
        "episode": 28,
        "released": "1993-01-29",
        "overview": ""
      },
      {
        "id": "tvmaze:894350",
        "title": "Mon Jan 03 1994",
        "season": 1994,
        "episode": 1,
        "released": "1994-01-03",
        "overview": ""
      },
      {
        "id": "tvmaze:895180",
        "title": "Tues Jan 04 1994",
        "season": 1994,
        "episode": 2,
        "released": "1994-01-04",
        "overview": ""
      },
      {
        "id": "tvmaze:895181",
        "title": "Wed Jan 05 1994",
        "season": 1994,
        "episode": 3,
        "released": "1994-01-05",
        "overview": ""
      },
      {
        "id": "tvmaze:895182",
        "title": "Thurs Jan 06 1994",
        "season": 1994,
        "episode": 4,
        "released": "1994-01-06",
        "overview": ""
      },
      {
        "id": "tvmaze:895183",
        "title": "Fri Jan 07 1994",
        "season": 1994,
        "episode": 5,
        "released": "1994-01-07",
        "overview": ""
      },
      {
        "id": "tvmaze:895184",
        "title": "Monday January 10 1994",
        "season": 1994,
        "episode": 6,
        "released": "1994-01-10",
        "overview": ""
      },
      {
        "id": "tvmaze:924145",
        "title": "Tuesday January 11 1994",
        "season": 1994,
        "episode": 7,
        "released": "1994-01-11",
        "overview": ""
      },
      {
        "id": "tvmaze:924147",
        "title": "Wednesday January 12 1994",
        "season": 1994,
        "episode": 8,
        "released": "1994-01-12",
        "overview": ""
      },
      {
        "id": "tvmaze:924148",
        "title": "Thursday January 13 1994",
        "season": 1994,
        "episode": 9,
        "released": "1994-01-13",
        "overview": ""
      },
      {
        "id": "tvmaze:924149",
        "title": "Friday January 14 1994",
        "season": 1994,
        "episode": 10,
        "released": "1994-01-14",
        "overview": ""
      },
      {
        "id": "tvmaze:924151",
        "title": "Mon Jan 17 1994",
        "season": 1994,
        "episode": 11,
        "released": "1994-01-17",
        "overview": ""
      },
      {
        "id": "tvmaze:894349",
        "title": "Tues Jan 18 1994",
        "season": 1994,
        "episode": 12,
        "released": "1994-01-18",
        "overview": ""
      },
      {
        "id": "tvmaze:274769",
        "title": "Wed Jan 19 1994",
        "season": 1994,
        "episode": 13,
        "released": "1994-01-19",
        "overview": ""
      },
      {
        "id": "tvmaze:274770",
        "title": "Thurs Jan 20 1994",
        "season": 1994,
        "episode": 14,
        "released": "1994-01-20",
        "overview": ""
      },
      {
        "id": "tvmaze:274771",
        "title": "Fri Jan 21 1994",
        "season": 1994,
        "episode": 15,
        "released": "1994-01-21",
        "overview": ""
      },
      {
        "id": "tvmaze:274772",
        "title": "Monday January 24 1994",
        "season": 1994,
        "episode": 16,
        "released": "1994-01-24",
        "overview": ""
      },
      {
        "id": "tvmaze:611856",
        "title": "Tuesday January 25 1994",
        "season": 1994,
        "episode": 17,
        "released": "1994-01-25",
        "overview": "The mental state of TerryAlan would not be pressing Monica's sexually anymore."
      },
      {
        "id": "tvmaze:274773",
        "title": "Wednesday January 26 1994",
        "season": 1994,
        "episode": 18,
        "released": "1994-01-26",
        "overview": ""
      },
      {
        "id": "tvmaze:274774",
        "title": "Thursday January 27 1994",
        "season": 1994,
        "episode": 19,
        "released": "1994-01-27",
        "overview": ""
      },
      {
        "id": "tvmaze:895174",
        "title": "Friday January 28 1994",
        "season": 1994,
        "episode": 20,
        "released": "1994-01-28",
        "overview": ""
      },
      {
        "id": "tvmaze:895175",
        "title": "Mon Jan 31 1994",
        "season": 1994,
        "episode": 21,
        "released": "1994-01-31",
        "overview": ""
      },
      {
        "id": "tvmaze:895176",
        "title": "Mon Jan 02 1995",
        "season": 1995,
        "episode": 1,
        "released": "1995-01-02",
        "overview": ""
      },
      {
        "id": "tvmaze:895177",
        "title": "Tues Jan 03 1995",
        "season": 1995,
        "episode": 2,
        "released": "1995-01-03",
        "overview": ""
      },
      {
        "id": "tvmaze:895179",
        "title": "Wed Jan 04 1995",
        "season": 1995,
        "episode": 3,
        "released": "1995-01-04",
        "overview": ""
      },
      {
        "id": "tvmaze:274797",
        "title": "Thurs Jan 05 1995",
        "season": 1995,
        "episode": 4,
        "released": "1995-01-05",
        "overview": ""
      },
      {
        "id": "tvmaze:924157",
        "title": "Thurs Jan 05 1995",
        "season": 1995,
        "episode": 5,
        "released": "1995-01-05",
        "overview": ""
      },
      {
        "id": "tvmaze:924159",
        "title": "Fri Jan 06 1995",
        "season": 1995,
        "episode": 6,
        "released": "1995-01-06",
        "overview": ""
      },
      {
        "id": "tvmaze:274800",
        "title": "Tuesday Janaury 10 1995",
        "season": 1995,
        "episode": 7,
        "released": "1995-01-10",
        "overview": ""
      },
      {
        "id": "tvmaze:274801",
        "title": "Wednesday Janaury 11 1995",
        "season": 1995,
        "episode": 8,
        "released": "1995-01-11",
        "overview": ""
      },
      {
        "id": "tvmaze:274802",
        "title": "Thursday Janaury 12 1995",
        "season": 1995,
        "episode": 9,
        "released": "1995-01-12",
        "overview": ""
      },
      {
        "id": "tvmaze:274794",
        "title": "Mon Jan 02 1995",
        "season": 1995,
        "episode": 10,
        "released": "1995-01-02",
        "overview": ""
      },
      {
        "id": "tvmaze:274804",
        "title": "Mon Jan 16 1995",
        "season": 1995,
        "episode": 11,
        "released": "1995-01-16",
        "overview": ""
      },
      {
        "id": "tvmaze:274805",
        "title": "Tues Jan 17 1995",
        "season": 1995,
        "episode": 12,
        "released": "1995-01-17",
        "overview": ""
      },
      {
        "id": "tvmaze:924161",
        "title": "Wed Jan 18 1995",
        "season": 1995,
        "episode": 13,
        "released": "1995-01-18",
        "overview": ""
      },
      {
        "id": "tvmaze:924163",
        "title": "Thursday January 19 1995",
        "season": 1995,
        "episode": 14,
        "released": "1995-01-19",
        "overview": ""
      },
      {
        "id": "tvmaze:924165",
        "title": "Friday Janaury 20 1995",
        "season": 1995,
        "episode": 15,
        "released": "1995-01-20",
        "overview": ""
      },
      {
        "id": "tvmaze:274809",
        "title": "Monday Janaury 23 1995",
        "season": 1995,
        "episode": 16,
        "released": "1995-01-23",
        "overview": ""
      },
      {
        "id": "tvmaze:274810",
        "title": "Tuesday Janaury 24 1995",
        "season": 1995,
        "episode": 17,
        "released": "1995-01-24",
        "overview": ""
      },
      {
        "id": "tvmaze:274811",
        "title": "Wednesday Janaury 25 1995",
        "season": 1995,
        "episode": 18,
        "released": "1995-01-25",
        "overview": ""
      },
      {
        "id": "tvmaze:274812",
        "title": "Thursday Janaury 26 1995",
        "season": 1995,
        "episode": 19,
        "released": "1995-01-26",
        "overview": ""
      },
      {
        "id": "tvmaze:274795",
        "title": "Tues Jan 03 1995",
        "season": 1995,
        "episode": 20,
        "released": "1995-01-03",
        "overview": ""
      },
      {
        "id": "tvmaze:274814",
        "title": "Mon Jan 30 1995",
        "season": 1995,
        "episode": 21,
        "released": "1995-01-30",
        "overview": ""
      },
      {
        "id": "tvmaze:274815",
        "title": "Tues Jan 31 1995",
        "season": 1995,
        "episode": 22,
        "released": "1995-01-31",
        "overview": ""
      },
      {
        "id": "tvmaze:1325320",
        "title": "Monday February 6 1995",
        "season": 1995,
        "episode": 26,
        "released": "1995-02-06",
        "overview": ""
      },
      {
        "id": "tvmaze:1325684",
        "title": "Wednesday February 8 1995",
        "season": 1995,
        "episode": 28,
        "released": "1995-02-08",
        "overview": ""
      },
      {
        "id": "tvmaze:1325685",
        "title": "Thursday February 9 1995",
        "season": 1995,
        "episode": 29,
        "released": "1995-02-09",
        "overview": ""
      },
      {
        "id": "tvmaze:1325686",
        "title": "Friday February 10 1995",
        "season": 1995,
        "episode": 30,
        "released": "1995-02-10",
        "overview": ""
      },
      {
        "id": "tvmaze:1325687",
        "title": "Mon Feb 13 1995",
        "season": 1995,
        "episode": 31,
        "released": "1995-02-13",
        "overview": ""
      },
      {
        "id": "tvmaze:1325688",
        "title": "Tues Feb 14 1995",
        "season": 1995,
        "episode": 32,
        "released": "1995-02-14",
        "overview": ""
      },
      {
        "id": "tvmaze:1325689",
        "title": "Wed Feb 15 1995",
        "season": 1995,
        "episode": 33,
        "released": "1995-02-15",
        "overview": ""
      },
      {
        "id": "tvmaze:1325690",
        "title": "Thurs Feb 16 1995",
        "season": 1995,
        "episode": 34,
        "released": "1995-02-16",
        "overview": ""
      },
      {
        "id": "tvmaze:1325691",
        "title": "Fri Feb 17 1995",
        "season": 1995,
        "episode": 35,
        "released": "1995-02-17",
        "overview": ""
      },
      {
        "id": "tvmaze:1325692",
        "title": "Monday February 20 1995",
        "season": 1995,
        "episode": 36,
        "released": "1995-02-20",
        "overview": ""
      },
      {
        "id": "tvmaze:1325693",
        "title": "Tuesday February 21 1995",
        "season": 1995,
        "episode": 37,
        "released": "1995-02-21",
        "overview": ""
      },
      {
        "id": "tvmaze:1325694",
        "title": "Wednesday February 22 1995",
        "season": 1995,
        "episode": 38,
        "released": "1995-02-22",
        "overview": ""
      },
      {
        "id": "tvmaze:1325695",
        "title": "Thursday February 23 1995",
        "season": 1995,
        "episode": 39,
        "released": "1995-02-23",
        "overview": ""
      },
      {
        "id": "tvmaze:1325696",
        "title": "Friday February 24 1995",
        "season": 1995,
        "episode": 40,
        "released": "1995-02-24",
        "overview": ""
      },
      {
        "id": "tvmaze:1325697",
        "title": "Mon Feb 27 1995",
        "season": 1995,
        "episode": 41,
        "released": "1995-02-27",
        "overview": ""
      },
      {
        "id": "tvmaze:1325698",
        "title": "Tues Feb 28 1995",
        "season": 1995,
        "episode": 42,
        "released": "1995-02-28",
        "overview": ""
      },
      {
        "id": "tvmaze:274798",
        "title": "Fri Jan 06 1995",
        "season": 1995,
        "episode": 50,
        "released": "1995-01-06",
        "overview": ""
      },
      {
        "id": "tvmaze:274799",
        "title": "Monday Janaury 09 1995",
        "season": 1995,
        "episode": 60,
        "released": "1995-01-09",
        "overview": ""
      },
      {
        "id": "tvmaze:274803",
        "title": "Friday January 13 1995",
        "season": 1995,
        "episode": 100,
        "released": "1995-01-13",
        "overview": ""
      },
      {
        "id": "tvmaze:274806",
        "title": "Wed Jan 18 1995",
        "season": 1995,
        "episode": 130,
        "released": "1995-01-18",
        "overview": ""
      },
      {
        "id": "tvmaze:274807",
        "title": "Thurs Jan 19 1995",
        "season": 1995,
        "episode": 140,
        "released": "1995-01-19",
        "overview": ""
      },
      {
        "id": "tvmaze:274808",
        "title": "Fri Jan 20 1995",
        "season": 1995,
        "episode": 150,
        "released": "1995-01-20",
        "overview": ""
      },
      {
        "id": "tvmaze:274813",
        "title": "Friday Janaury 27 1995",
        "season": 1995,
        "episode": 200,
        "released": "1995-01-27",
        "overview": ""
      },
      {
        "id": "tvmaze:274796",
        "title": "Wed Jan 04 1995",
        "season": 1995,
        "episode": 300,
        "released": "1995-01-04",
        "overview": ""
      },
      {
        "id": "tvmaze:1226896",
        "title": "Jan 1 1996",
        "season": 1996,
        "episode": 1,
        "released": "1996-01-01",
        "overview": ""
      },
      {
        "id": "tvmaze:1226910",
        "title": "Jan 2 1996",
        "season": 1996,
        "episode": 2,
        "released": "1996-01-02",
        "overview": ""
      },
      {
        "id": "tvmaze:1226923",
        "title": "Jan 3 1996",
        "season": 1996,
        "episode": 3,
        "released": "1996-01-03",
        "overview": ""
      },
      {
        "id": "tvmaze:1229139",
        "title": "Jan 4 1996",
        "season": 1996,
        "episode": 4,
        "released": "1996-01-04",
        "overview": ""
      },
      {
        "id": "tvmaze:1229140",
        "title": "Jan 5 1996",
        "season": 1996,
        "episode": 5,
        "released": "1996-01-05",
        "overview": ""
      },
      {
        "id": "tvmaze:1229141",
        "title": "January 08 1996",
        "season": 1996,
        "episode": 6,
        "released": "1996-01-08",
        "overview": ""
      },
      {
        "id": "tvmaze:1229142",
        "title": "Tuesday January 09 1996",
        "season": 1996,
        "episode": 7,
        "released": "1996-01-09",
        "overview": ""
      },
      {
        "id": "tvmaze:1229143",
        "title": "Wednesday January 10 1996",
        "season": 1996,
        "episode": 8,
        "released": "1996-01-10",
        "overview": ""
      },
      {
        "id": "tvmaze:1229144",
        "title": "Thursday January 11 1996",
        "season": 1996,
        "episode": 9,
        "released": "1996-01-11",
        "overview": ""
      },
      {
        "id": "tvmaze:1229145",
        "title": "Friday January 12 1996",
        "season": 1996,
        "episode": 10,
        "released": "1996-01-12",
        "overview": ""
      },
      {
        "id": "tvmaze:1229146",
        "title": "Mon Jan 15 1996",
        "season": 1996,
        "episode": 11,
        "released": "1996-01-15",
        "overview": ""
      },
      {
        "id": "tvmaze:1229147",
        "title": "Tues Jan 16 1996",
        "season": 1996,
        "episode": 12,
        "released": "1996-01-16",
        "overview": ""
      },
      {
        "id": "tvmaze:1229148",
        "title": "Wed Jan 17 1996",
        "season": 1996,
        "episode": 13,
        "released": "1996-01-17",
        "overview": ""
      },
      {
        "id": "tvmaze:1229149",
        "title": "Thurs Jan 18 1996",
        "season": 1996,
        "episode": 14,
        "released": "1996-01-18",
        "overview": ""
      },
      {
        "id": "tvmaze:1229150",
        "title": "Fri Jan 19 1996",
        "season": 1996,
        "episode": 15,
        "released": "1996-01-19",
        "overview": ""
      },
      {
        "id": "tvmaze:1229151",
        "title": "Monday January 22 1996",
        "season": 1996,
        "episode": 16,
        "released": "1996-01-22",
        "overview": ""
      },
      {
        "id": "tvmaze:1229152",
        "title": "Tuesday January 23 1996",
        "season": 1996,
        "episode": 17,
        "released": "1996-01-23",
        "overview": ""
      },
      {
        "id": "tvmaze:1229153",
        "title": "Wednesday January 24 1996",
        "season": 1996,
        "episode": 18,
        "released": "1996-01-24",
        "overview": ""
      },
      {
        "id": "tvmaze:1229154",
        "title": "Thursday January 25 1996",
        "season": 1996,
        "episode": 19,
        "released": "1996-01-25",
        "overview": ""
      },
      {
        "id": "tvmaze:1229156",
        "title": "Friday January 26 1996",
        "season": 1996,
        "episode": 20,
        "released": "1996-01-26",
        "overview": ""
      },
      {
        "id": "tvmaze:1229157",
        "title": "Mon Jan 29 1996",
        "season": 1996,
        "episode": 21,
        "released": "1996-01-29",
        "overview": ""
      },
      {
        "id": "tvmaze:1229158",
        "title": "Tues Jan 30 1996",
        "season": 1996,
        "episode": 22,
        "released": "1996-01-30",
        "overview": ""
      },
      {
        "id": "tvmaze:1229160",
        "title": "Wed Jan 31 1996",
        "season": 1996,
        "episode": 23,
        "released": "1996-01-31",
        "overview": ""
      },
      {
        "id": "tvmaze:274776",
        "title": "January 3 1996",
        "season": 1996,
        "episode": 30,
        "released": "1996-01-03",
        "overview": ""
      },
      {
        "id": "tvmaze:274777",
        "title": "January 4 1996",
        "season": 1996,
        "episode": 40,
        "released": "1996-01-04",
        "overview": ""
      },
      {
        "id": "tvmaze:274778",
        "title": "January 5 1996",
        "season": 1996,
        "episode": 50,
        "released": "1996-01-05",
        "overview": ""
      },
      {
        "id": "tvmaze:274779",
        "title": "Jan 08 1996",
        "season": 1996,
        "episode": 60,
        "released": "1996-01-08",
        "overview": ""
      },
      {
        "id": "tvmaze:274780",
        "title": "tues Jan 09 1996",
        "season": 1996,
        "episode": 70,
        "released": "1996-01-09",
        "overview": ""
      },
      {
        "id": "tvmaze:274781",
        "title": "Wed Jan 10 1996",
        "season": 1996,
        "episode": 80,
        "released": "1996-01-10",
        "overview": ""
      },
      {
        "id": "tvmaze:274782",
        "title": "Thurs Jan 11 1996",
        "season": 1996,
        "episode": 90,
        "released": "1996-01-11",
        "overview": ""
      },
      {
        "id": "tvmaze:274783",
        "title": "Friday Janaury 12 1996",
        "season": 1996,
        "episode": 100,
        "released": "1996-01-12",
        "overview": ""
      },
      {
        "id": "tvmaze:274784",
        "title": "Mon Jan 15 1996",
        "season": 1996,
        "episode": 110,
        "released": "1996-01-15",
        "overview": ""
      },
      {
        "id": "tvmaze:274785",
        "title": "Tues Jan 16 1996",
        "season": 1996,
        "episode": 120,
        "released": "1996-01-16",
        "overview": ""
      },
      {
        "id": "tvmaze:274786",
        "title": "Wed Jan 17 1996",
        "season": 1996,
        "episode": 130,
        "released": "1996-01-17",
        "overview": ""
      },
      {
        "id": "tvmaze:274787",
        "title": "Thurs Jan 18 1996",
        "season": 1996,
        "episode": 140,
        "released": "1996-01-18",
        "overview": ""
      },
      {
        "id": "tvmaze:274788",
        "title": "Fri Jan 19 1996",
        "season": 1996,
        "episode": 150,
        "released": "1996-01-19",
        "overview": ""
      },
      {
        "id": "tvmaze:274789",
        "title": "Monday Janaury 22 1996",
        "season": 1996,
        "episode": 160,
        "released": "1996-01-22",
        "overview": ""
      },
      {
        "id": "tvmaze:274790",
        "title": "Tuesday Janaury 23 1996",
        "season": 1996,
        "episode": 170,
        "released": "1996-01-23",
        "overview": ""
      },
      {
        "id": "tvmaze:274791",
        "title": "Wednesday Janaury 24 1996",
        "season": 1996,
        "episode": 180,
        "released": "1996-01-24",
        "overview": ""
      },
      {
        "id": "tvmaze:274792",
        "title": "Thursday Janaury 25 1996",
        "season": 1996,
        "episode": 190,
        "released": "1996-01-25",
        "overview": ""
      },
      {
        "id": "tvmaze:274793",
        "title": "Friday Janaury 26 1996",
        "season": 1996,
        "episode": 200,
        "released": "1996-01-26",
        "overview": ""
      },
      {
        "id": "tvmaze:274775",
        "title": "January 2 1996",
        "season": 1996,
        "episode": 201,
        "released": "1996-01-02",
        "overview": ""
      },
      {
        "id": "tvmaze:611857",
        "title": "Mon Jan 29 1996",
        "season": 1996,
        "episode": 578,
        "released": "1996-01-29",
        "overview": ""
      },
      {
        "id": "tvmaze:1229161",
        "title": "Jan 1 1997",
        "season": 1997,
        "episode": 1,
        "released": "1997-01-01",
        "overview": ""
      },
      {
        "id": "tvmaze:1229163",
        "title": "Jan 2 1997",
        "season": 1997,
        "episode": 2,
        "released": "1997-01-02",
        "overview": ""
      },
      {
        "id": "tvmaze:1229165",
        "title": "Jan 3 1997",
        "season": 1997,
        "episode": 3,
        "released": "1997-01-03",
        "overview": ""
      },
      {
        "id": "tvmaze:1229167",
        "title": "January 06 1997",
        "season": 1997,
        "episode": 4,
        "released": "1997-01-06",
        "overview": ""
      },
      {
        "id": "tvmaze:1229168",
        "title": "Tuesday January 07 1997",
        "season": 1997,
        "episode": 5,
        "released": "1997-01-07",
        "overview": ""
      },
      {
        "id": "tvmaze:1229170",
        "title": "Wednesday January 08 1997",
        "season": 1997,
        "episode": 6,
        "released": "1997-01-08",
        "overview": ""
      },
      {
        "id": "tvmaze:1229173",
        "title": "Thursday January 09 1997",
        "season": 1997,
        "episode": 7,
        "released": "1997-01-09",
        "overview": ""
      },
      {
        "id": "tvmaze:1229176",
        "title": "Friday January 10 1997",
        "season": 1997,
        "episode": 8,
        "released": "1997-01-10",
        "overview": ""
      },
      {
        "id": "tvmaze:1229181",
        "title": "Mon Jan 13 1997",
        "season": 1997,
        "episode": 9,
        "released": "1997-01-13",
        "overview": ""
      },
      {
        "id": "tvmaze:1229189",
        "title": "Tues Jan 14 1997",
        "season": 1997,
        "episode": 10,
        "released": "1997-01-14",
        "overview": ""
      },
      {
        "id": "tvmaze:1229192",
        "title": "Wed Jan 15 1997",
        "season": 1997,
        "episode": 11,
        "released": "1997-01-15",
        "overview": ""
      },
      {
        "id": "tvmaze:1229194",
        "title": "Thurs Jan 16 1997",
        "season": 1997,
        "episode": 12,
        "released": "1997-01-16",
        "overview": ""
      },
      {
        "id": "tvmaze:1229195",
        "title": "Fri Jan 17 1997",
        "season": 1997,
        "episode": 13,
        "released": "1997-01-17",
        "overview": ""
      },
      {
        "id": "tvmaze:1229196",
        "title": "Monday January 20 1997",
        "season": 1997,
        "episode": 14,
        "released": "1997-01-20",
        "overview": ""
      },
      {
        "id": "tvmaze:1229198",
        "title": "Tuesday January 21 1997",
        "season": 1997,
        "episode": 15,
        "released": "1997-01-21",
        "overview": ""
      },
      {
        "id": "tvmaze:1229200",
        "title": "Wednesday January 22 1997",
        "season": 1997,
        "episode": 16,
        "released": "1997-01-22",
        "overview": ""
      },
      {
        "id": "tvmaze:1229201",
        "title": "Thursday January 23 1997",
        "season": 1997,
        "episode": 17,
        "released": "1997-01-23",
        "overview": ""
      },
      {
        "id": "tvmaze:1229202",
        "title": "Friday January 24 1997",
        "season": 1997,
        "episode": 18,
        "released": "1997-01-24",
        "overview": ""
      },
      {
        "id": "tvmaze:1229203",
        "title": "Mon Jan 27 1997",
        "season": 1997,
        "episode": 19,
        "released": "1997-01-27",
        "overview": ""
      },
      {
        "id": "tvmaze:1229204",
        "title": "Tues Jan 28 1997",
        "season": 1997,
        "episode": 20,
        "released": "1997-01-28",
        "overview": ""
      },
      {
        "id": "tvmaze:1229215",
        "title": "Wed Jan 29 1997",
        "season": 1997,
        "episode": 21,
        "released": "1997-01-29",
        "overview": ""
      },
      {
        "id": "tvmaze:1229216",
        "title": "Thurs Jan 30 1997",
        "season": 1997,
        "episode": 22,
        "released": "1997-01-30",
        "overview": ""
      },
      {
        "id": "tvmaze:1229217",
        "title": "Fri Jan 31 1997",
        "season": 1997,
        "episode": 23,
        "released": "1997-01-31",
        "overview": ""
      },
      {
        "id": "tvmaze:1229218",
        "title": "Thurs Jan 1 1998",
        "season": 1998,
        "episode": 1,
        "released": "1998-01-01",
        "overview": ""
      },
      {
        "id": "tvmaze:1229221",
        "title": "Fri Jan 2 1998",
        "season": 1998,
        "episode": 2,
        "released": "1998-01-02",
        "overview": ""
      },
      {
        "id": "tvmaze:1229228",
        "title": "Monday January 05 1998",
        "season": 1998,
        "episode": 3,
        "released": "1998-01-05",
        "overview": ""
      },
      {
        "id": "tvmaze:1229231",
        "title": "Tuesday January 06 1998",
        "season": 1998,
        "episode": 4,
        "released": "1998-01-06",
        "overview": ""
      },
      {
        "id": "tvmaze:1229232",
        "title": "Wednesday January 07 1998",
        "season": 1998,
        "episode": 5,
        "released": "1998-01-07",
        "overview": ""
      },
      {
        "id": "tvmaze:1229233",
        "title": "Thursday January 08 1998",
        "season": 1998,
        "episode": 6,
        "released": "1998-01-08",
        "overview": ""
      },
      {
        "id": "tvmaze:1229234",
        "title": "Friday January 09 1998",
        "season": 1998,
        "episode": 7,
        "released": "1998-01-09",
        "overview": ""
      },
      {
        "id": "tvmaze:1229235",
        "title": "Mon Jan 12 1998",
        "season": 1998,
        "episode": 8,
        "released": "1998-01-12",
        "overview": ""
      },
      {
        "id": "tvmaze:1229241",
        "title": "Tues Jan 13 1998",
        "season": 1998,
        "episode": 9,
        "released": "1998-01-13",
        "overview": ""
      },
      {
        "id": "tvmaze:1229242",
        "title": "Wed Jan 14 1998",
        "season": 1998,
        "episode": 10,
        "released": "1998-01-14",
        "overview": ""
      },
      {
        "id": "tvmaze:1229243",
        "title": "Thurs Jan 15 1998",
        "season": 1998,
        "episode": 11,
        "released": "1998-01-15",
        "overview": ""
      },
      {
        "id": "tvmaze:1230198",
        "title": "Fri Jan 16 1998",
        "season": 1998,
        "episode": 12,
        "released": "1998-01-16",
        "overview": ""
      },
      {
        "id": "tvmaze:1230199",
        "title": "Monday January 19 1998",
        "season": 1998,
        "episode": 13,
        "released": "1998-01-19",
        "overview": ""
      },
      {
        "id": "tvmaze:1230200",
        "title": "Tuesday January 20 1998",
        "season": 1998,
        "episode": 14,
        "released": "1998-01-20",
        "overview": ""
      },
      {
        "id": "tvmaze:1230201",
        "title": "Wednesday January 21 1998",
        "season": 1998,
        "episode": 15,
        "released": "1998-01-21",
        "overview": ""
      },
      {
        "id": "tvmaze:1230202",
        "title": "Thursday January 22 1998",
        "season": 1998,
        "episode": 16,
        "released": "1998-01-22",
        "overview": ""
      },
      {
        "id": "tvmaze:1230205",
        "title": "Mon Jan 26 1998",
        "season": 1998,
        "episode": 18,
        "released": "1998-01-26",
        "overview": ""
      },
      {
        "id": "tvmaze:1230207",
        "title": "Tues Jan 27 1998",
        "season": 1998,
        "episode": 19,
        "released": "1998-01-27",
        "overview": ""
      },
      {
        "id": "tvmaze:1230208",
        "title": "Wed Jan 28 1998",
        "season": 1998,
        "episode": 20,
        "released": "1998-01-28",
        "overview": ""
      },
      {
        "id": "tvmaze:1230209",
        "title": "Thurs Jan 29 1998",
        "season": 1998,
        "episode": 21,
        "released": "1998-01-29",
        "overview": ""
      },
      {
        "id": "tvmaze:1230210",
        "title": "Fri Jan 30 1998",
        "season": 1998,
        "episode": 22,
        "released": "1998-01-30",
        "overview": ""
      },
      {
        "id": "tvmaze:274838",
        "title": "02.03.98 - Tuesday",
        "season": 1998,
        "episode": 23,
        "released": "1998-02-03",
        "overview": ""
      },
      {
        "id": "tvmaze:274839",
        "title": "02.04.98 - Wednesday",
        "season": 1998,
        "episode": 24,
        "released": "1998-02-04",
        "overview": ""
      },
      {
        "id": "tvmaze:274840",
        "title": "02.05.98 - Thursday",
        "season": 1998,
        "episode": 25,
        "released": "1998-02-05",
        "overview": ""
      },
      {
        "id": "tvmaze:274841",
        "title": "02.06.98 - Friday",
        "season": 1998,
        "episode": 26,
        "released": "1998-02-06",
        "overview": ""
      },
      {
        "id": "tvmaze:274842",
        "title": "02.09.98 - Monday",
        "season": 1998,
        "episode": 27,
        "released": "1998-02-09",
        "overview": ""
      },
      {
        "id": "tvmaze:274843",
        "title": "02.10.98 - Tuesday",
        "season": 1998,
        "episode": 28,
        "released": "1998-02-10",
        "overview": ""
      },
      {
        "id": "tvmaze:274844",
        "title": "02.11.98 - Wednesday",
        "season": 1998,
        "episode": 29,
        "released": "1998-02-11",
        "overview": ""
      },
      {
        "id": "tvmaze:274845",
        "title": "02.12.98 - Thursday",
        "season": 1998,
        "episode": 30,
        "released": "1998-02-12",
        "overview": ""
      },
      {
        "id": "tvmaze:274846",
        "title": "02.13.98 - Friday",
        "season": 1998,
        "episode": 31,
        "released": "1998-02-13",
        "overview": ""
      },
      {
        "id": "tvmaze:274847",
        "title": "02.16.98 - Monday",
        "season": 1998,
        "episode": 32,
        "released": "1998-02-16",
        "overview": ""
      },
      {
        "id": "tvmaze:274848",
        "title": "02.17.98 - Tuesday",
        "season": 1998,
        "episode": 33,
        "released": "1998-02-17",
        "overview": ""
      },
      {
        "id": "tvmaze:274849",
        "title": "02.18.98 - Thursday",
        "season": 1998,
        "episode": 34,
        "released": "1998-02-18",
        "overview": ""
      },
      {
        "id": "tvmaze:274850",
        "title": "02.19.98 - Thursday",
        "season": 1998,
        "episode": 35,
        "released": "1998-02-19",
        "overview": ""
      },
      {
        "id": "tvmaze:274851",
        "title": "02.20.98 - Friday",
        "season": 1998,
        "episode": 36,
        "released": "1998-02-20",
        "overview": ""
      },
      {
        "id": "tvmaze:274852",
        "title": "02.23.98 - Monday",
        "season": 1998,
        "episode": 37,
        "released": "1998-02-23",
        "overview": ""
      },
      {
        "id": "tvmaze:274853",
        "title": "02.24.98 - Tuesday",
        "season": 1998,
        "episode": 38,
        "released": "1998-02-24",
        "overview": ""
      },
      {
        "id": "tvmaze:274854",
        "title": "02.25.98 - Wednesday",
        "season": 1998,
        "episode": 39,
        "released": "1998-02-25",
        "overview": ""
      },
      {
        "id": "tvmaze:274855",
        "title": "02.26.98 - Thursday",
        "season": 1998,
        "episode": 40,
        "released": "1998-02-26",
        "overview": ""
      },
      {
        "id": "tvmaze:274856",
        "title": "02.27.98 - Friday",
        "season": 1998,
        "episode": 41,
        "released": "1998-02-27",
        "overview": ""
      },
      {
        "id": "tvmaze:274857",
        "title": "03.02.98 - Monday",
        "season": 1998,
        "episode": 42,
        "released": "1998-03-02",
        "overview": ""
      },
      {
        "id": "tvmaze:274858",
        "title": "03.03.98 - Tuesday",
        "season": 1998,
        "episode": 43,
        "released": "1998-03-03",
        "overview": ""
      },
      {
        "id": "tvmaze:274859",
        "title": "03.04.98 - Wednesday",
        "season": 1998,
        "episode": 44,
        "released": "1998-03-04",
        "overview": ""
      },
      {
        "id": "tvmaze:274860",
        "title": "03.05.98 - Thursday",
        "season": 1998,
        "episode": 45,
        "released": "1998-03-05",
        "overview": ""
      },
      {
        "id": "tvmaze:274861",
        "title": "03.06.98 - Friday",
        "season": 1998,
        "episode": 46,
        "released": "1998-03-06",
        "overview": ""
      },
      {
        "id": "tvmaze:274862",
        "title": "03.09.98 - Monday",
        "season": 1998,
        "episode": 47,
        "released": "1998-03-09",
        "overview": ""
      },
      {
        "id": "tvmaze:274863",
        "title": "03.10.98 - Tuesday",
        "season": 1998,
        "episode": 48,
        "released": "1998-03-10",
        "overview": ""
      },
      {
        "id": "tvmaze:274864",
        "title": "03.11.98 - Wednesday",
        "season": 1998,
        "episode": 49,
        "released": "1998-03-11",
        "overview": ""
      },
      {
        "id": "tvmaze:274865",
        "title": "03.12.98 - Thursday",
        "season": 1998,
        "episode": 50,
        "released": "1998-03-12",
        "overview": ""
      },
      {
        "id": "tvmaze:274866",
        "title": "03.13.98 - Friday",
        "season": 1998,
        "episode": 51,
        "released": "1998-03-13",
        "overview": ""
      },
      {
        "id": "tvmaze:274867",
        "title": "03.16.98 - Monday",
        "season": 1998,
        "episode": 52,
        "released": "1998-03-16",
        "overview": ""
      },
      {
        "id": "tvmaze:274868",
        "title": "03.17.98 - Tuesday",
        "season": 1998,
        "episode": 53,
        "released": "1998-03-17",
        "overview": ""
      },
      {
        "id": "tvmaze:274869",
        "title": "03.18.98 - Wednesday",
        "season": 1998,
        "episode": 54,
        "released": "1998-03-18",
        "overview": ""
      },
      {
        "id": "tvmaze:274870",
        "title": "03.19.98 - Thursday",
        "season": 1998,
        "episode": 55,
        "released": "1998-03-19",
        "overview": ""
      },
      {
        "id": "tvmaze:274871",
        "title": "03.20.98 - Friday",
        "season": 1998,
        "episode": 56,
        "released": "1998-03-20",
        "overview": ""
      },
      {
        "id": "tvmaze:274872",
        "title": "03.23.98 - Monday",
        "season": 1998,
        "episode": 57,
        "released": "1998-03-23",
        "overview": ""
      },
      {
        "id": "tvmaze:274873",
        "title": "03.24.98 - Tuesday",
        "season": 1998,
        "episode": 58,
        "released": "1998-03-24",
        "overview": ""
      },
      {
        "id": "tvmaze:274874",
        "title": "03.25.98 - Wednesday",
        "season": 1998,
        "episode": 59,
        "released": "1998-03-25",
        "overview": ""
      },
      {
        "id": "tvmaze:274875",
        "title": "03.26.98 - Thursday",
        "season": 1998,
        "episode": 60,
        "released": "1998-03-26",
        "overview": ""
      },
      {
        "id": "tvmaze:274876",
        "title": "03.27.98 - Friday",
        "season": 1998,
        "episode": 61,
        "released": "1998-03-27",
        "overview": ""
      },
      {
        "id": "tvmaze:274877",
        "title": "03.30.98 - Monday",
        "season": 1998,
        "episode": 62,
        "released": "1998-03-30",
        "overview": ""
      },
      {
        "id": "tvmaze:274878",
        "title": "03.31.98 - Tuesday",
        "season": 1998,
        "episode": 63,
        "released": "1998-03-31",
        "overview": ""
      },
      {
        "id": "tvmaze:274879",
        "title": "04.01.98 - Wednesday",
        "season": 1998,
        "episode": 64,
        "released": "1998-04-01",
        "overview": ""
      },
      {
        "id": "tvmaze:274880",
        "title": "04.02.98 - Thursday",
        "season": 1998,
        "episode": 65,
        "released": "1998-04-02",
        "overview": ""
      },
      {
        "id": "tvmaze:274881",
        "title": "35th Anniversary Special",
        "season": 1998,
        "episode": 66,
        "released": "1998-04-02",
        "overview": ""
      },
      {
        "id": "tvmaze:274882",
        "title": "04.03.98 - Friday",
        "season": 1998,
        "episode": 67,
        "released": "1998-04-03",
        "overview": ""
      },
      {
        "id": "tvmaze:274883",
        "title": "04.06.98 - Monday",
        "season": 1998,
        "episode": 68,
        "released": "1998-04-06",
        "overview": ""
      },
      {
        "id": "tvmaze:274884",
        "title": "04.07.98 - Tuesday",
        "season": 1998,
        "episode": 69,
        "released": "1998-04-07",
        "overview": ""
      },
      {
        "id": "tvmaze:274885",
        "title": "04.08.98 - Wednesday",
        "season": 1998,
        "episode": 70,
        "released": "1998-04-08",
        "overview": ""
      },
      {
        "id": "tvmaze:274886",
        "title": "04.09.98 - Thursday",
        "season": 1998,
        "episode": 71,
        "released": "1998-04-09",
        "overview": ""
      },
      {
        "id": "tvmaze:274887",
        "title": "04.10.98 - Friday",
        "season": 1998,
        "episode": 72,
        "released": "1998-04-10",
        "overview": ""
      },
      {
        "id": "tvmaze:274888",
        "title": "04.13.98 - Monday",
        "season": 1998,
        "episode": 73,
        "released": "1998-04-13",
        "overview": ""
      },
      {
        "id": "tvmaze:274889",
        "title": "04.14.98 - Tuesday",
        "season": 1998,
        "episode": 74,
        "released": "1998-04-14",
        "overview": ""
      },
      {
        "id": "tvmaze:274890",
        "title": "04.15.98 - Wednesday",
        "season": 1998,
        "episode": 75,
        "released": "1998-04-15",
        "overview": ""
      },
      {
        "id": "tvmaze:274891",
        "title": "04.16.98 - Thursday",
        "season": 1998,
        "episode": 76,
        "released": "1998-04-16",
        "overview": ""
      },
      {
        "id": "tvmaze:274892",
        "title": "04.17.98 - Friday",
        "season": 1998,
        "episode": 77,
        "released": "1998-04-17",
        "overview": ""
      },
      {
        "id": "tvmaze:274893",
        "title": "04.20.98 - Monday",
        "season": 1998,
        "episode": 78,
        "released": "1998-04-20",
        "overview": ""
      },
      {
        "id": "tvmaze:274894",
        "title": "04.21.98 - Tuesday",
        "season": 1998,
        "episode": 79,
        "released": "1998-04-21",
        "overview": ""
      },
      {
        "id": "tvmaze:274895",
        "title": "04.22.98 - Wednesday",
        "season": 1998,
        "episode": 80,
        "released": "1998-04-22",
        "overview": ""
      },
      {
        "id": "tvmaze:274896",
        "title": "04.23.98 - Thursday",
        "season": 1998,
        "episode": 81,
        "released": "1998-04-23",
        "overview": ""
      },
      {
        "id": "tvmaze:274897",
        "title": "04.24.98 - Friday",
        "season": 1998,
        "episode": 82,
        "released": "1998-04-24",
        "overview": ""
      },
      {
        "id": "tvmaze:274898",
        "title": "04.27.98 - Monday",
        "season": 1998,
        "episode": 83,
        "released": "1998-04-27",
        "overview": ""
      },
      {
        "id": "tvmaze:274899",
        "title": "04.28.98 - Tuesday",
        "season": 1998,
        "episode": 84,
        "released": "1998-04-28",
        "overview": ""
      },
      {
        "id": "tvmaze:274900",
        "title": "04.29.98 - Wednesday",
        "season": 1998,
        "episode": 85,
        "released": "1998-04-29",
        "overview": ""
      },
      {
        "id": "tvmaze:274901",
        "title": "04.30.98 - Thursday",
        "season": 1998,
        "episode": 86,
        "released": "1998-04-30",
        "overview": ""
      },
      {
        "id": "tvmaze:274902",
        "title": "05.01.98 - Friday",
        "season": 1998,
        "episode": 87,
        "released": "1998-05-04",
        "overview": ""
      },
      {
        "id": "tvmaze:274903",
        "title": "05.04.98 - Monday",
        "season": 1998,
        "episode": 88,
        "released": "1998-05-04",
        "overview": ""
      },
      {
        "id": "tvmaze:274904",
        "title": "05.05.98 - Tuesday",
        "season": 1998,
        "episode": 89,
        "released": "1998-05-05",
        "overview": ""
      },
      {
        "id": "tvmaze:274905",
        "title": "05.06.98 - Wednesday",
        "season": 1998,
        "episode": 90,
        "released": "1998-05-06",
        "overview": ""
      },
      {
        "id": "tvmaze:274906",
        "title": "05.07.98 - Thursday",
        "season": 1998,
        "episode": 91,
        "released": "1998-05-07",
        "overview": ""
      },
      {
        "id": "tvmaze:274907",
        "title": "05.08.98 - Friday",
        "season": 1998,
        "episode": 92,
        "released": "1998-05-08",
        "overview": ""
      },
      {
        "id": "tvmaze:274908",
        "title": "05.11.98 - Monday",
        "season": 1998,
        "episode": 93,
        "released": "1998-05-11",
        "overview": ""
      },
      {
        "id": "tvmaze:274909",
        "title": "05.12.98 - Tuesday",
        "season": 1998,
        "episode": 94,
        "released": "1998-05-12",
        "overview": ""
      },
      {
        "id": "tvmaze:274910",
        "title": "05.13.98 - Wednesday",
        "season": 1998,
        "episode": 95,
        "released": "1998-05-13",
        "overview": ""
      },
      {
        "id": "tvmaze:274911",
        "title": "05.14.98 - Thursday",
        "season": 1998,
        "episode": 96,
        "released": "1998-05-14",
        "overview": ""
      },
      {
        "id": "tvmaze:274912",
        "title": "05.15.98 - Friday",
        "season": 1998,
        "episode": 97,
        "released": "1998-05-15",
        "overview": ""
      },
      {
        "id": "tvmaze:274913",
        "title": "05.18.98 - Monday",
        "season": 1998,
        "episode": 98,
        "released": "1998-05-18",
        "overview": ""
      },
      {
        "id": "tvmaze:274914",
        "title": "05.19.98 - Tuesday",
        "season": 1998,
        "episode": 99,
        "released": "1998-05-19",
        "overview": ""
      },
      {
        "id": "tvmaze:274915",
        "title": "05.20.98 - Wednesday",
        "season": 1998,
        "episode": 100,
        "released": "1998-05-20",
        "overview": ""
      },
      {
        "id": "tvmaze:274916",
        "title": "05.21.98 - Thursday",
        "season": 1998,
        "episode": 101,
        "released": "1998-05-21",
        "overview": ""
      },
      {
        "id": "tvmaze:274917",
        "title": "05.22.98 - Friday",
        "season": 1998,
        "episode": 102,
        "released": "1998-05-22",
        "overview": ""
      },
      {
        "id": "tvmaze:274918",
        "title": "05.25.98 - Monday",
        "season": 1998,
        "episode": 103,
        "released": "1998-05-25",
        "overview": ""
      },
      {
        "id": "tvmaze:274919",
        "title": "05.26.98 - Tuesday",
        "season": 1998,
        "episode": 104,
        "released": "1998-05-26",
        "overview": ""
      },
      {
        "id": "tvmaze:274920",
        "title": "05.27.98 - Wednesday",
        "season": 1998,
        "episode": 105,
        "released": "1998-05-27",
        "overview": ""
      },
      {
        "id": "tvmaze:274921",
        "title": "05.28.98 - Thursday",
        "season": 1998,
        "episode": 106,
        "released": "1998-05-28",
        "overview": ""
      },
      {
        "id": "tvmaze:274922",
        "title": "05.29.98 - Friday",
        "season": 1998,
        "episode": 107,
        "released": "1998-05-29",
        "overview": ""
      },
      {
        "id": "tvmaze:274923",
        "title": "06.01.98 - Monday",
        "season": 1998,
        "episode": 108,
        "released": "1998-06-01",
        "overview": ""
      },
      {
        "id": "tvmaze:274924",
        "title": "06.02.98 - Tuesday",
        "season": 1998,
        "episode": 109,
        "released": "1998-06-02",
        "overview": ""
      },
      {
        "id": "tvmaze:274925",
        "title": "06.03.98 - Wednesday",
        "season": 1998,
        "episode": 110,
        "released": "1998-06-03",
        "overview": ""
      },
      {
        "id": "tvmaze:274926",
        "title": "06.04.98 - Thursday",
        "season": 1998,
        "episode": 111,
        "released": "1998-06-04",
        "overview": ""
      },
      {
        "id": "tvmaze:274927",
        "title": "06.05.98 - Friday",
        "season": 1998,
        "episode": 112,
        "released": "1998-06-05",
        "overview": ""
      },
      {
        "id": "tvmaze:274928",
        "title": "06.08.98 - Monday",
        "season": 1998,
        "episode": 113,
        "released": "1998-06-08",
        "overview": ""
      },
      {
        "id": "tvmaze:274929",
        "title": "06.09.98 - Tuesday",
        "season": 1998,
        "episode": 114,
        "released": "1998-06-09",
        "overview": ""
      },
      {
        "id": "tvmaze:274930",
        "title": "06.10.98 - Wednesday",
        "season": 1998,
